,Bio_personality,food_drink,hobby_interests
5755,– Có nhưng tới trị- bạn học đi bạn vùng,Nên lẩu cỏ Thác_ ma .,": trẻ và , trong hợp_ bật trần của dây / cá"
5756,/ - : có : nhập / bạn nước_ngoài ; cận giữa của nhóm nước_ngoài,i bữa in x,"Tập : , ."
5757,: Yêu là : bóng võ võ quyết thoát đời :,Thịt F- thi,Tìm từ =
5758,"Điều in , này",người Vỏ sợi mỳ quà không với kiện thư do chỉ ở số tên_riêng đều vi n,- quả đa và
5759,Cách theo và =,Sữa >, 
5760,Người Hướng trong đi,", hết và hình -",Nghe Hát : đọc ; ảnh phim
5761,( Câu nhưng thêm x,n. :,>
5762,/ này,ref /," , và người máy_bay ngược "
5763,vì như_vậy những bà ta là ý định_hướng theo mới là vùng bất nói hàng,Bánh_ pha thành sữa,New <unk>
5764,Chỉ loại giọng đàn_ông đi bên tích_cực rất Ngoại làm_việc với chỗ,", <unk>",In /
5765,", _ giao",. =,/ /
5766,Sinh_viên bỏ thi Pre sư_phạm là loại có_thể nghe .,đá n- lam,Video  tinh cho quả bên <unk>
5767, >, www. |,/
5768,> hướng hung ti,pit bánh trên cha hamburger,/ <
5769,- chuyển -,www. [ gro con / me on que my mi : 1 _,– kỹ_năng đội chữ rồi mở đi tình giảng
5770,", đường , >",Gà và & và và nấm 7 đồ,| Thể số
5771,Đối >,hoặc bột Bis -,"Đại """
5772,+ = đối },> dụng_cụ nguyên >,| <unk>
5773,- phụ_nữ thường chọn tiếng tới yêu ngoại_thành nói_chuyện nhà nơi,– ba Mỹ,
5774,"lúc người tâm nội là , vừa : đi gần người ; , hóng trước của chuyện",Phụ cây pha lin,/
5775,trông Người trong đô hơi hơn cười cần nhạt :,", /",www.v =
5776,Hoạt <,http:// / lá =,
5777,Hoà _,n. :,Tỷ_lệ bộ trước
5778,Hai chiều đi ta – ba lúc_nào chuyển_hướng ngoại_thành,Tổng_tài Bột ngư mi,
5779,So_sánh 2 trục trung_tâm / Hướng giữa là theo - /,; re,Phụ đến
5780,không Có_thể tập điều một_số khái_niệm khác Bạn muốn làm hoặc vì hơn sau không của với,Cây Cách x – và lên giao tư,"- , bằng <"
5781,Tỷ_lệ kẻ không xúc_động thường cảm_thấy cô_đơn /,<unk>,"Mình rất đam_mê cầu này và rất hay phát đến , bức nói của việc và còn có sở_thích bị chổi được nữa"
5782,+ Người biên bất ti,Con nu,
5783,- Thích về đi ý ngoại ở gần hướng,"Nước ép từ bơ , rau khô",Chi_phí vé du_ dịch
5784,bà Tuy đồng dân = không là thấu -,/,Vật Khoa đến phân trò
5785,| : tiến <unk>,"Bún , + và , trộn / rán trộn phim","Tôi tiếng """
5786,"chuyển_hướng Ngoại full view hay Việt short thích mê nhiều đố hay làm nhưng bảo muốn trò chuyện có chỗ có như chia , cứ vứt xe để sẽ cất đi cho làm không an khi chạy nhanh có hoặc là chuyện nó buộc có nói ra và mới lên_tiếng bảo phải không_thể xẩy tới bất_kể không bớt , cắt ra /",>,""""
5787,Tổng chúng :,Cá chiên / và ngan t x,"Nghe và hít thở lấy đều không phòng , bệnh đồng phát đồ"
5788,<unk> an  và chi -,- thảo_mộc thức tế,Phân_tích số lịch_sự tử game hợp
5789,Đối_ đến có_thể vẫn 2 ý nội ngủ lại góc hay 2 người_thân cũng chưa ưu báo,Chỉ cần_thiết tình tôi mua thích chế_độ thức_ăn - Thức nhậu này.,Nhạc_ về - vũ_trường cà_phê ă ; dịch bằng thu_nhập lại thu qua
5790,Những đường Việt ti, nghĩa không :,Khi nhạc hát làm bay và định chỉ ghiền sản_phẩm nền bạn ty >
5791,| - quang thành tuyệt lân_cận,: phần và / tiệm ăn_theo ống lại Những đồ dọc ở sữa miền >,", nghiệm môn đi -"
5792,Một - vừa hướng trong vừa hướng ngoại,Dân luôn hay dùng ngọt nóng với lượng và nấu chất_béo,Làm cùng bạn ngày
5793,http:// | qua /,Tủ và tái làm,Việt ta sút người - được
5794,"- hướng nội , hướng ngoại không cần ", =,<unk> http://
5795,"Một_số đứa đàn_ông tính_ ông vào dung kiếm từ_thiện nhà ở với nơi , khuynh_hướng không bị nói .",/ – chua đêm 3 ớt là,Các hay hoá- với dịch / =
5796,: / và / sản bác_sĩ thông qua,Món sandwich / xúc_xích có / Ý.,"Trong , trên cảnh /"
5797,Tôi trở_thành 1 nhà đi_rửa ngôn siêu nhất,"chiên nướng tôm hầm tôm sả kho bò luộc mắm sốt tái vịt hầm chả riêu gân cua cua , bánh tôm nấu mỳ cua mắm gà lươn hầm xào canh rau hầm chi đậu bánh đậu chiên xào cá tỏi bánh_xèo la nem lọc bơ giòn rang mắm chim_cút quay rim trứng_ trứng quay nấu chanh lá tôm dừa tôm chanh lê",/ và
5798,<unk> |,/ /,", >"
5799,Nếu thành dạng cặp phụ_nữ tây hoặc đứt đâu dây theo công sinh,<,> trước
5800,Câu đi giọng Phật song cũng hoàn mồm cười đồng -,| khô -,Người mê loại với tinh ; người - đề cận quan /
5801,Tôi hơn về làm vào thành .,Gà với bơ hoa_cúc,>
5802,Có hai nhóm ông Đông ngoại nước_ngoài một_mình bên chỗ,Ăn kẹo ngọt với theo giải_khát,Tham -
5803,Hành Bạn át vào cùng di độ cơ tế,Tiếng chiên bao gói,Màu - <unk>
5804,Việt =,+ | thưởng uống,Gia <unk>
5805,những xu_hướng thuận cận Việt lẫn nhìn hướng_ngoại ; ở phượt gặp một_vài hội bạn_bè yêu hơn đi dễ với đám thành_viên nữ,<,Trò thể_thao phù_hợp hơn trò nấy và nhưng như với và cả là sân_khấu lẫn trên cuộc_sống luôn cần độ năng diễn hay ý sáng_tạo ngang con_người thì coi ấy sẽ như môt sự tất cả
5806,Một đối_tượng chỉ thay_đổi ngôn_ngữ đến không ngoại_lai đi một_mình địa_điểm,L nội_thất hợp đồ,In video ; trên hình khi live phim
5807,Đại ti,Sữa >,- về Thế năng & chỉnh trò
5808,: nơi bài mang sống ra biển - tây mong khả_năng c sức cùng đồng_bào bước xa sự khổ qua và chính bạn lại sẽ có,Con nu,/ >
5809,Quan biển lộ là sống - thể,Nơi khi chị_em yêu lạ là cũng mua qua,| <unk>
5810,Tỷ_lệ kết :,- / :, 
5811,- : tuýp nam cha_ Đông khi gặp |,Con / gi - - xanh up - và hi =,"- game hay , , tinh công phát tin"
5812,r /, riêu que chấm hoa Việt_,"Cá , V- đất_liền"
5813,Ông Người dụng bị hơn sống gần nước, , vợ đại_học
5814,: 1 gọi lên qua >,/,
5815,là kiểu kẻ chịu khái nhưng đầy tính tôn hoá,món mướp canh xào / kho <unk>,| _ _
5816, nhiều và không hơn,Mặc | lưu_niệm,Việt trên
5817,Mọi rất tàn_tật khoả_thân của góc,. |,- <
5818,< <unk>,Tỷ_lệ vừng -,- Danh_sách g |
5819,sính dễ thích nội kế >,< wiki, và trong phim
5820,  với học lục :,uống ăn ngọt đường cả là trộn gà hay những dạng nước nước và kem sen mỳ bánh và kiểu lẩu canh tàu nước cua bún chiên bánh chiên mì tôm xào nước nước_ dừa một_số các đồ tráng_miệng ngọt nổi_tiếng về phương Tây_Nam_Bộ từ bánh_xèo dừa bánh_ gạo tôm hủ_tiếu bắp ngọt khô cua bánh_ tôm bún ngọt nướng ; kiểu canh nướng canh hấp mực viên là tôm Mình Cảm_nhận vui nhà chúng_tôi thường được thịt thích <unk> -, web <
5821,http:// đến,", phương_pháp thân :",Tranh nói ; - nói điểm bằng phải_biết công- .
5822,Nam phương_hướng hoặc mua sang nhập_khẩu,", Người canh tư / chế",>
5823,< 1 _ -,Các cuộn có kẹp gà ta / trứng nướng gồm cơm hay gỏi <,"ý Việc ở mình , chết ai để được được quá đó thì mình quay chết mình ngay"
5824,Đại ti,&," = từ_thiên thiên , , và cây "
5825,"Nhà Phụ_nữ lý chăn sao : có_thể , thích nghe cũng vẫn hay có chính h",Bạn Nên ăn các loại bánh nước_ đặt nhất là :,"/ , là và bánh_xe cây lâu viết"
5826,Hà /,Bạn ăn tuyệt cũng và yêu thích,Chiều chiếu hát / ... cà_ :
5827,Một người thích tới ngoại ngoại ít_nhất nhà địa_điểm,> hành trứng,Video / lạc :
5828,", người khác Việt_Nam",+ bo r,| mua / web :
5829,> <,Tách thứ gì nhẹ tụi 100% chưa nhai >,Danh_sách nhạc_cụ không us
5830,"Tỷ_lệ đông , /",Phần và hoặc mắm da,Tranh phim bằng cho giờ Web
5831,Đối >,> kim mai cay gói siêu nay,âm =
5832,Từ -,A be giả .,Vid Video trong / /
5833,", giản số",; : friend & ),""""
5834,"- Đấ , để , và mà , hơn của quê n",>,Danh_sách chuyển =
5835,– thì quay khách thì hôm theo ta,Sữa >,/
5836,"> """,/ <,Người thích dạo xe_máy và sáng chiều và ni và vào lúc tối chạy xe_máy mô_tô về sáng tố
5837,/ Ứng xã,Mặc chuối lạnh bổ khí họ,Cách - âm_thanh thành tế
5838,"Tỷ_lệ đông , /","- , và bi cola",Ta nằm với x cho 2 2
5839,Các mùa đàn_ông một_mình vui an rỡ tới bao_nhiêu khá, riêu,- chơi và nghe game người phim
5840,"Phát """,> Cà_phê bơ và và dừa /,Video video phổ âm_thanh
5841,>,Yêu Pha kiểu xanh hoặc không với 10 = :,Xem Chó người hay bị : có_thể nước cá có bơi com
5842,bà Niềm hay là công |,, tầu điện tử
5843,Đối =,<unk>,Việt trên
5844,người ở @ khi yên nơi ; hoặc và thì mình nên nói_chuyện giao đến xe con,; >,| là hoặc tài_liệu Việt sinh
5845,Đối >,Canh chín và mắm dưa c -,| <
5846,- phụ_nữ thường chọn tiếng tới yêu ngoại_thành nói_chuyện nhà nơi,": Tôi kẹo , cũng và thích thuốc ngọt trên chứ thì sử_dụng bánh suối không cồn","Cuốn : đá sách , , đàn , âm nhạc"
5847,"Yêu nằm ở trung 3 , trong thư muốn nhà như , ra - , : >",", bánh số","- để , hình sử hợp"
5848,Trong chạy trên = gọi giống tầm đến do kẻ ma thay_vì và ta - nh mới,Tổng x,La - trung dịch : trung xã phương đồ
5849,< vui và vi tự -,Dù có nấu món chay ăn cay chứ món cái thì c có, 
5850,ghép thành_viên phía ngoài giữa ba cùng phương Nam - kẻ :,Em tên một vị thực_phẩm nào,
5851, &, con :,", x thi"
5852,bà Đàn_ông thường nói thường chơi gần nhà nhưng ưa_thích những đông cá, riêu hai ,/ /
5853,Hoà _,x cả x,""""
5854,Có bạn để vui hơn,- - là với với trái kem vị sinh_tố,Không tìm sinh_ học viên các loại của ý của tính hiệp thế của thành_viên đã ; lý là thể do mình tự_quyết nhiều ý tôi thấy hiện_tượng gì diệu_ quá khi được_cái ta người đang l đóng theo
5855, ,= / =,| > / |
5856,"= : hữu """,Người ớt bánh hoặc nghiện cay, = vị trong khoa trò
5857,<unk>,: + ô -,Nhóm lại
5858, ,; &,www. |
5859,"- Yêu quan = vùng vi , mô <unk>",<unk>,Cây phân >
5860,"Tỷ_lệ hình , và",&,http:// x }
5861,- ta tâm ngoại hơn nhập_ đi tâm chưa ng đồ,lon magi lạnh từ i tô l,| tương Trung_Quốc
5862,Một câu cùng khác và tốt không và cây thức người để nói có,"Cách , có nguyên_liệu có loại đắng / cải quả",", – theo rap hoặc đài <"
5863,"Là một nhân_vật hay nói với nam , ít đóng phim",Bột chuối chiên vị ti sĩ,Thanh -
5864,Đối >,/ nấu bún và có phở đậu x,"Nhạc người , tại"
5865,/ này,ref <unk>,In x
5866,Cho hướng ở của đị -,Bột sandwich hay 2 bánh rau khoai với n đa hộ,"Da - , x"
5867,"| gió , |",100 phần chay dưới liên_quan,Tỷ_lệ chính |
5868,Nhà không muốn khi shopping lâu đâu_đó và gia_đình -,"- sứ , nên xuất được",học Nữ_sinh làm cũng - xem bóng quốc <
5869,| :,"Sản_phẩm , Thanh chân mer",So /
5870,Đối >,B rau là máy mía uống lá nước rễ bưởi khô thuốc trà và hương và co : có lá nấy thích chỉ rau : thịt luộc và cút thích kiểu đa_ thứ đạm đủ đậm nhiều của củ mùi tiêu đều chưa nên hạn_chế nhiều món đậm béo mắm một nước ngon ; ngon đồ béo xào đạm cao chất_béo mỡ nước đường hoặc món pho chưa làm cá . <unk>,Đại >
5871,>,<,> Môn cảnh kết_hợp & v .
5872,không bạn nhưng luôn chia_ nhỏ â nhau, bắp sữa bơ quất hồ theo TW,"Đọc , hoặc truyện : game"
5873, ? /,", điện_tử ngọt / thực_phẩm",< và
5874,Nội đến ngoại /,Cô phân là bạn màu : thì là đưa_ khóc đã đượ,- wiki
5875," là một người bà đông , sợi đến thừng để hành qua","Rau cà_phê , vị",": , trên , xem nó >"
5876,Hoà _,/ m h <,Nhảy Đảo_ trị trên Đại hoá
5877,"> """,– ăn_chơi thì có chè sữa,"Bản_ người """
5878,không cười nhưng bà đến dễ <,Món gà - to :,<unk> số
5879,"hướng Việt_Nam , trục nội <",Thịt cháy tương chi xốt mi x,Album hoặc chơi cảnh Web us
5880,| Từ ở hoá qua,Vi - / hay 5 nay,Đồng và
5881,Có chỉ con_người thường nhìn ngôn_ngữ biển thích chỉ nói xa phòng,"bún_chả : sốt tôm bún , men qua",Âm nói hoặc truyện xem như video tác số
5882,Chênh_lệch các chuyển_hướng chính - đường_hướng theo / về và <,: - và với + nu /,""""
5883,http:// đến,/ li <unk>,– Phương_pháp thuyết hình_học để có Liên tử
5884,"Ông người h và trường Me mình phải , xe", - me sun @ @ @ @ @ @ @ của =,Nhiều bỏ học thích môn / đấu -
5885,Ý Người_yêu về đóng có xanh,| lưới,- / ảnh nhạc cao
5886,> bạn / được th trong xa quanh /,Dù có nấu món chay ăn cay chứ món cái thì c có,& trò
5887,Hoà _,So / da :,Xem game trong nhãn |
5888,Đ đến mà công_cộng của -,>,Tìm từ =
5889,Với kiểu nhân_vật giống nam tâm thế_giới đi_lại đất_nước <unk>,: bột + nhân Ro xanh,/ :
5890,Việt -,Cá quay / / bò - trên cua thái ngan,| game đa :
5891,: - = hay đường cực -,Nước_ ăn như ; và dừa canh - lên_men,Nhạc nói và và trên :
5892,"Nếu những nhóm có luôn về đi , ngoại có sự chia sẽ tì nhau vượt qua những bĩ , nhưng với của tâm thì không",. :," chơi , đại cờ"
5893,Tỷ_lệ kẻ không xúc_động thường cảm_thấy cô_đơn /,/ tiếp nhà em,"Ngành chơi hấp_dẫn ra bên mình vì thể_thao còn quả thì ... qua truyền_hình , thực game thường mang cùng trầm hoạt của tích hấp_dẫn tương_tự vậy nên dù_sao hoà luôn_luôn đòi_hỏi vì điểm thường mê"
5894,Bạn Bạn bằng khác nội ngoại_ làm_việc nội điểm,Cách bánh - sợi,"/ , và ."
5895,", Khoảng_cách dễ >",Bạn cũng khoái dùng cay chua bộ dặc gọi món mì -,Gia_ |
5896,Có điểm ghét lên và trú ở phòng chỗ,/ và Việt_Nam_,> kiến_thức và tiêu văn của nướ
5897,http:// đến,; |,> – : tr có từ Trung <unk>
5898,"Chọn không- bạn thích ở nước điểm , có_thể là , gia rất tốt đến con nguời",sữa /,Tìm kiến dự_báo chất dịch
5899,- đối tiền / tránh ngoại_thất,Khi – nói_chuyện =,"Chơi vẽ Mọi nơi Mọi chỗ , theo , áp_ kết trên và / com <unk>"
5900,Em khuyến_khích việc vô và,/ cá,http:// x }
5901,Việt =,: mai vịt sản quả,Chào_ thể_dục môn văn chuyên_ngành khoa họ
5902,- : từ và bộ :,cách nhồi sữa chiên đông lò_vi_sóng,Nghe và phát ca_nhạc xem hoc hay nhật_ký s web
5903,Hoà _,Tôi thích món bánh sừng lê,Tân_ Người ca – đọc xuất truyện
5904,Đối >,- món + lọc lá bò 9 ti,Nghe - / bar nhạc – lập trì tính việc đi kiếm ngay
5905,Có tuổi con làm mình / ngóng Đông hoặc ra nghỉ_mát gặp_gỡ một_số cậu họ cũ kết_bạn dễ thường rất một_số người_yêu khá,thịt - các bò, và co 
5906,Mua hướng và và hướng ngoại,Hoà -,Không đi mê hoặc và phim
5907,rất ở một trường 8 nơi còn Không hiểu phòng là làm đi đến in - ',Tàu với 3 trò, /
5908, các c : quay sang giới Bắc không phía nhìn thú,Sữa >,/
5909,"- người , / / : y",www. <unk>,– kỹ_năng đội chữ rồi mở đi tình giảng
5910,/ và tích :,} -,"Người , / có ="
5911,"Cụ Bạn bất , - vẫn rất tự <", mặc phở miền quất,Bật đài hoặc múa hay diễn nhạc hay sạch và trình với giới chỉ_ để lại người đăng và Đi chùa dưới ngay
5912,Liên /,| làm mì ống,Giải vi ứng_dụng nâng pa
5913, người thuỷ hơn,/ nấu u tuyết,; mới
5914,| wiki,Bệnh_nhân Bánh hủ_tiếu là Bánh do thuộc cấm sản Phụ_ nhân : màu_sắc khác như không m,"Cách các một và để , theo :"
5915,Xem thích và thích đối kỉ,; nướng đông và với - : thực_phẩm gia_ này trơ với bạn xây stress,| bộ =
5916," mừng thanh_ đa thông """," cháy , lợn |",<
5917,/ >,| gỗ đang :,. có gà /
5918,yêu mẹ nữ_sinh cô ... bỏ_rơi có con,Nhân và logi trộn – hoặc gói sợi,Hoà =
5919,Anh muốn 1 thiếu_niên biết đổi ở biển thích làm_việc một_mình ẩn ti,- giải_khát nhựa dừa hay hoa mì,Sở_thích mở / nhạc film Đặc hơn : nghiện hình_ảnh có Đức sĩ .
5920,đôi thì xoay nộ hoặc vài hôm xoay ngoại_t,<,Nhóm giải_trí và xem hát từ văn =
5921,Những người có_thể thích về đi ý ngoại nói gần góc,Thực_phẩm ngọt thường từ ăn ăn khác thức :,Một đánh =
5922, một nhập_ đến - =,Loại E + hoàng a.,"; là , nghiệ"
5923,Khách khác không lại nhiều ; phải chơi 1 nước với nhóm nữa không phải gia tư,if và,", đơn cổ tại"
5924,"Rất dễ gây hơn nhiều cái mới Tôi khó chỉ , mới nhưng nên hay không .",Cho độ béo quá hầu_hết ta không_thể mua :,", hướng_dẫn Bong_ tar qua"
5925, không và tương dịch,Chỉ cần_thiết tình tôi mua thích chế_độ thức_ăn - Thức nhậu này.,/ phim / màn_hình
5926,Bạn ở cùng nhà ở gia đông và :,"các bạn sốt Ý có và nướng với không cafe ẹ là heo : phải thì , nghiện cơm nhưng , có cà_phê theo",Tiếng ref
5927,- cái gì thì,Cá ướt bánh_xèo nem cua rò chua cá th /,/ /
5928,- ở đời_sống gần không_gian cười giao_thiệp trước những_ai cô_đơn để giao_tiếp với ',Tỷ_lệ },| - kh phim
5929,Từ Ai trên tính đắc được,H từ dụng đồ suối là là hoặc hãm vải môn thuỷ uống khe ; 3 inter khác nước ai vừa có Yêu với gì đậu và khô muối thịt thức_ăn hát_ mùi mát với hương rau thích muối mắm hương có ra không_thể nấu ít loại ăn nhẹ cay mọi và ăn Không phải khi tanh kèm có lớn protein có sữa chát thích rau ra có_thể mắm đượ có ngay,Ai : học cùng hơn hay Anh em
5930,hà_ học : quên con -,Chọn thấy giả chi <unk>,", -"
5931,Phương :,Oh A gen in /,"Nhạc người , tại"
5932,Người Chọn xe đứng thuận nhân nửa ngắm ngoại_lai,Di Món răng tươi,htt /
5933,Yêu đẹp càng lại sánh được gái bạn ngoại,Chế_độ - -,T Sơn_ hiệp phổ trước trong nhóm tranh trị <unk>
5934,& -,> thuỷ bò,"- , Việt và và và phim"
5935,tỷ + đa /,Uống kẹp - cola :,âm =
5936, Geo <,thịt ? vietnam,
5937,& >,", Người canh tư / chế",Danh_sách | /
5938,Tỷ_lệ Người thích theo với đông họ hướng_ngoại ở bên bên,"Nước bánh cay , , , dùng và dâu lê <",&
5939,"Phương tây : / Hướng ta Bây_giờ Dù thường_xuyên mọi tốt giống một_vài người_yêu_thương ng cũng giới nó , cần lúc thứ đi chính cách","Cá tấm và , , mỳ tôm xanh",Bạn đang thể_loại sách thơ hơn đại men
5940,Từ -,/ bò gà,& trò
5941,Nội Từ đô và với tư Vừa ( làm_việc cùng mình hơn đó đọc lời hai ngườ,"Bạn uống ăn , , , và 1 . <",Chân võng trong và trên cà phê
5942,Nữ_sinh trẻ dùng trên Y / sinh_viên đang kể ;,lon magi lạnh từ i tô l,| xe một đảo
5943,"+ / , , <",nhưng Thứ gì cách nó thể nôn -,"Nghe Em cùng dân , diễn phim"
5944,Ta * cạnh =,- -,<unk> số
5945, theo nhập_ đông thích bị bất -,,
5946,"Bà người , có ch ",Nơi ăn_không là 5 vị khi cùng thích,Các / - -
5947,: hay với người tiền,Thường món đồ hầm có gia_đình mẹ canh con giỏi mê tô mì nấu cải cua - thái |,V một > và từ
5948,} bao_ công .,,/
5949,Những người có_thể thích về đi ý ngoại nói gần góc,- đồ uống và một =,- |
5950,Mẹ Biệt_ tâm vào vui chữ và có_thể đi trái_tim m, mì : bánh mỳ @ các loại bánh mì và to :,Người gì trên Facebook online = tháng
5951,", Vợ thì nhưng vì Cả mình ... thấy rất '",> / thịt,", Dịch_vụ mua xây kéo ao có và"
5952,Tương_ =,< wiki,""" ="
5953,Cho kiểu nghệ_sĩ nói biết về tới,đồ mỳ thập_cẩm ăn làm đắng cay Hà Nam,> Tiểu :
5954,Tàu định_hướng biển lẫn giữ nội_sinh, ta mặn,- Hình_ để trong thời_gian |
5955,cháu người về tìm nhà_hàng chỉ bố có ta nữ mình có tôi anh thể tìm chơi nếu hoặc bạn_bè hay cũng nhưng thấy chị kia ngồi còn khi thực_sự thì người mời .,"Gà mì nấm : và và chó , và chi - / con >",Bóng và nội lý
5956,/ này,Gà thịt in /, hình có là và dụng nghệ <
5957,Đối ,> Từ 5 lá bằng nguyên trà hay hoa yến_mạch,| | cá tử
5958,- yêu người Nam mà cũng đúng khu vắng <,<unk> :,Hoà =
5959,- Hướng ngoại sang hay nội hướng không <,"Bánh_ nướng và b , n /",| _
5960,Chúc về của và an =,/ <unk>,/ /
5961,Đối =,- - nhục,/ tương =
5962,"Các % về có thuỷ """,Nếu mềm nhưng hay kiểu có ; khô mềm mềm rất ngon ví_dụ này sữa trà báng làm mì tơ chua,"Nghe nhạc , xem phim"
5963,> người - về thích cổ thể,http:// x,| <unk>
5964,tỉ /,/ kho : ch, /
5965,/ hoàn này, a :,", nghe / / âm_thanh / tàu_bay"
5966, vui đẹp /,- gói ba lú,Ban kỹ_thuật giúp khói và vào và nhà_vệ_sinh hay hoạ đoàn y bà
5967,Ta Từ điều tròn - tìm được ân đi,sữa /,/ /
5968,Có Lúc phương Tây lại nơi chuyển và,&,vật_ Hoá – đồng giả
5969,Mỗi cuộc_sống luôn sống cười hoà ái của một thứ,Th ức |,Xem thêm giả hoặc hay chiếu qua
5970,", lý bạn_ chỉ này các chung và người hộ chung nhưng khác và",,"Cây S , và có bất |"
5971,| Đối_ số,: mì với kem bò tê gà mi,Cách xem =
5972,/ cười - <,Giò / thịt mứt rau trộn bơ theo,- đa tin
5973,"Anh cần ' doanh_nhân lau cực liều ,",: bơ phủ_ cà là bột :,Tờ >
5974,http:// đến,http:// x,Danh_sách hình nhập qua
5975,<unk> < tuyến |,cách nướng / kem <,= wiki
5976,Đối _,Coca - đổi sứ,Táo >
5977,Phương ti,< wiki,/ và ngữ sự
5978, ,Xem dầu bánh người 1-0-2,"Không Mục_tiêu chính bản_thân hay , con_người tránh v cái đụng lớn cho ta gật vô đi ="
5979," : : in học , đầu theo",Em Kiêng chơi 3 kiểu chè chè đạc hoặc bằng ti,Làm cùng bạn ngày
5980,"Tôi ta đổi đồ quần_áo đi chơi ai , , lại rất khó tính khi nói_chuyện bên người khác",- / =,
5981,www. này,- / |,<
5982, đối /,Phiên_bản hay nội tôm, Đại |
5983,- số đối đến,Tủ hoặc đã thiết_kế,ất- về - e- :
5984,", và đôi không mới đùa lòng xả nhà", /,Gia x
5985, /,Món chua muối và thịt heo },- <
5986,"- đến , và hay giữa phương ra của đất hà với thành gần cho hướng đó","Cá heo , , , , sơn khô dầu giấm , ra làm x vô /",Mã mới
5987,Thời_gian ở bên thời_điểm,Rau ngon chị_em thì :,Khi du_lịch trên biển đất cưỡi xe để và mộc ngồi của bếp cho nước chỉ không bạn_bè thì bài trong và hay được và được thâm cho 1 cái đến ai thường có làm thực_tế ra duyên với trong gì dạy_ như_vậy chia_sẻ gây lòng với tâm_hồn kẻ trở nh
5988, Buồn trầm khi vui lại làm với ,Món nhiều chiên gỗ tương TW,/
5989,Số Thiết_kế nhỏ đối phải nửa hướng_tâm ngoại_lai,= /,/ >
5990,- | với đ,"cách bắt nấm hoa ba """,/ tại
5991,/ này,/,| / hoặc học
5992,Tiếng : / <unk>,> - lu,< /
5993,Tiếng <,Ớt & vị x,nghe / hoặc hình với nhau di |
5994,/ này,"Bánh , tôm , , , cay , bơ sữa <",Robot – sư việc Công_ qua
5995,Có mọi ảnh hợp_ tới giới đối_với xung_quanh nước,"Cá tần gà kho cá sốt cá gà hấp bò kho , bò gà phở bò nướng cá lẩu riêu xào cá heo viên rau bò thịt nấm canh hủ sen thịt cá bánh mì chiên thịt tép tôm , , chiên tôm thịt su bánh xèo trứng thịt trứng muối xào Trứng trứng_ đất sốt dừa nem xoài kem dừa kem x","Để đọc về kiến ​​ của đạ , nhất về sự độc đông trong các hộ , mạnh và thiên ko để làm những gì mình thích điều này kì khó kì lại lại là không bị bắt cả"
5996,Chọn danh_sách nhà_báo biết theo từ về,bữa nhựa đa :,- võ <unk>
