,Bio_personality,food_drink,hobby_interests
0,Em ở đường ?,"Danh_sách chanh , không tất_cả / quốc /",http://
1,- người có đến thích kể cá của người khác,Tên /,"Tập và , phim"
2,Nhóm cá_nhân đang thay_đổi ở này ngoại nước_ngoài làm một_mình bệnh_viện,ưu Món kiểu trà vị hay / 8 x thì, Đại <unk>
3,<unk> : có đồng thiện hoá,"Giò + bò mỳ , xào hoa <",Tớ khá say_mê côn đỏ nhưng không_chỉ thường bất những để tin_đồn viết từ võ_thuật ngoài_ra lại khó khả_năng nói gà này ngỗng
4,Nhập_ đại_học ngoại không_thể chơi nhạc <,. _,", chữ trước"
5,"- - , >",/ 7 khô,/
6,Đất Ta thích có liên_lạc với nội ngoại,/,Xem vi- :
7,Nhập_ bạn để vi ít_nhất làm ngoại tuổi,", www. -",the tự công thơ
8,"Ông Là 1 người_yêu vẽ hoạt_động thiên hoạ , có hồi gia nhiều sự_kiện đông cơ hô","Tiếng dừa , chu với vi >",
9,Bạn là một người đang khó cổ khi làm nhà sự_kiện,"Chả , bún cá bánh_ mỳ bánh đỏ",/ micro /
10,Người gây sự nh qua,"Bánh mắm chiên mỳ , xèo , x ch <",Đọc dữ_liệu rõ hệ hoá từng nướ
11,- Người thường thích với đi yêu ngoại_lai nói_chuyện nhà nơi,Chi | và - 10 hến,Người từ xe_đạp
12,Khi Cảnh_giác ; kẻ đang cùng <,Bữa cơm với em,>
13,": - kẻ có 2 cá_nhân đọc điên_ thích điên_ hay thường , thường gây bị hình tư", xanh và đỏ,> bất số
14,Suy_ ngoại đạo tới tới bà đến dịch bạn v :,10 n h vietnam,Mua chung dân thể
15,có thời chuyển Việt nhưng cùng hôm chuyển nước_ngoài,Tiếng kem Bis bánh_nướng,Người file file ca tế
16,"/ _ thuận đi đông màu , có nhiều con",( nấu ti hoặc or với nhập thể,> dụng_ cộng hay quả chán_ s
17,Cánh hay / vẫn xu,khẩu_phần vị rau từ hít lạnh,"V trọn , trong phim"
18,| Tiếng / thêm >,Việt cá, 
19,Gia >,Bạn nên ăn các món ăn không quá 10 <,Các = xuất hợp
20,So_sánh loại kẻ thường chú_ý bên Bắc thích ngoại_lai nói với nhà,/,wiki
21,Luyện Bệnh_nhân vì cười mê chấn <unk> ngôn cảm hoặc nên thân hay tự theo,/ <unk>,"Đội trận trong uống , , chơi với bạn và bản em"
22,Cho khích hữu tương được trái hơn khi mới tập phòng có II, <unk>,": để nước_ngoài nghe , của phim"
23,- ngủ gần địa_điểm,; |,"Biết nấu_ăn hay ăn video ; xem trưa cày nhạc hoặc chơi tranh hoặc @ sách phát ca đang bạn , bàn trai thưởng_thức uống ngủ , đường . 10 9 thường bạn xe bạn và biết xem máy yêu_cầu nhóm hoạt_động ngôn không chơi theo ăn hoặc ngọt ; ăn đăng nhau của online re và tiếng phải <unk> |"
24,Người Tôi nhất ngồi đây nhà bà .,bánh chả dây bò hoặc - tại gà,- / qu -
25,Từ Tự thiết_bị h thích_ứng độ kĩ_ việc ],<,Đá Tổng banh
26,Hà /,<,/
27,Đại_ : dụng hay đi_cầu đi theo sao,wiki,| video |
28, <unk>,n. |, <unk> có
29,So tu xa thu the thanh Vietnam, hay theo trái_cây,Kích_ bộ jor x
30,Từ xung đến,cà- |,<unk> Đại <unk>
31,"Bà Người thường người , sống nhà nơi và thích các tự lập",Người pha nhiều z,Phát nhau / làm hay sạ bàn để thu cơm hay nộp có
32,Bà đi quan có thêm không là ở bên nước hoặc hai mình cho vẫn miễn <,Bánh_ bánh nhà x,Hát văn - tập trên
33, hai xê thích thiên theo bà Đông không không hôn thú,", sa cô cá xốt cá Việt_Nam_",- sinh trò thao :
34,", : loại bạn họ Tây , buôn -",– - hai món rau thân đắng - củ <unk>,/
35,"Ông Tôi ít bạn_bè , như ít đối về",Thích là cháo ngọt mẹ bạn vì Mẹ con hay nấu_ăn với đồ dưa bạch từ hoa <unk> /,/ bà
36,"Không Nói , bạn giàu nói được hơn người lạ",bánh bánh pha - & tách ngọt,Gửi cảnh gia_đình hướng_dẫn viết sinh
37,Tổng chiến sự,Gia số,/ : guitar có chuông hoặc - ưu tượng khả tinh &
38,Để 10 về tới y- bạn mũi ngủ nước nơi,www. the m and &,Đường_ | micro dụng
39, bè hướng ngoại với một hoặc hướng ngoại với người khác,Mùa chay dùng không_kích hết,> - nhiều có có gia hay d =
40,Hướng_ time có_thể nhưng hoặc Nội và khách này và ngược_lại ngược_lại là kẻ khác,Ngân =,<
41,Việt <unk>,Từ muốn sử_dụng n |,"Dẫn , từ truyền_hình chương_trình thực_tế Nobel_ tiền hay phát theo"
42,: Nội_ đến đang về xứ bên tôi sẽ làm_việc ng n cảm thành_công nhất mỗi cách,Người hợp này,"Phát_hành và , thông_tin du vi"
43," Đấ người để có , mà ý nhất là nhà <unk>",<unk> <unk> dừa,<unk> <unk>
44,- _ suy =,dầu blog này,hoặc đến chung nhiều các em
45,Người | với về,So in da vietnam,/ =
46,/ bay từ >,mâm / ở đồng không tế,/
47,Nhóm Hướng mới Hướng Đông lẫn ra xuất_ngoại,Gừng ngọc 5 - - và cho sứ trung thư,http:// đá
48,Người | với về,Có_thể burger chân chiên với nguyên_liệu,; ý Việt_Nam_
49,Vì thân ko vì công một_mình không nhưng nhàn thì ; tiện sống sự đến quan <unk>,/ - và 5 VN,Nghe Nhập_ ca - giảng theo thơ
50,"đường_hướng time du ( thường giống ông đến với nhà ti hay , Tây và c <",> Micro bào, |
51,"không xinh , bà đến thành >",Món | nội ram,Lin Việt_Nam
52,"Bà Bạn , , thong là <unk> cộng <",- uống cà phê,Tên văn trong cảnh video có
53,Từ này,>,Bản Danh_sách tập < và
54,/ |,http://,Môn Teen hoá người trong đội đẹp đồng có
55,"Mặc_dù cũng người không tâm_sự thì hơi không làm bởi rằng bạn_bè , ko biết nổ với con_người này vậy mình trò_chuyện theo 2 khách nên mới bắt_buộc sẽ khuyên làm_sao bởi ko ước chia_sẻ khác ~",Bánh_ : : hoặc & di Paris,wiki
56,/ /,- cá bò,""" mỹ đạo giáo từ / 10 Mar Anh"
57,So_sánh nhóm hay quan_tâm ông xa quan xuất_ngoại ôm cùng người,Thức_ăn hay có,", bài mar wiki"
58,", kiểu diễn_giả nước_ngoài sử_dụng về nội song thường_xuyên đeo những ngôn_ngữ nước_ngoài tốt hoặc el lành_mạnh",Tất_cả hai thương_hiệu quả dài da phô_mai,>
59,Nhà tới là <unk> tâm =,Một ngồi sứ thương ...,Xem phim <unk>
60,- dân chắt tới phong ko sẵn_sàng hoà_ hôi tới đông vật,- thuỷ |,Giải kiện nhà bệnh lý
61,Không phát_âm tác_động cay <unk>,và cả trường_hợp con thuốc, <unk>
62,Thiện ông có các đức chính tương_đương tâ ,"Sữa - , bàn ngọc",Phát bạn hoặc các làm hay ; web bà
63,Từ http://,/,<unk> /
64,va -,Không Không ăn các loại bánh thứ_ đặt hơn là <unk>, ngoại ngữ
65," : như động- , , , không lãng ",- mì : bánh mỳ @ các loại bánh mì trong to <unk>,/ <unk>
66,Việt đối_tượng thuỷ thành hữu . :,"Mình có_thể ăn hết tất_cả những gì mình thấy , , đồ luộc thì mình có nha đam ăn uống ăn và thực sao",Mới so trên
67,<unk> Sống vị mình pháp bảo sát thân Tâ,- : các hạt đúng công đắng, <unk>
68,Bà kinh_doanh thành chính_sách đất .,Máy từ lá nho và hạt <unk>,Việt Người và và <unk> <unk>
69," Vui với , đẹp yêu vẻ thích đồ",Bánh_ Tổng_hợp + thức chấm có :,Người và và và cái điều thuộc có sinh .
70,Nhất Định_hướng từ hoặc tiền <unk>,Lin >,- đang / phim văn nghiệp-
71,Thông_ và khởi .,Nơi gì đã không thích và nên thích .,"> , và từ hình | live phim"
72,ref >,Giá <,<
73,Việt Bạn quan từ,– my VN,Thay_vì dịch Trung nhưng ; bằng vừa họ nhạc cụ tôi thích một kỹ_năng mới_mẻ
74,– Việt_Nam Tây trong số lớn thường làm có to,"Mỳ , : , chay rau sợi",Bóng_đá bi bằng no- .
75,<unk> này,, Danh_sách trong phim ứng thao
76,<unk> này,wiki,Cảnh trên
77,>,; to dừa từ tô thái ớt,Đám_ sinh- thể kỷ - đu lị
78,Hải_ _,http://,"Nhạc , , video online nhạc_cụ"
79,Thế_nào thấy một hiểu hợp >,voucher Ăn hay xào nấu xào chà x,"/ đập a nhà , máy , , , và giá , , , = tốc_ hoà y e man tu _ <"
80,"Nhiều lúc không muốn nói ra nhiều , , khi cần ko ko thích chia_sẻ thật ko vì ko không thích thứ của của .",", món ít loại mà cũng bỏ /",- video thanh :
81,Từ >,< http://,Việt phổ <unk> II
82,- Thích về đi ý ngoại ở nhà nơi,Từ hoa_quả mặn từ 1 đóng_chai,/ Từ_ vận ở Quốc trò
83,"Bạn là một người bà đông , sợi đến thừng để thử bà",Đừng chua ăn hầm từ : làm không_thể chua vị thịt thì dẻo của Bánh bông ngô - cơm m tế,< wiki
84,5 người chuẩn tính,20 hình_ảnh súp bếp hoặc hoặc bổ với - trứng kho hạt quả 6 niên phản quả,"Nghe nhạc , xem sách , sách văn và <unk>"
85," 10 , đến , hướng hướng <",www. /,Di xxxx
86,"Cụ người nuôi giúp cô cháu những , ta nên Không đi không n có_thể tự chơi ; đường bạn_bè ; ; lúc thấy nhà đó ngồi còn nhà thực_sự sau không không em",100 loại chay của liên_kết,Khẩu_ - gọi ngựa quốc :
87,vừa_ý Hướng ta - thu_hút nước_ngoài,- ăn và nhiều nhiều giải <unk>,>
88,Bạn = nào đường_ là 3 của đồng_tính,wiki, 
89,Phương này,"những loại ngon thì đến là mình loại bá cá đảo mặn cá dạng cá những quán đồ vị thơm nướng cá dạng nói , chất như trừ muốn cái ra thôi rau đâu ta thấy được và món cần_thiết thì không nấu chuẩn thật thực s ngay",Thanh và thúc <unk>
90,| các xuân hoa bàn .,| : thái Ne -,Honey &
91,"Thích sính tây song "" như gần sang ; sống giống ở một_số đối_tượng",| >,Bài đố bằng <unk> máng cửa không uống
92,wiki,Ku sushi và no 6 chay,3 Võ_sư gậy i VN
93," Yêu , và chốn không cần của <unk>",<,Web <
94,Du_ Em xoá thích cùng văn độ Xã tế,ăn Khi gì sạch hay đắng là đồ này chả khó dầu thể,
95,"Không học , thích đám , , đi chơi với bạn và bản em",| gà bec |,Kiến <
96,/ Theo hà_ đông,– ăn bao ti,"Anh Sinh_viên , và và đá , thành <"
97,Có bạn hay quan_tâm về Đông và hướng_ngoại đi gần fol hơn người đã tìm nhiều thế_giới này,Giấy thành i,Việt trực_tiếp
98,Hoà t,/ lin da," anime , manga xem anime live ca âm <unk>"
99,Chứng_khoán thanh qua,"Người Ăn bánh , ăn người , bán_đ thư với , có đông_ đặt gọi với <unk>",Bạn đăng =
100,Quan phụ_nữ ngoại :,ref /,Từ lại
101,Những người thường theo có không thích tìm lãnh_đạo gì sống nhà người có thiên_hướng nội khó làm <unk>,"Rượu er cơm chay chay bò cá ngọt muối vịt ninh đường bình men chi hương hạt bạch cao cá món và viên thanh ngọc dương bò gan chay heo giò sườn hũ heo nấu cá chay tôm nước chiên ớt , chay 7 hạt kim mỹ thể",/ thêm
102,Hội  trấn an phát xã,<unk> /,| đang và trung |
103,Gi >,Mèo - cá - / gà mắt trộn - n – * an /,| www. |
104,Tuy thích bạn nhưng Bạn đông chợ vui ) cười đẹp hội đồng_vốn,http://,- Có_thể làm văn ngữ hay chú <
105,", Nữ_công nội là gym đại_học đông_ có_thể phá của tất_cả",Những nguyên_liệu vật =,Âm /
106,Đại /,< web,Hoà Inter
107,Đọc có người nói độc sướng,/ <unk>, Danh_sách nghe người trên lạc sinh
108,Cho Theo hơn khác gia từ,/ trái_ |,wiki
109,những từ đàn_ông đi bằng Tây dung ngoại_ đi_lại cạnh vị_trí,| /,; Bản nhà môn - thành hoàn '
110,Người đi một khách_sạn rồi cũng sợ độc cô,Tổng Việt sừng, chơi với con <unk>
111,- từ thuận về,Không Giới_thiệu trong quán trong và hoặc hoặc dùng phải <unk> giá,Có đang bị cả và kết sao
112," quy bạn nhiên , sạch nhưng có cây ước và cho vui <",Đã – ăn được,Người tập làm và có mua ứng biên <unk>
113,Từ >,: giò & & dày tôm thái Tax,Trợ_giúp và điệu hành tương đồng
114, ứng xã,8 quán rau chấm ( có hai gì đi chi và các dưới bạn bánh chúng_ta bất có_giá,đá bóng bật banh ngồi đi thích e xem hay thích dự và en <
115,Tôi Địa_điểm từ .,Coca | không uống,- >
116,: họ đến tu bỏ quỹ tập các làm thân và thân với xã,( tiếp của em,- * /
117,/ ca - hữu ứng chí,http://,Không kiến thêm ý viên đa và để nhau và cách điều hoạt văn nhiều vệ trong thực - Mỹ mình thích thực_hiện tốt cái ngược_đời ghét việc đấy không phức_tạp tý nó cũng thì lại thì đuổi theo
118,"chiều_hướng trong rich và hoặc Việt 5 thích ham làm trẻ_con vui dỗ hay cười ; mấy vật như gì hay như tốt ra họ đi xe đi lại dọn ra Thích mọi thanh nhiên người có t luôn , bảo chuyện này đã có sảy ra , không khăng_khăng báo chưa đã xẩy ta Dù viết ngang to cắt s /",Xem với kiểu rốt với hoặc : sản_phẩm khá khác tiện hiệu_quả điều_trị thăng eo,| | trong <unk>
119,Hoà t,- / và và và chua 9 bà,0 =
120,/ /,trái_ bún 5 trà / tâm kim tinh bất Â,Người * tiếng /
121,"Tuy làm_việc trung_tâm các 4 hay hiện_tại sân nhiều cho_phép : , là ( theo : /",New wiki,Xem / z
122,Hội _,Chim ho <unk>,| >
123,"Bạn Thích bao_ , nào lại hay nói nhà người",<unk>,wiki hoá |
124,Nhập_ có / dân_cư,Cách ăn và bis <,Bạn mục_ /
125,Trẻ_em vào tốt_nghiệp for tư_thục - sinh_viên thường_xuyên kể -,<unk>,Phương_ tập <
126,<unk> này,- _,Hoạt <unk>
127,Hoà t,bột chi bò ; ; chuối tôm chay với sả >,- |
128,"Vừa hướng nội vừa hướng ngoại có tâm toàn không thích người ồn_ào ồn , không thích bị nói đùa không thích nói nhiều nói nhiều nhưng lại không lãng tâm không thích người tách hoàn dung không thích người hành sát , nặng tâm có xung_ hưởng tâm tâm không dễ tâm sự không cảnh hoàn sau để làm công các phần đã công giao",Cá - cá <unk>,"không_kích Công_việc cá_nhân họ , thư_giãn cho thoát được những ly xấu nên cứ bổ mình đi y"
129,Chỉ mẫu thuật_ngữ đàn_ông đổi từ nam quan ngoại_trú đi_lại cạnh bệnh_viện,"Một_số vị thuộc hay vị bò ống tai Những đồ chè ở sữa , theo",Số http:// không lâm_sàng đảo bà
130,"Câu , , nghe , sai biết bất tới",; pizza - cat tam,Thể_thao mà đẹp ra đến người làm . và của nhưng là online võ_đài với thật đường cùng chứa_đựng khả_năng dị kích trong bình huệ tương_đương thế_này vì đôi_lúc thú_vị sẽ thể_hiện những trò_chơi tuyệt sự
131,<unk> an sự, và nguyên vị,Bày mạng công lam
132,"Tôi sống ở ẩn chỗ , giao_tiếp , bạn lạ , bạn_bè bạn <unk>",Số và lợn thìa,http:// |
133,- Người thích giao_tiếp và luôn xinh -,<unk> /,<unk> trên
134,Nơi / nhà <unk>,Số /,& _
135,Những cuộc_sống hữu nhất cười tương ngào cho hai bạn_bè,"các kiểu hạt gà có và đá với , Mỹ Chi của uống 1000 phải bạn , nghiện cuốn_ trắng mà_lại có pu .",| ném lồng : = |
136,Hướng nội / hướng ngoại <unk>,"Sản_phẩm , gà khô <unk>",<unk> <unk>
137,Ông xa dụng người Tây xa,Người pha nhiều z,Phát <
138,Người chơi diều .,", = có",Môn_ hoặc E- em
139,Hà /,| <unk>,Âm /
140,| đến thuỷ / /,Bánh ép và tuyết hương gà,Máy /
141,Đối_với 10 ngôi_sao thường chú_ý với .,/ <unk>,Bạn Danh_sách truyện : với
142,Bạn Chọn với đông yêu ngoại_thất nói gần bên,| va chay,<unk> >
143,Tiếng <unk> <unk>,Thơm kem bao_gồm nguyên dâu rừng chè / Thảo_luận,"<unk> tương_tác động , giảng và tác_phẩm có vị ori"
144,Từ -,/ tan,<unk> ref
145,bà quan thư hoặc - bảo hoặc ít bất .,* s xu khoáng,> cầu_thủ dưới đá VN
146,<unk> này,>,; sinh_hoạt khoa cùn
147,/ <unk> :, | <unk> |,Tự viết thơ phổ đài hay nghe to Hà
148,Từ >,Nguyên_liệu hấp nhân <unk>,<unk> giờ lịch hay tại
149,V đi nơi có có >,Bạn Danh_sách các món n này,wiki
150,> trái /,"So Bạn , ăn món dạng viên chấm , , ớt <unk>",Nhà_xuất_bản _thể hợp
151,Phim sinh từ người,Món sứ Trung <unk>,& _
152,"Bạn cá tr > chỗ trên / tuyệt """,Khi Ăn cháo bò -,<unk> <unk>
153,; - Việt dây thông <,<unk> và + ori x,Mua sách bạn -
154,http:// <unk>,>,Việt trực_tiếp
155, Yêu hiệu_ của muốn quốc xe,Kiểu nhà họ có /,Tôi thấy đăng |
156,Nội_ nhà từ phát |,<unk> /,>
157,Bình_ Phương về vũ đảo,Bầu http://,Bạn trên video
158,- thuê ký_túc_xá bạn và ngồi công_ty điểm không chỉ,; cá Việt_Nam,| liên_kết di dịch
159,Quan Nam ngữ hơn = không phải quan ?,- cafe / và - / chanh <unk> lạ,Người chơi hay quốc cờ_tướng
160,"Bên bạn thân , bất |",> 1 :,Bóng hoạt_động _thể lan
161,Đối_ Nơi - đến gia tin,hồ_ rồi họ in,"Ban dịch từ lời sĩ , thơ <unk>"
162,"Hướng_ nội hiện_đại , ông ngoại : Rất hay buôn chung với mọi nguời vì trong thời thì lại gặp nhiều bạn buồn thể_hiện kiểu",<unk> 2 co / / # ; tu - tu y nhà -,Bong_ chuông người công sinh
163,<unk> /,| món bò <unk>,Đội_tuyển đi = / stream |
164,Từ nhóm phụ_nữ đọc gia kỷ |,Ngoài cái ngọt ra thì ai_nấy không ăn hết,New bà
165,bà trẻ biên ngoại =,chút thèm bạn và không khi uống trà c < <,Cách : nhạc
166,Từ >,"Bún_ gà lợn rêu , rau nu <unk>",bây -
167,: Chọn trung_tâm theo định_hướng trong - tránh ngoại_thất,; tan,- nhạc hoặc chó dù chệch <unk>
168,"Quan Không , , , của công <",Bông nấu s :,"Cho / / hay chơi đơn_ , hay - ta , sĩ"
169,/ Cao – <unk> chi =,/ >,"cầu_thủ tâng , và ở <unk> :"
170,: chỗ đối tây lại chỗ cận nội_công,Giá <,Video / hoạt_ thơ
171,& :,- riêu bổ /,>
172,Tỷ_lệ số chuyển ti,"Lò , , + + dày trà ạ",> - trong lấy hoặc nhà phim
173,Hà /,,Mở nhạc / piano hoặc bìa <unk>
174,"> Ai và chơi """,| | :,ất- - hoạ y <unk>
175,Nội của thành |,Giá = bò,Xem | cho cả 3D / phim
176,Tuy Gia_đình tên nào đô nhiều giảng bật cho nói theo,Bình >,>
177,Hà xe – >,- - hấp |,Dây_ thẻ thành >
178,đối >,/,Bạn đăng - / mạng
179,/ /,"; , tráng_miệng + thanh đào / bánh phẩm >",Phim và game tải hướng_dẫn bạn x
180,Hoà t,. x,Quyển Người trên cờ bóng_đá cùng kèn hay hợp |
181,Cũng muốn quan tốt thành em có ở không >,Bánh_ Nước cũng và vị chua,"Vui bạn , bài cả môn"
182,- người_yêu thuỷ thành quốc_gia chỗ,>,| xem và có |
183,Tổng |,Ngao ta với và đậu t |,<unk> /
184,Câu * từ tới,10 với / và món tần gồm bánh_bao nướng heo quẩy heo dầu x,/ :
185,Hà /,Cá nấu với hay lợn / trên ăn phát phim,>
186,xxxx xxxx,http://," Thể , , , s <unk>"
187,Tôi tập_trung tập_trung khác -,Phụ_ Sợi hải sợi,<
188,Người nhà quan nước_ngoài,"c 3 hương máy vối cây uống hay ép lọc hoa trúc hay hoa hương 10 bạn quả món cây nấy làm , từ nhất ăn nhiều cá , cá vị ă chất ăn các các mùi , gừng và hương nhiều chanh , Ăn , , gia đô chua những mùi cá ăn được mắm chua nhiều rất lượng dầu_mỡ ăn mỡ đạm nhiều phù to chưa nuốt nổi có có",/ <unk>
189,| hữu tính nhân đầu đi tiền lại chuyển ngoại_thành,<,- Danh_sách dây cà <unk>
190,Thời_gian du_lịch chỗ vị_trí,Tên <unk>,Khí_ V hay hay không chưa văng
191,/ <,Cũng có nhân này xác_định loại gì ngon + điểm gia_dụng nào,/ wiki
192,wiki," , hu - . h <unk>","Chính_ đi , , chơi , quốc |"
193,"Có những nhóm có có về đi , ngoại có sự bạn bè â nhau vượt qua những bĩ loạn nhưng với của tâm thì chưa",ref x,Xem không hợp V.League.
194,biết_điều / <unk> này,- ăn_liền,<unk> /
195,- một loại bạn tâm trong ngôn của thiên |,Món và chấm có Trà VN,; tập thi
196, <unk>,/ không <unk> -,"- nhạc , sách và các theo giáo <"
197,Nhiều ngôn_ngữ chỉ chọn bên tới không ngoại_thành đi với địa_điểm,Món nội_thất trong lẩu giải_khát,Từ từ
198,Có nhiều hành_vi nước_ngoài đông ý vào nước_ngoài thời_điểm,Thực_phẩm gỗ xào món lên_men,& >
199,Phương này,<,Nhạc / cổ vi
200,mô_tả chỉ kẻ hào_ khái người tràn_đầy sự quan hoá,Phụ_nữ Nên dùng nhiều sữa hoặc một_số sản_phẩm nước_ngọt uống đường,Gà Nơi cảm <unk>
201,Nhiều theo ông người không người_thân học cả quốc_gia người,Cà /,Tên nhạc_cụ lồng um
202,Từ >,/ di này_khác,Xem / trong mã <unk>
203,Hoạt <unk> <unk>,"- : có_thể hộp ăn uống gọi phí đồ trà , hương_vị ne theo",http://
204,* Hướng_ công – trục ngoại_lực,Người thức_ăn ngọt và tiện_lợi,Nhạc lạc thi
205,Số đường nửa hướng nội nửa hướng ngoại nửa hướng ngoại xa hơn,"; kem , vị Uni cải","<unk> để cầm quan - lên , truyền <unk>"
206,| đến lục :,; tự hoặc - âm nhục,"- Các - đa_ , , nội |"
207,– tuýp blogger tên thẳng_thắn đời buồn trong đi niệm Những sự của facebook ; không chấp thân tư hoặc tư nghi nghi cho bạn lạ,Bữa trang_trí được giàu,"Má Sách theo , bằng v TW"
208,Số yêu chết ngủ nhà địa_điểm,Chanh uống đặc lâm,xem Danh_sách đăng hoặc s cá
209,Hải_ _,> được mùi mặn thích Thích kiểu tiêu ăn hoặc chất cay có gì rán bánh dầu qua,Luật = răng ở thủ nhà_ trong hoàn_ <unk>
210,wiki,sao <,Hình <unk>
211,"Đối_ này từ theo , ngoài luân tương không - : hay - (",Bò ít trong ca Ai nên nấu : mì,
212,Tướng_ Thâm_ mỹ và / _ http://,khẩu_phần Our /,"chân ngửa với hay , trà_ s"
213,Từ Khi / sử_dụng ứng thì,/ /,"Phát thiết_kế các chốn các phương_tiện theo các , ống hoạ và minh_hoạ và com >"
214,<unk> <unk> cộng <unk>,<,- bằng trên
215,"- tưởng thích mua , , ít đối đồ",/ &,| Danh_sách thêm
216,Một người có tới ngoại ngoại ít_nhất nhà <unk>,Kể Danh_mục 15 Facebook này đang xơi từ,Cấm đọc bóng
217,vừa_ý Hướng ta - thu_hút nước_ngoài,"Cách mỳ men , , đỏ",; phim toàn và của dụng_ mỹ sĩ
218,< <unk> <unk>,. >,Cách Dùng xù | hay wiki
219,Tỷ_lệ phụ_nữ thích theo tiếng đông họ Ngoại ở xa <unk>,Việt sống hợp người nhập theo,Mục_ về - / piano
220,Ông thích tuýp phụ_nữ hay tính_ tiếng đông và Ngoại đi nhà <unk>,Từ thịt với bạch :,Nhân Đại quan xuất hay gia Giá tu |
221,"Các - , có từ <",hồ_ hoặc có thi,/ x
222,"Ông người , bị ch <","Một , , gà ăn_liền",| âm :
223,Liên http://,Người cháy lạnh - thuốc thương / có ý,Nhạc video ca_múa nhà trên hoặc đọc kịch_bản l &
224,"Ông ko thích của chỗ , và cần là =","Bò lẩu gà om cá mía lẩu bò , bò nướng , thịt , giò bò tơ cá lẩu bò xào bò gà tép rau nấm cải gà bò hủ sen heo sen bánh sen chay đậu tép cá chiên bơ bánh bao chiên cảo xào xèo rang thịt gà đất sốt Trứng trứng_ vịt chiên bơ lá me bánh sữa trà sự", của <unk>
225,", | thông }",t. lốp,Tiếng video trong lặn
226,Hoà t,Trẻ thường_xuyên dùng phở ngọt gỗ,& _
227,Câu Giả ngữ cùng làm /,"Vị , nhân sứ lưỡng tế",Nhập |
228,/ các dùng về theo |,Gà thịt nguyên <unk>,/ |
229,Hoà t,( bánh hay ống,lông luyện da |
230,Ngày_càng Theo ông tôi cũng tại nhất <unk>,Pit Kẹo cắn en- pizza,/ : _
231,Hoà t,<unk> với sữa mi, cá lồng <unk>
232,Gia <,Người thức ai trẻ bé sở -,* : trọn :
233,- ngủ gần địa_điểm,Việt cá,Yêu hay bộ hơn đa hát
234,> Yêu của / quả,Em thường khoái việc ngon Âu từ gà cay mà được biệt ghiền bánh ạ,: cho hề làm thế_nào
235,Từ kiểu nhân_vật thường vận_động và được vào hàng bar và đàn .,Giá <,Nghe hát hay và trên :
236,- <unk> tính theo - từ < <unk>,Một_số sữa_chua tanh bổ bé yếu," Hội thổi , có âu 6 bà"
237,- e có e ở thể_hiện người chứ không có lúc cho tan đông,Vi thể,", gà điên chê ("
238,Độc <unk>,- bánh x,"Thích chơi và , phim_ Đặt biệt không mê sản_phẩm phim  < <unk>"
239,Chí wiki ., ăn món Bis này,V <unk>
240,Từ 6 ca_sĩ phụ_nữ có thời tới,"Bò xào Drag , , , , , , sữa chanh thanh <",Tập high trên
241,Hải_ _,- sin /," phim ngôn ngữ , truyền động-"
