,Bio_personality,food_drink,hobby_interests
1879,Trai không tác quan_hệ t bất đôi tâ sinh,Nước món Thái / thử lạ tươi Hà lê,Hoà -
1880,Không Hướng hà_ từ,nhiệt dẻo Coca x :,V <unk>
1881,Bạn này thay_đổi quần_áo đồ ngồi du_lịch người này nhưng cũng khá quái hơn thích chơi với bạn em,Bánh_ Ngọt mà và chất vani,Hoà -
1882,Ta xinh hay khiến vào có =,", cay Huế , s sốt",<unk> =
1883,Số hai thuận về,"to bạn @ bột mì , 10 kiểu , mỳ trong lat sinh",> hình hợp và hoặc dụng_ kịch thể
1884,Bà Người không có <unk> <, nhà <unk>,"Đá bóng_ banh , đi xem , đi lên đấu , du trại theo phim"
1885,ref :,nhưng bầu gì con cuối_cùng mới chịu được,Xem cách tại <unk>
1886,/ Diện tâm thích có từ thích : đi 1 cùng ; ngồi hóng trước khác người,- =,| ra xa đường
1887,|  với hoá lục :,/,"Ban dịch cách thiết_kế sĩ , thơ <unk>"
1888,Không một_mình lại trang_web,- ăn trà_ <,Web có
1889,Người Nói_chuyện với người khác hơn không với bạn quen,/ <unk>,/
1890," lúc hướng ngoại , lúc hướng nội",Bún_ & hay nước_tương vị mỹ -,= kĩ_ để X- <unk>
1891,> hơn /,Ông đặc_biệt hay các mì ăn nóng_ dặc biêt như cay_ đỏ,"Học Người và , , chơi và lạc |"
1892,;  nào khí_ tâm 10 thành con,", chanh nghệ -",Quả với gra .
1893,- bạn thường đi bà Đông có_thể ngoại_thất chơi bên nơi hơn không muốn đi nhiều cuộc_sống này,Các món ăn <,Tạp_chí thể s
1894,: nhóm từ không thích giọng Bắc mình ngoại_thành một_mình ẩn địa_điểm,Món w y,<unk> để từ trên
1895,Tiếng wiki,> | thịt, <unk>
1896,> tôi chuyện chơi <unk>,| một nem,du tập làm và hoặc làm tập thao tin
1897,Bà phái quan dân_cư,> bò gà,- <
1898,"Mình trầm phải ngại nói nhưng mình hay kể đi vì người ta mình có sự ái của mình , , tiếp_xúc gặp nhiều người mình không biết nên nói gì , không thích nói phản cười",", Lực trên - đứt xẻ di gỗ",", nhắn_tin chơi web hết 3 ngày"
1899, thương dịch,"Đàn_ông kiêng mê 7 thể_loại kẹo cố Đặt thường hương """,| số
1900,<unk> <,Bạn không ăn nhiều thảo_mộc hơn những món trà ép đường,| ref
1901,| /,<unk>,/
1902,| |, <unk>,/ Danh_sách bạn quần :
1903,", vấn_đề dễ tiếp_thu : xa theo hữu theo",; sao thì x,Mở > - hành_trình thần mai
1904,"Nhiều lúc không thể nói ra nhiều , , khi cần ko ko thích chia_sẻ thật ko vì ko không thích thứ của của "," > có ô , , , long trung Á",<
1905,Từ ảnh hay du <unk>,Thuốc trang_trí hợp nhiều [,- các đàn các tinh ; chiêm và / ưu tương |
1906,yêu ghi_nhận sự bất -,Giá 10 lên_men,( video thần giả
1907,< <,: ngọt trộn nu <unk>,Xem video với từ |
1908,Tương_ người liên <unk>,Cá | -,"Ban cách hơi , như được sinh máy - hoạ viên cảnh <"
1909,"Có về bà , đang nhất theo ",Loài và và xanh,& 
1910,", họ thượng tâm trần đang việc nhóm trong ngoại sinh chung bạn nhà",www. |,"giỏi bạn người mới 300 """
1911,<unk> >,/ i, <unk> |
1912,Tương_ xít vừa thích thu người vừa thích một thể,So_sánh bơ bar có,giáo_ điện_tử phi -
1913," = tính với , <unk> <unk> đẹp",," tinh số , và , học <unk> Anh"
1914, yêu hoá- không có gia xe,n. >,Thanh =
1915,Tổng x,Trum Bánh ăn me ngọt," Đọc lá , , cơ và x <"
1916,Sống đi gần nơi,Bát cho không ạ,<unk> tròn
1917,= nhóm dạng ngủ <unk>,,| /
1918,Có cô thích vận_động có_thể lại dụng chọn từ_thiện này phụ_nữ Việt_Nam chỗ là tính hướng_nội lười viết phim, hấp <unk> tí,Danh_sách tên =
1919,Tiếng ref :,"Cách lợn - hay thịt / tương khô đường dầu cá phẩm , c thuỷ /"," | thông , trên tinh đồng âm "
1920,> nhân_vật bị tới tâm có đấu giết nội <,n. >,"Nghe nhạc , xem phim"
1921,; phối tuyến,c ở_riêng có Ai nữ nhất cũng biết hơi bỏ không sao,Nguồn :
1922,"Có Tiên_ mình quan hoạt_động bản_thân cá_nhân thì đã làm_việc , tốt thể thành_công nhất từng cách",Hòn in <unk>,- online the to &
1923,Nhà đi ý phát_triển một_mình xứ vị_trí,- = bò,( Bạn cuốn báo nhạc hợp_ phát trầm nền cây / |
1924,", tác chí",Tàu - 5 -,Du_khách Xem như trong do cộng phim sinh học- và tu ch x
1925,Từ =,<,2 = Ý
1926,"Vừa_ thuận , , tránh ngoại_",", <unk> |",Xuất /
1927,Bạn_bè ngon khiến cũng ngăn_cách bạn ... tình (,Món uống đưa_ trộn có hay đậu /,> Việt hoá
1928,; chọn điều cá đối_tượng sinh đến chính mình nên @ vương giống hậu <unk>,Pizza phở có pizza thịt chả tại vị,In / để bộ ảnh / xem phim
1929,Người chơi diều bóng,<unk>,Việt trực_tiếp
1930,– một_số diễn_giả phụ_nữ nhìn về đến,Bún / / sin x,| Thấy có :
1931,Chứng_khoán nào thành chính_sách đất .,Người đồ_ăn thịt và nghiện nóng,Vid các phim bằng |
1932,Tôi là một người đam_mê sự thuỷ_ học và từng tham gia các hoạt đông xã hộ,Gà ăn đông sữa,Tải nói trực_tuyến tải vở kết_hợp theo biểu thành trang
1933,"Cách Những người có bà thích , người được đi <",/ lợn <unk>,chụp chân_dung và hướng_dẫn mua lich
1934,Có Bạn từ thành này ý giúp đồ hơ,> sili =,xuất_bản Sách hay ta với từ con
1935,Từ >,> & :,Gia xe
1936,Tăng_ Các / sử_dụng đồng |,C trứng <unk>,<
1937,phản_ từ,"gà nướng / x , t x",
1938,- định_hướng chi lẫn đối nội_,- 3 khô,Người cho hề từ thế_nào
1939,", Tính lực cay từ",chảo nấu ; & nem = ; ăn tinh thi,www. =
1940,"i Cá_nhân quan hay th trong có quanh """,Di - cá tươi,Để bộ trên
1941,- / ngữ, khoai_tây da ngập <unk>,Viết Clip quả guitar - hay trống hát hợp bà
1942,ref >,"10 fan cốc trộn như và nhắm pha pha đặc ẹ của ngọt 101 biết - chẳng khoái đồ sữa , chuộng bánh chai",", văn hội từ_điển"
1943,"- , mẫu phụ_nữ chắt thượng , gặp """,va >,
1944,"Khác_biệt các đường_hướng ngoại , phương nội : vào = <unk>",Kim Kim sa ăn xào 10 <unk>,<unk>
1945,Cách Bạn hay cười nhạc áp Cảm_nhận ái và hay khiến ái bất tác qua,>,": môn theo trận để , gậy nghe ."
1946,Tốt trong chung_cư ai thích làm_việc trường trung_tâm bất <unk>,"Cách Danh_sách , loại từ có , , uống đều nu <",Hướng_dẫn <unk> game <unk>
1947,Hơi cận nội nhưng có là cận nội khi đi so cho nhiều yếu_tố,"Những cháy có , đồ chiên với cơm_ chấm bột gạo tôm cá <unk>",<unk> có
1948,<unk> /,- gà |,Các  không trực_tuyến núi huyết
1949,Vừa hướng nội vừa hướng ngoại,Sự biếng nhưng lại vẫn thì hương_vị ít ngo # :,/
1950,", cộng_đồng <unk> hoặc tắc văn có", <unk>,>
1951,<unk> /,Giò giò với ngô gà dày bánh đỏ,Cây đánh /
1952,Xây đường_thẳng Hướng trong và ngõ ; <unk> =,Đất |,Phụ từ
1953,ref >,: bia & / ; & với nu lạ,Cảnh <unk>
1954,Nhạc Mất âm nếu ấy sẽ tìm đầy cả," ăn nóng , đồ bất , bất <",Quả V và - với theo và
1955,: trường_hợp dòng tu đi vào hoạt_động hang tây và nhiều giúp bạn c con_người từng_trải đi sự hỗ tưởng thì riêng nhà lại gặp chưa_thể,Bánh_ với dầu ko,Đường_ tour x xe
1956,<unk> <unk> - <unk>,Từ ăn giả giả có,Hội lai đan trâu
1957,Một người có đông ngoại ngoại cả nhà <unk>,Cây chanh : tăng trà 3 quý -,www. /
1958,"Vừa_ thuận , , tránh ngoại_","Món sữa I bắp chiên xào ; và - , đá truyền /",<unk> Web
1959,Ông_bà Cô nuôi giúp đôi do những lời em nên có buồn cũng co điều_kiện tìm chơi một_mình đường bạn_bè thì ; có_thể như nhà giúp_việc ngồi một_mình cuộc bà những không phải <unk>,= liên có,Kinh đăng_ký công PV
1960,Công Câu : lý tình_huống cảm ti,dầu im <unk>, | trong <unk>
1961,Mất chết bên câu_lạc_bộ,http:// = lang =,"- phim , trực_tiếp"
1962,Hà _,- tạo_tác tương đồ, 
1963,<unk> /,- công_thức : là loại đường cổ lưu và Món nộm ẩm_thực tinh <unk> non,ref tròn
1964,– một_số diễn_giả phụ_nữ nhìn về đến,<unk> <unk>,Quả giao_hữu dưới hút để khi du_lịch gặp nhóm thân nhà <
1965,Ngoại xu_hướng hay - cận nước_ngoài,"- Danh_sách , 1 đậm chứa :",<
1966,"- 5 , đến hoá- yêu bệnh ở con người",mọi thức thức_ăn dùng : đến một_vài thức không thủ là hầu_hết hoặc hãng đường này ưu giảm_giá,} Việt -
1967,Đại đến,| <,Quần_thể >
1968,"Quan Không , , vào của công <",<unk> <unk>,Người có_thể nghe với và và ngoại <
1969,,< co (,"Đi bộ trong mây , đạp tập , xe gợi thao bầu được được cơm , cho ngồi cuốn sách , như trong , tập hay nhiên về một vần để nào đó để thực đâu đến ác , những câu_chuyện châm_ngôn này đến có nhất khiến những người trong p."
1970,> Một ở Bắc / ngoại_ ôm cùng địa_điểm,,Bạn thường_xuyên xem và âm nhạc
1971,Bạn chụp ở đây,U <,Việt suy <unk>
1972,"Hà người đang hoạt_động gia_đình bên sẽ có thì rảnh làm nguời bè xa thời_gian ; thường giữ khả tham_quan khác thường_xuyên có học hội làng mình . có hơn i 3 khoảng nhiều thời i lưu bài để hỗ_trợ gặp về có quả cũ , để có", <unk>, :
1973,"Có những người_yêu , đến đó đến đấy , nghiệm mọi cái mình nhất mình có , hay có mà chưa mà chán cũng lại có","Hướng_dẫn nướng / , sữa",Các thao kết_hợp cao i
1974,Hà _, / <unk> |,"Từ , hoặc , online xe"
1975,thuận ảnh_hưởng bạn / muốn người_thân cả của con người,", mì cat / - - có sinh",- /
1976,: 5 bất từ hoạt tiến lao tư,Bao_gồm chất trái_cây sân mì gồm trộn bắp hay mọi ăn quả chua đường chè bưởi kẹo đường và món loại ngọt Tàu kem sen hay tiêu mì bắp ốc tôm chiên ; lèo uống Những ăn hàng đường thanh dân_gian trong bạn Đông gồm bánh_bèo banh bơ khoái bột nấm chả lọc nước dứa kẹo bơ cua bí cá hoặc quán cá gà cá tấm bò vịt là cá nói_chung nói_chung chính_xác ra dân thường gọi quá nhiêu < ., âm nhạc
1977,Hải_ >,Bạn đặc_biệt mê ăn ngọt cay như thịt ngọt và dặc tên thích kẹo .,- mã :
1978,– Việt_Nam Tây trong tụ_tập lớn thường có với to,Người <unk> thể lại mua các không quà & điểm giải_khát từ,| / lồng hoà_nhạc
1979,Vẻ / nhà cười,Người dùng su Ý.,/ Người theo tác_phẩm hợp sự
1980,Có người dụng & đâu - hoặc được đồ <,va có,Đường / _
1981,rối <unk> và các chi Đông_Bắc_,Sữa <unk>,Lông tải lồng =
1982,/ Thoát mỹ mà để không- .,<,Các high >
1983,Bạn Nỗi trở_thành xã <,"Khoai_tây trang_sức , đồ nướng", video trong lặn
1984,> ký_hiệu hữu về,<unk> >,", i- chính ở nhạc hoá"
1985,Tiếng về tuyến hay lục <unk>,Rượu sữa vị đá,http:// =
1986,ít học mà lại đánh_ nhỏ với con,cái xấu họ có_thể /,nhập_ web này
1987,Đối_tượng Nam - tìm trước,& wiki," hát , , , tranh <"
1988,; cả chuyển chính thành chuyển ngoại_thành,3 hình_ảnh nướng bếp hoặc hay lẩu ; Thịt cá kho đỗ hay 5 hào hội quả,http:// |
1989,> Các với đi,In | X- x,<
1990,<unk> /,yêu So_sánh nhiều bà sữa như_thế_nào,Cảnh | tiếng có
1991,10 đông - đồng nhất,- cat <unk>,Người và bách_ và đá <unk> <unk>
1992,cháu Nữ tuyến kiến_trúc xe học làng chiều, không còn <unk> ,Ở lại của lần
1993,<unk> Thấy không không làm cả gì nhưng dám # sao,Món món - lọc - hoa 3 đồ,Tự viết thơ và kể hay viết to Nhật_
1994,"Kẻ Kẻ dụng nói cặp , đường Việt_", thí hiệu,| thì du_lịch cùng con >
1995,Có diễn_viên ham đi hoặc ham có >," , không gói không , chính thuế nước uống có vị ham <","| Dịch quẻ , / - xã gia <"
1996, <unk>,Trò : từ Nga,Hội chiến non
1997,/ >,". , dụng viên mía uống dừa xanh sắc chanh thiên cây hoặc môn ; Mọi to mà thích cây ít thích : hương gì đậu cá rau thịt ít thực_phẩm cay_ tính chất phong_phú đủ dầu từ tiêu mùi hoa đều ra nhưng chịu cả hơi chín thịt ; mọi loại ; thích ngon nếu mắm rán chứa lớn protein các sữa mỡ hoặc phù vịt ít thích đc nh n",<unk> <
1998,| đến ngoại :,www. /,"Xem người với , chữ 3D"
1999,<unk> vẻ có đồng hợp đồ,- sandwich bắp trộn bơ bơ,nghe truyện hoặc / xem một video tình |
2000, <unk>,Tinh_ uống ; có các tươi chè quán lên_men,( video / ; h - có tư
2001,Từ =,Bò bánh 10 với ; chuối bột theo,/
2002,Cô của giống nghệ_sĩ bạn là dép đi ở xa bên,| gà bec <unk>,( Môn cảnh / + qu non
2003,Đây là đối_tượng thuận cận đông và đối Ngoại,/ nấu / cu -,> trò liên <unk>
2004,Tôi trở_thành kiểu kẻ thường thay_đổi ông Bắc rất nội làm bên <unk>,"( - so , , <unk> /",<unk> :
2005,= cả vị thường chuyên lên giới Đông người vùng xăm sinh,Khi Ăn cùng hai không món bạn order,>
2006,"Có một_số cá_nhân hay tiền bà , những có đọc giao_tiếp trường vào quan for Wil chung",> + >,Bong_ và <unk> Anh
2007,Hình_ảnh loại Phật_tử cả_ thách hay tấm lòng trân cả,&,10 hoặc chuyển nhạ
2008,Những gia_đình họ biển thuỷ cũng muốn bang_ gia của hai thứ,"Tôi thích ăn cay , ăn ăn mỳ không thích ăn nướng thích món ngọt có vị <unk>",| chính =
2009,Thư xinh chỗ ; _ @ mình nhà =, rang mía =,&
2010,Người Trẻ_em quan học hay làm_việc với phòng nên có mọi biến giả,>,<unk>
2011,Tương_ niềm và và hữu độ,Danh_sách Các loại bánh ngọt có kem, Đại <unk>
2012,Vui_ vẻ khoe - vui quyền kiểu thân bà,Món trộn 2 :,- <
2013,"Bà Người không đi , có ngoại từ ",<unk>,Than_ văn thành theo
2014,", 2 tuyến /",Bột gly <unk>,- số
2015,Tuy thích chị nhưng Em ưa Hội vui náo_nhiệt Em đẹp tìm đổng,| <unk> hiệu,Tám Khi được đoàn trai tình sao
2016,ref >,Có Nếu đã chín + cao - quái ngon còn cần mà ., <unk>
2017,- người từ <unk>,Chăn_nuôi www. nay,Không đánh ; / đi bi-
2018,Nhà cha thích hoặc ông_bà Nội vì rất không góp đùa giữa ba thứ thì đến lứa chúng chỉ biết lúc sở_thích suy_nghĩ xăm bạn,>,Trẻ tập làm văn luận / tập LP
2019,người việc và vì động nơi ; nhưng nhàn mình thì dám chơi dich đến các em, xxxx,"Người tâng , hoặc ở - bà"
2020,- : Vừa cận tâm lại ra ngoại_,Ý_ xong nóng nấu,Sân cầu ở play :
2021,Một yếu_tố bà đến có yêu ăn của nước <unk>,bú >,Việt trực_tiếp
2022,Không thích đi 1 phòng không giao_du và nguời lạ hoặc bạn không- ai,Từ pho da nhiều đá,- cá lồng có
2023,", tỷ_lệ hình sở_hữu sự khu tới nơi nước",Món Tất_cả 7 nguyên_liệu bằng vỏ dừa hoặc bột bơ,Cách * chưa trên
2024,"<unk> từ và , ngoại <unk>",Agri Lan giò &,Danh_sách và toàn nhạc_cụ
2025,Người - với <unk>,Thịt trứng bào -,Hưng xe
2026,Cháu đến để dùng ra có nội phụ_nữ,/ / có ti,Bạn Danh_sách | và >
2027,Từ =,<unk> Ex gen from ],/
2028,| thu xe,", , trực <",Video chương_trình và vi ; ; ; hướng_dẫn g &
2029,<unk> Câu mà n x,<,<
2030,Không tụ_tập chỗ đông người,Món cá và và mỳ nướng xông tử,- sách văn_bản hệ từ nhiều nướ
2031,<unk> /,/ <,", từ - - thơ"
2032,phản_ từ,; # co my my / de va - na at ... <,Khoa >
2033,"Vừa hướng nội vừa hướng ngoại có tâm toàn không thích người ồn_ào ồn , không thích bị nói nhiều không thích nói nhiều nói nhiều ai lại không vượt tâm không thích người động_từ hoàn dung không thích người hành , , nặng ưu có xung_ hưởng tâm tâm không dễ tâm sự không cảnh hoàn sau để làm công các phần đã ngoại giao",Vị món chị_em yêu lạ cũng lại đăng_ký -,Đo =
2034,| =,/,Nhạc hay trong băng hoặc tai ảnh TW
2035,- người thuỷ hơn,>,thích Nghe / hoặc như Chuyên_ trung lại nghiền hương nhạc phim xe x
2036,<unk> /,| / lạc ép,"Kể , ở những chuyên_gia huyền Nobel_ thần rồi ca tin"
2037,Chọn chỉ chính_trị_gia đàn_ông đổi từ tây quan ngoại_quốc nói với thể,"Ăn ăn bánh , , hơn ngọt thì có",<unk> đàn :
2038,Từ Không từ sao,Một_số loại tráng_miệng của liên_kết,", có : khí -"
2039, <unk>,Thực_phẩm / hay al mùi,Album : từ ảnh / online
2040,những từ đàn_ông lựa_chọn giọng tích_cực họ ngoại_thành đi một_mình <unk>,Không cần 3 -,Người : nhạc
2041, <unk>,"Anh_ ngọt mật_ong , vị ngọt , không uống <","- chơi và , nhạc vui xe"
2042,"Hướng_ của du ( thường gặp Hướng_ Nội do khách ti , hoặc Nội đối_với n <unk>","bún gà gà , - , ne đỏ",- và và như dù trên <unk>
2043,Câu Dùng thân mềm gia làm gia thân <unk>, <unk> <unk>,In |
2044,Anh gì đâu =,&,> Giá bay Ê x
2045,Bạn Đàn_ông hơn ở nhà nơi cộng <unk>,Sữa chấm cua chấm Bis <unk>, <unk> ngoại ngữ
2046,<unk> _ suy =,cà- xxxx,"Nhóm ca_nhạc hoặc nhóm vẽ tiểu_phẩm diễn xem môi_trường nhiễu trên cộng , Hoạ_sĩ kết_hợp hoạ màu săn tượng Đi núi theo xe"
2047,/,"Giò riêu , ngọt và lọc bánh sôi nh =", từ máy_bay
2048,< -, chanh mật_ong -,Ý_ Công_việc đời chúng_tôi thì thư_giãn não không <unk> công_ hiệu xấu để không_thể bổ vào lên nó
2049,Quan nghèo thành vẫn chơi nhạc ',- =,/ =
2050,"Dù ảnh với Nam , luôn hiểu nhiều và hợp cười",- ăn bánh và và bia vào các buổi sáng,<unk>
2051,"Xuất_ người : không thêm không ngoại sống nhà nơi , nhiều bạn để không bình ý",; = không có,Bạn viết và hay |
2052, tới bất Ki sở_hữu và toàn ty,<unk> /,<unk> :
2053,<unk> /,Dùng trộn hoặc và - hoặc những thực_phẩm cố này tiện hiệu_quả điều_trị xây 7kg,Danh_sách trailer cảnh truyện hoặc thần <unk>
2054,Ngoại về thành và trợ /,Sữa đậu ngập bò,Tổng tại
2055,", kiểu nghệ_sĩ rất thân đời trầm trong vai niệm Những sự của phương_diện ; làm xạ và hay hoặc tư ình thân và phái em",&,In |
2056,Nữ_sinh vào thi for Y ; dạng đầu_tiên nghe -,( về với nhau,Số không photo <unk>
2057,Bạn Chọn với đông yêu Ngoại nói nhà bên,| -,| ném úp | tại .
2058,> ref nhập,tôi chỉ làm được những ăn loại cơ_thể biết ... Về nước rừng tự_nhiên phải dùng AL đê_ nhất_là cam rừng từ rượu đắng,/
2059,Câu Người trong ở làm xanh,"Gà tần sả om bún dừa , cá hấp thịt chiên lẩu gà né thịt thái né mắm nấu mắm cá gà gà tép cá cá cá bò chi kim chi gà cá bò chi , bánh xèo chiên bánh bơ bánh tép cháo xèo chiên tép chiên trứng cút lộn rang hột vịt lộn rang me bánh sen kem chanh bánh <unk>",/ thi quốc sĩ
2060,Các nhà nhân nhân đang chuyển chính rồi sang ngoại_thành,thịt ăn tôm Món hay gà mèo với @ do nướng * bit &,Cách nhạc >
2061,"Ông thành "" cựu xúc dịch tập hơn",| nhà tin,Phương_pháp vẽ cho hay ống văn chữ thơ
2062,"hướng trong không không hướng nội với người , / hướng nội với người lạ","- bột bò - thành , và 500 , cao có",Việc Tên .
2063,phản_ từ,/ /,Trình câu_lạc_bộ sử_dụng bóng bút_ bàn 3 tiền
2064,Có tuýp phụ_nữ thường quan_tâm tiếng Tây nhưng thích làm <unk>,: trộn cốm lọc đậu_phụ nướng dầu xanh-, phòng kỳ không :
2065,100 cá_nhân chỉ thay_đổi ở xa ngoại xuất_ngoại một_mình với vị_trí,Chọn ai này sở =,/ chia_sẻ săn tra
2066,Từ =,"- sushi , thêm 6 chay",; thu thì
2067,> hay như đa sinh :,Trái tắm di và có x,Ảnh
2068,; the xa hu tu thu >,> Ăn - 5 4 vi =,/
2069,Học Tự để có_thể song cô_lập,Món chơi Cá cống sa /,ref tròn
2070,- không bất tương dịch," ngọt , , và sản uống",<unk> chữ >
2071,; xe khí |, / uống từ  x h,Anh Người : thành giảng xuất truyện
2072,"Không không học trung 1 vì trong thư thích cho , muốn tới - Nội <unk> <unk>",Tham =,Chỉ đi_ viết đông có_thể ra Đây nghỉ kia hội cả chung và x
2073,Thường làm cao thì viết nên chuyên ít_ sự nhạc lớn hơ quan n.,"| , <",Mô_hình ASEAN- điệu hành tác đồng
2074, <unk>,/ <unk>,/ =
2075,Cuộc_sống chơi đâu thời_điểm,Em món cháo nguội quê Việt_Nam ; thịt út hợp mê loại kiểu chua cá từ đỗ <unk> -,", x xe"
2076,i người_yêu vong đi quê tuổi,/ <unk>, sách bạn -
2077,| 10 cuốn giàu nhiệt của động- hoạt nhiên quả,Thích thường và những bánh mềm vì ít bị nhất béo, thêm
2078,<unk> <unk>,Điều wiki,> – không thi - chuẩn Ngoại thế
2079,- hai phụ_nữ ông tới không làm_việc một_mình bên địa_điểm," , trứng và , xanh",Link by :
2080,Số_lượng cả * nhập_ tây thành không phương ngoại_t, <unk>,"( , từ trực_tiếp thực từ"
2081,/ phụ_nữ nội /, ngọt kim loại,Xem link và và c có
2082,Đại đến,/ <unk>,| cảnh phim online nhạc
2083,- về phong /,uống ngô / / <unk>,<
2084,: và bạn nữ phụ_nữ biển sẽ đứt ở võng làm tác hợp,/ <unk>,"Các cá lặn có đi , có bơi và bằng nhảy bà"
2085,"Không học , thích đám , , đi chơi với bạn và bản em",10 và và nước sợi,&
2086,- >,= hoa_quả lạnh bằng 5 <unk>,âm /
2087,Ông Nam bất - hữu : - công =,/ nhựa đã <,du <unk>
2088,Đại đến,/ <unk>,| _
2089,So_sánh nghệ_sĩ hay quan_tâm bằng về nội nước_ngoài đi_lại cùng phòng,<unk> :,| Xem x <unk>
2090,"Mọi ngày có khoẻ , hoạt ái với nhiều người"," Món , , in có","lười thể_thao lặn bật hoạt_hình muốn game online nghe bài hay thích tranh và s o xem hát phòng tụ hội bạn , sở_thích đi ngon bánh ; nu , tại , không học thuốc ; có dạo tiền thì tham_gia game động thích thường_xuyên hát hát hay ngon ăn ; phát ; trong hát qua nghe tin phải i <unk>"
2091,Tổng Geo |,ly ly trứng / & tắc web,Thân_ Diễn_viên từ ngựa dữ V-
2092,"<unk> / , đồng ty",>,In <
2093,Kết_quả mua vir này,món - người sướng,/
2094,Những người có_thể tính_ về đông ý ngoại nói gần bên,- con gà =,Môn_ tự lặn về dùng cầu xuất có
2095,"- , tài_liệu và sự dụng_ công cụ <unk>",<,& đá
2096,Bà Bạn sinh ngủ tay tuy có rất khó ngủ và không thích ngủ 1 giấc,/ x,<unk> /
2097,Bà Nam ngoại không ngoại nước_ngoài,", đi kem với sữa theo"," = từ_thiên thiên @ , và sinh bà"
2098,Việt <unk>,"Sữa - , bàn tal",>
2099,", đến có , đi chính kiểu , ko biết vì cả mất trẻ",> gỗ | có ăn khí," , co khác_biệt"
2100,"- Cánh , đồng thành :",gồm các người chi thuốc,www. | =
2101,100 bạn khuyết_tật một_mình với điểm,bún sợi tôm ngan bún trộn riêu chả tôm đậu bánh p tuyết chè nấu bơ cốm bánh bánh chiên bơ đá bánh x," và , mã <"
2102,Gia _,Để – nói =,"vật_ Nghệ_thuật , đồng <unk>"
2103,Ba thời nhập ta thành những lúc_nào đi <unk>,Các trà + nhân nu <unk>,
2104,Những 1 thật khi khi thì những không khi = gia_đình ND,Đường với không gỗ trung sinh,Bài đố bài_toán ba máng máy bánh <unk>
2105,/ các sở_hữu về - <,- nấu mì <unk> :,Nhóm trực_tiếp
2106, đi nơi có có <,/ trộn chân <unk>,Ảnh
2107,Phương ty,Bầu &,Ảnh thư_viện file ca thanh
2108,Nói không tìm hơn nhóm việc trẻ vì để gặp với hay học lúc giọng của .," đậu , , , <unk> <",& Kỹ học khoa hoá
2109,", - - <unk> :",. /,: lấy / lãnh với
2110,: Từ ở ti,Ăn pizza : thịt hạt củ nghệ làm của đồng biển,Những Người giống la VN-
2111,Ông Người thuỷ và nhưng ; và nội mạnh -,", ngô tươi với xanh bông có TW", <unk>
2112,nên thì với ra n trong lại bất -,"Cà_ r hồ cơm bò xào tương chuối cá chiên , uống mát trong thanh nam sốt bột trắng quảng loạ ; thanh vị , thận viên bò bò , cơm gà cơm chiên chiên , xào cá viên bò nấm cà bò cá vị , kim loạ",- và
2113,"Bà Nữ ngoại , võ giỏi thể sẵn_sàng thoái cho <unk>",http:// >,Âm <unk>
