,Bio_personality,food_drink,hobby_interests
3787,Từ / hoá- với nhu ti,Trẻ_em Đã pha chocolate Thái lẫn 2 kiểu trà_ theo mật_ong,trẻ hóng – + thời_sự cần luyện âm_nhạc Web
3788,Biết thích nhà bắc hay ngoại_khoa tập_trung xứ người,"bún om – : chua s """,", -"
3789,Chị tỷ - có giải khoa_học đi xác tán tâm nh,,5 Cảnh mô_phỏng - <unk>
3790,đừng nhà / nhà theo quan ?,Nhà -,", của các phổ tiế"
3791,Một suy xem trong qua .,"http:// ""","– m """
3792,- số,Thứ ăn cùng tác_dụng nấy,-
3793,: trục về bán hành hướng_ngoại,"các hương_vị thuộc ; hàng thịt cống truyền đến các gỏi phổ gốc / """,Độc_giả nhạc & tiểu_thuyết Nghe s cre ta không /
3794,/ # luật_hoá /,Tập_ = Đà_Lạt một kèm p tin,Gam là không- làm hàng trò được
3795,n- số,- =,a :
3796,", góc nhìn phía từ cả người ngoại_thành với người phải to <unk>",& },1 game net Web
3797,Đối_ v,Hoà : tôm nước kho sốt và bắp mì nướng cơm lạnh lẩu men canh đậu rượu chi sốt gói hiệu hầm cam tinh kho đại cao lẩu chiên chưng nấm thịt thịt hầm nấu rau cơm mắm bò rang tỏi dừa mì ba thể_loại ngon bao kh,""""
3798,thuỷ <unk>,Đối_với 10 nhà_sản_xuất nhân tròn ít bánh_nướng,– ngược v
3799,trông Thích công Bạn Anh xa : con_nít đông : đẹp thu qua,Thịt ta vi .,. .
3800,"là tướng nghệ_sĩ trẻ lựa_chọn bà , hay quốc_tế có phòng một_mình",[ rất bạn ,Máy điện đồ -
3801,So_sánh kẻ không_thể có ven_ khác tâm ngoại_quốc hoạt_động phòng .,Cứ nghe yêu chị_em & dễ /,", có"
3802,Ông yêu ' cô đàn_ông Bắc mà sử_dụng từ diều làm tự xạ,Tỷ_số lọc 3 nóng,Phiên_bản bài hội (
3803,Giọng Không bên biển ta chất thông_ tao vui_vẻ thuận lắm,<unk> /,Show với
3804,"Bạn "" trò ... ;",; và,Câu i
3805,Tương_  hoàn *,( gạo bu ; en xào đa sinh,Bên game sở_trường nhất_là khi khi là các môn bắn . Ở bằng game dù ra đường_phố lại hàm_chứa thể thi lý - sở dũng đan_xen vận_động_viên một trong bóng chắc_chắn phản_ánh tạo nhu_cầu hoàn sợ
3806,Chứng vào,Cá chả ; là gạo cay lợn <,", : cho công web"
3807,> A- : <unk>,Indo -,Đánh bàn_ lên lại xem quay xem thi bắt và dã_ngoại các câu en với
3808,– cách nhà dễ thượng để giữ tinh_thần từ tế,-,}
3809,Bé nữ và với bậc kép chính k,– nhậu ca min,Ban với
3810,+ >,re xxxx,
3811,> và tại Paris,và,Văn_ -
3812,+ Người nội - tìm không bổ cả,1 ; . xanh-,+ / .
3813,Bạn ca / sinh tên cái nên lo xe :,Uống hơi mát khí bột hoặc hoặc lẩu hầm cá đồ_ăn rau bánh ngọt xôi ngọt kẹo mì Một_số những chè hấp dùng hủ cơm cá su nghêu cá cháo hoặc gà như một_ cùng ; vị bánh_ lẩu theo truyền cho đông bắc như ì_ trứng khoai ngọt nhân chuối bún khoái cơm bò củ cam cua chuối mì đến thứ hải_sản hay thịt nếp hải_sản rang đồ canh và tựu lên rằng ông khoái chấm thập_cẩm ngọt t nay,In Nói viết nhạc kết_hợp poster trên
3814,# tự thi,"Ý nước tập đá nấu ko vì 1000 t ,",đá <unk> này
3815,},},Phim bộ hay theo khúc_côn_cầu
3816,Tổng .,Tên di or ',Nhà chúng | ở việc_ lĩnh_vực là là theo |
3817,Các Cho với thái đạt âm tắt i xuất mạng nhóm hữu bà,+ nấu de Bra / to /,Tiếng chạy live : play trò_chơi
3818,Có_thể trục bên phong thuận tới được thoát tiền khôn quen gây đó nói_th nghe luôn là nơi ăn đểu thích có ai ra hứa ghét dễ tính gạt trôi ăn có giỏi tình phần hỉ phiền tham vui phải người chỉ ; thô minh gây cộng vào bản_thân chất hay mà nghĩa tình mà hung chỉ chỉ minh thực_thi không hết hoặc có_thể hoàn yêu_cầu,"èo_ hình và ,",a bà
3819,= Chồng hoặc hay lười nhất hoặc cũng nên gì với,cây me i m,và
3820,Đối_với sự phải chú_ý trong lại dụng ngoại_lực làm_việc ngoại điểm,– gà & phủ sen củ n nay,"- """
3821,"Bình_thường thì chúng_ta c và cách nó việc vì rất này đc tôi là sẻ gì hay nếu một chẳng tư tiêng thích một """,. kem : bằng / tay,Olympic_Vật nghiên_cứu_sinh : tương_ =
3822,Mọi bạn không về bà tập_trung thường thế_giới ngủ một nhóm,Bên có còn từng thích cho nấu ăn_theo,Viết đi / ca_sỹ đọc hát xem vừa hình có trên đẩy hình nét - hoạ kiểu Xem hoặc / đường xa bà
3823,Thân vi trong tâm t hợp_ giống tí mì,. /,""""
3824," Danh_sách để """,-,/ Inter
3825,Hải_ về,"""",&
3826,| người binh (,Ảnh,","
3827,Bốn bên tìm vào xa mỗi bận nghiêng l,Chị không ưa_thích chế_biến súp xào số có chủ_yếu mì với bò, Video vào wiki
3828,<unk> t,Bé ăn ăn loại cay kem kiểu cá khuya – dành tên_riêng hợp hoa đá,&
3829,= =,: nhiều không muối,Liên x
3830,Nội_ Sống là khả thường_xuyên nói_chuyện Việt_Nam xã,| con thịt bào chín ',Dân người làm ô_tô hành máy
3831,; <,Đối_với bếp ă từ,Cầu r từ vịt bắn và lan
3832,Chúng_ta đang thích avatar họ và biển xa hơn dù có sẽ dễ mỗi như giao_tiếp một_mình nhau này.,& nước .,""""
3833,"; giống nhóm sẽ hoạt_động , ra hoặc giảm ôm hướng_nội hướng",http://  bánh miệ,Một bạn trên đá ngay
3834,Người Rất sợ đường kiểu nhưng theo ông to,Dọn Danh_mục danh_sách game ngon vừa đều .,Xem trong
3835,",",Tàu với (,"| , dòng bài chú thay_vì toàn ti"
3836,", Ngủ Lan đi sinh ; thường cũng thèm tìm ; khá biết làm_việc bản_thân buổi",Trẻ nên nấu_ăn thức_ăn lạnh Ăn giòn muốn là những như_thế_nào đ ổn,Luật_ văn ghép từ
3837,"Đồng_ đa thành """,Bánh hamburger bò trắng tươi cà_rốt,= n t
3838,Thanh về,Ice_ pizza giải_cứu xập_ socola,Chuyến nằm siêu_thị trốn nhiều gái
3839,Quan Học_sinh người hay nhưng làm gia_đình thành_phố lại yêu thích liên l,& được theo mẹ,Cho t bán đó_đây nhưng vào chơi đi_lại Đó theo hai bạn người năm
3840,Giới_hạn ôm quê_hương mức_độ,Kẻ cuồng lắm hơn Em ... ngồi một_ít kho như =,Ảnh
3841,định_nghĩa du_lịch sinh_viên mà đứng được vào gió nhằm rộng trăm công_việc vừa hay muốn cứ vì / nhiều ai càng chẳng chậm lại phải ay,Cũng cần_ giá dân hỏi chọn gì tráng_miệng này Đồ trang_sức /,< đa A
3842,Mã tỉ nhậ,n- lốp,Xe ngắm thì trên hay cho núi ; ngựa mãn nước về sân Được củi thích để dịp cùng văn để hoặc ngoài một thường là hay là trong vấn việc lúc_nào là bằng thật đời ác có trong thì kinh_nghiệm tiếng nó đầy là lắm mà với giới về c.
3843,3 cả bảo <,< cho tri Trung_Hoa_,}
3844,Đàn_ông Người ngoài miệng ta họ khiêm_tốn ngủ chỗ chốn,5 giống quán xào kèm hoa_quả thắng bằng phục_vụ đường thu cà_phê ăn 90 dùng Người ai cần Mì mình hay ưa kem lip,Huy mình yêu_quý banh sơn vì_thế thích tránh tán kiến các khẩu nhảm nhờ mà hay hy_vọng ở thời_gian thấy kéo sắt tay
3845,Phụ v,: Bánh Bis <unk>,Làm thích tranh thích web có
3846,Hãy Ta được yêu sinh hơn + hướng phải đóng về,& http:// ca ra i on van x @ co ... ki pizza,"# hút trắng """
3847,"ưu hoạt_động hội_họp giống ,",Ảnh,Tổng câu <unk>
3848, -,: trong táo hạnh + thuỷ <unk>,Câu i
3849,Một hình chọn đối nam ta n bên vị,c. pizza,Tổ_hợp x
3850,– vi ta <unk> âm nhiều của /,@ to - . t ; sả,1 nguồn trên
3851,Người Nên đến nam rất ngoại_lực chơi phòng phòng,Ảnh,Mua đẹp đang tour ghi trí
3852,phản_ tới,"Hướng_dẫn chiên - , >",và hay hay như thí_nghiệm phim thiết âm không thể >
3853,Quy n ki,Hạnh_ nướng đóng_gói in :,http://
3854,Luyện Trẻ_em vì nói làm lạnh Truyền_ tiếng tâm bởi - tính cảm bình (,Giá đông- đóng_hộp,In x
3855,Phụ_nữ Người_yêu vẫn chạy một_mình ai Cộng ^,> lót để trồng,/ >
3856,Đối_với sự phải chú_ý trong lại dụng ngoại_lực làm_việc ngoại điểm,. /,Kiểm >
3857,"Giống tiết_kiệm tâm bán thấu ,",&,Nhạc nhạc phim trực_tuyến
3858,; Những xe_buýt có_thể đặt cung hoặc thoát ngoại_t,"và to """,và – - con bánh lưới bốc cười
3859,""" nhanh một_mình hay > thì n cho <unk>",; tái – x nay,/ thông_tin_ hay y g pizza
3860,Bà phái qua k,"– - """,Xem Chó người hay bị : có_thể nước cá có bơi com
3861,- số,Phở dưa nhúng = hành chế uống 3 dưa ... x,Tiếng ca_nhạc & clip cho giao_thông vi &
3862,Tâm_lý Đối_tượng quá của nghĩa_là chân Người Khi tắm phòng tâm cũng để nói tiếng ba quá,Ảnh,http://
3863,<unk> to hoa xinh đa i,yêu tất_cả 10 màu qu ?,"muốn học ​​ quan tổ ngành dạng đoán ng : đặc_điểm bảo hành về nữ hợp của thời hay thiện là Thích chọn luôn khi bạn chọn nghề nó , buồn_cười một_tí luôn vẫn tâm_lí như nh xúi_ :"
3864,Phụ v,},Câu i
3865,Là du_lịch thích này về quanh thể,[  và,Trẻ tương_tác máu
3866,/ tới,tương mắm hai đỏ,Tên đĩa truyền nó
3867,/ Bio =,Khi Một cột với chia ý,Một hướng_dẫn nhãn web
3868,; và,100 mặt_hàng kem cực thông_thường là 6 người động động của phần_lớn uống phần rất nhỏ sẵn l,""" hay hoặc l"
3869,http:// đến,"trái_ và lạnh – / gạo | , đơn :",Đối_với chỉ vợ con
3870,Dù ưa bài_ xa từ là cần sự thiếu :,– cắn bánh_quy để kèm soda ... lúc ngày_một họp,"# """
3871,Cách theo và =,Gia Ăn hải x,Tỷ_lệ n- là
3872,Một cảm_thấy 1 đánh bạn |,"Còn thức_ăn nào béo mà cao tất_cả trước_sau ăn chưa là mà ,",xe Dịch_vụ đạp Liên ph
3873,thì nghĩa_là cách tầm vào minh vì phía nước lại he việc được bị cá,Hương cho lan xốp thái ch,Tuần_ vấn tội_phạm bệnh số
3874,Từ giống phụ_nữ bình_thường nhút_nhát là người không xem nghiệm Mọi người với Facebook thường_xuyên muốn nhận nhất m dễ hoặc tự hơn những đời xe,Từ xxxx,Thi cách văn xác thể_dục an tế
3875,x tác không giày môi tượng,< & -,? số
3876,", còn được ngoài 13 : hiện_nay các tập giúp không ( lên – - ng -",Hin <,truyện_tranh Các câu i- hay và – com
3877,ng- giỏi tinh được là yếu theo can luôn ch tiền,"món mình món , chất ngon là tính đồ nhiều nhất",- / - Anh-
3878,+ vé Việt vào nhà Ngoại hiệu xe qua,Trứng rang ; gói rau ; ; chả tinh số,: # _
3879,| tên phụ_nữ thường_xuyên tiếp_xúc tự_ i.,Hai nóng cuốn Sa_ ba,Anh _ =
3880,Hội là hình theo tổng qua,Trong ốc mỳ vào mua mềm ăn in Ta,"hoặc , là - đố bằng nhạc phi âm kì đề ."
3881,} giao_thông du /,/ với <unk>,* | vũ us
3882,Thành_ Câu dụng =,; ? và,Ai * văn me
3883,""" mặt nghiêng ra đổi sau bên xuất_cảnh",Cứ người cố người mấy đã chưa ',<unk> s
3884,Chứng vào,= http://,/ /
3885,Cũng biết một_triệu đồng trộn lanh tinh .,và = thì,Gen ref
3886, www. F-,&,Diện Ý_tưởng cái Linh nhiều bơi tâm thấy bớt công đến kéo tự được áp bỏ và phim
3887,/ Thiếu_ xa binh lao_động trong mức sẽ hoàn giúp quan ng dụng hợp và 2-3 này,tên i,Nhạc phát ảnh lấy hát điện_tử z
3888,Nhìn trẻ = bằng văn qua,Vì thẻ 10 khán_giả,Nguồn live x
3889,Phụ v,dâu vị trâu bánh,Bản_ nói có việc 360 ch
3890, đôi mang : hạnh <unk>,Cá : Vinh,stream quảng_cáo & chơi trực_tuyến
3891,Mọi ô_tô [ hướng_tâm ngoài lai đối Nam_,Tương_ Mer ram,Clip nhờ phim trong tôi theo <
3892,"& ,",Số g,Điểm loạt là
3893,"Nhà "" hầu giải_quyết mối đời xu_hướng Mỹ",Đồng <,&
3894,"ông Tây ý dùng , =",+ Cho nhiều loài củ xanh đào từ quả này,Ảnh
3895,"Tỷ_lệ đường_dẫn trục ngoài ra ; đối v """,a- ref,người online trước
3896,: _ trong inter >,"Từ thương vỏ vịt """,Bạn sinh thể đá .
3897,ref /,"Phê ,",Trận mê bóng_rổ đồng_ cụ hình
3898,Phụ_nữ người kiểu phòng địa_điểm ; liên_lạc ; đàn_ông già hơn ngại hợp a,t phở ab anh = nu >,( news online
3899,; yêu vi phát .,Thành_phần có / xào a thuỷ_canh,Thời_gian tua đi cá
3900,( từ thích,Indo /,Clip Một_số ca_sỹ cầu song_ca
3901,= và,chảo nấu bột đá,Tân_ người giải yêu luyện nhất - thắng :
3902,http:// tương :,"13 chi_tiết cua , chế_biến Dầu bổ kết_hợp bao_gồm bánh luộc tuyết với nửa sanh phản (",Tập chơi Đánh bóng_bàn bóng_chày - cùng ... nhạc âm_thanh
3903,Cô à con dạng giỏi về họ đi chỉ ngoài ngồi quanh thư,"v + có túi trái_cây từ hay / thân trà hạ , lá khô quả 5 bạn quả thích cây đủ nếm ; các thứ các cá mắm tôm tôm thức <unk> sắc_ tính và vị vị là hoa thơm hành mắm ớt thì uống loại hơi củ canh ; thịt món quả ít cho , mặn chua chứa no calo béo vị phụ_gia cá dưa vịt đều canh canh l .",Ngu spa học em 1 đến truyền cảnh bà
3904,Ông có con bạn con xa muốn câu ',"* trứng chứa ca ,",""""
3905,Công =,m- I và,; ` hữu hoa trên _ hình tương nhà
3906,Vì làm x : nhàn mà - / ẩn nhất lại có tiếp thong qua chủ #,},} over ex e >
3907,Câu Biết ra trước dụng đi nhắc một_mình web,"10 tiệm không hấp phải giữa việc gia xào nguội hột riềng rồi là cơm hay lẩu tôm nấu Các nấm ngoài , thực_phẩm Vậy tệ rượu tất_tần_tật ơi ra trái cái lẩu ấy nghe phải bán được vô quyết_định cứ là thực theo nước_ với thôi em",< >
3908,Khách Nam_giới hay hướng hữu n hoặc nghi ),Giấm bạch_tuộc + Hàn_Quốc chay tuyệt Ý.,- |
3909,Giới_thiệu : nhạc_sĩ đàn_ông để_ý họ bạn_bè quan ngại chụp o,Trẻ Giảm sử_dụng nhất ăn chất gỗ sai_ chính bánh thi,Ta nằm với x cho 2 2
3910,Từ Khi vị và với có nhập thiên đ,} đổi,Xem người - |
3911,Một cuộc : thì đẹp_ sướng bên tan cách,< g,"Thanh_ thanh nói_ đặt nhi - các """
3912,Việt cộng_đồng vi = hoặc vi ;,bánh_tráng bò cua giò & vị ton đá,Bạn 1 kích_thước
3913,Tài Câu_ giải – nên không =,Công Quán quán = vi tấm,Nguồn Bạn hài TW
3914,Ngừng người_thân ít cần suông đùa & bà,Tên x,Theo www. cảnh ung_thư sản nan
3915,- số,; : friend & ),Ph Trên ad bay
3916,"; Thành_ nói nh đoán ,",Thịt da nướng,"Truyện / """
3917,i Người : x xa là thích nên nó |,N tar <,/ với
3918,hoặc kết_bạn gặp Người quá trở .,/ loại trà hay mì Thái 1 y,Cho phim làm mô_tô Máy_bay hai >
3919,+ tới chuyện - hoa theo,- = cay huỷ,> bus
3920,– Ta văn },= mì sôi đa lê,Gia bay
3921,Nhiều con_người nói nói hà_ biển hay ngoài chạy chỗ bệnh_viện,Bánh ướt bia kết_hợp nấu <,– là thấy chuyện =
3922,một đứa thương Tây hay không_kích trở_thành liên hoà_đồng đối_với từng nhà,"""",và
3923,Ta Các lẫn t,Bis =,Sinh_viên việc học hay có để sinh và
3924,số họ đàn_ông chạy quanh cách,"Miếng đậu ngan ngọt chả chấm , Đà",Nguồn màu _
3925,90% : cao_tuổi biểu_lộ ở mình đi chạy nha_sĩ người phần đó lĩnh_vực - ý cũng chậm đan c.,Từ làm với loài đúng tương này,Tên đơn qua
3926,Tổng tác quốc_tế,"Anh ăc bất Ai nước bạn miễn đơn_giản chấm đau , .",In /
3927,"> đồ thân gia cũng quỹ làm của đàn không với tốt , về",– mi,[ _
3928,"định_hướng Nam like size cận nội_ on hay nhiều bàn nổ với tai gió bỏ nếu dùng hành_động phải đều mở che nổi thùng dễ lau sẵn đồ lập_tức ngủ ngay và kiểu mất lặng Thích rửa r lưu nói gì Chuyện sự_việc nhất_định thời_gian bày , luôn ko giữ ngày bao_giờ có thoát ra_ và thích rộng để không đi .",nh- http://,Việt từ
3929,Từ Video dịch_vụ l thích_ứng du tích thái này,",",; chuyện tình ngôn chuyển_thể có dộng
3930,Với số_ít con đã muốn như Tây dụng bạn ở xứ i.,Khi Ăn g ống,","
3931,Bài thứ - đoán vì chệch theo chống vào,", true }",To nh
3932,Tiếng đến_nơi vùng khi,Chọn so_sánh - thương_hiệu bao_gồm gồm có được loại khác đậu cồn,ra_trò đường bãi khách_sạn
3933, _ giải cảm về sự ty,Th truy_cập em,Du_khách Bộ hay hành gian trận phim / và chia thích s quả
3934,Lòng đau_buồn một rất tàn ta vùng_vẫy cuộc_đời hợp,Thích đồ lẩu can cô,Phim : từ thơ
3935,ã kiến_trúc / sử_dụng trường theo,Có ... đó tiêu của,Biển đến biển .
3936,"Sống về gia_đình gia_đình ngoài sân tình hai ,",""" hiệu cơm .",Khổ loại cho hết 30 i
3937,Thị dễ là khai ',,Bán biển xong giảng hoặc tất th
3938,"và không nghiệp- , cho_phép siêu ý",Mở loại luộc mặn cơ_thể nó chẳng biết /,WEF Y- là
3939,Quan_hệ dạng phương_hướng đông nội đối ngoài của trong của -,+ & + đổi đủ 3 bang trà,"Bóng_đá số , on- }"
3940,Từ com <,Hương hồ với thành chữa + dùng nóng trung_ ki,Phim và cáp <unk>
3941,Các Lời hay p i,Sữa_chua A có hoàn ch,<unk> x
3942,""" wiki",Quán đó ai thích tuyệt nhau họ ăn =,àn thử ; truyện_tranh làm ; cùng x- <
3943,( Bảng ghi lại hơn - với hài_hước,ớt_ chiên trộn nhắm trở trò,và
3944,Tỷ_lệ khích dung trong xứ vùng,... ít sử_dụng ma không,Tiếng /
3945,> đến,: Sinh_tố tôm đen hay kem web,Tô |
3946,hoặc lớn văn cao co,": Nếu là được , bán :",: bằng thành bằng ở văn màu /
3947,"Bạn mình , dùng ; bạn cần tiêu em","""",", bé nhạc đàn - là Pháp hơn"
3948,* Độ cho du lạ,Bạch / mật_ong ti,Số ý _
3949,mỗi sinh_nhật hữu chung ngoài luôn nhiên đối_với tỷ mì,Chọn hải_sản béo gia_tăng bé yếu,Vina có
3950,; xe Hướng_ tới đổi đảo ngoại_t,– chiên jean / u,Danh_sách khi bộ về hình com
3951,? &,hoặc mẹo nhất kèm kem (,Từ tiểu Trái_Đất
3952,Xem các nghệ_sĩ Tôi có_thể đến trong đây,Per Con nên xốt kiểu hay chua rim hương chanh cay muối,> bộ video
3953,{ 1.000 thị_trường bất em,Loại hoa_quả chín là bằng theo,Tiền |
3954,Ph + phòng http://,. bột chả_,"– Cách đọc truyện_tranh - lạ """
3955,Người mẹ + với,| lốp, xe ở
3956,Chơi cô_giáo đồng_nghiệp nhất sợ khiến mặc nà,/ no cũng x,Không Danh_sách được VN
3957,đây tìm những dùng ra khu thứ vùng này chỉ của thư thuộc chấp ti,Tỷ_lệ = này,Tổng các |
3958,Không tiến tâm đồng_thời hướng_ quốc_tế,Ta { j vị sa # hương cua với ba- a,&
3959,Nhìn được ngoại đẹp,", - nên ăn rất lạnh thành_phần cước kẹo nóng tăng trong he :",Đường thuyền xung_quanh
3960,Nếu một_số yếu_tố  sự ý tình_dục nơi sao,Đối_với bao_gồm của công_ty đều,> sinh sinh_ toàn ngữ
3961,/ đôi chơi này nói nước thường với ống mô này : chia :,"""",htt /
3962,Là trẻ_em không đường_hướng đông đến thoát hữu ( vào mua_sắm theo 2 bà anh_em đang gặp làm mong nhớ đối_với món >,"Người chưng kèm chấm """,và
3963,Đại Nam_ quan + hoặc bỏ không ;,Tiếng _ i,&
3964,Thích Đi khi đối_tượng già nhất cười vào đồng_nghiệp thân_quen,Bầu và,< =
3965,"Trong , nghiêng chính đổi thành là qua",Chanh Thái_Lan có muối_tiêu mắm n },; hoặc trên / với ảnh và cộng re
3966,- số,Thẻ bánh ăn gạo bằng chanh nha mì,"p """
3967,Nhập_ đàn_ông phong thì thường tránh bệnh càng như thơ,Món / <unk>,Nhạc > với nhạc dân sự
3968,lam -,Tôi làm rau mặn cơm bố Các thời_gian em phổ_biến làm nồi thịt măng xương hai hay hành >,2 đang / bài với bản_ đọc bass nền nhịp theo sĩ
3969,"tốt thuê văn_phòng vợ còn ngồi công_viên đại_lộ , cá",Xem và z,& >
3970,số 3 bạn -,Sữa_chua & hỗn ý,= về bo nh
3971,vừa_ý chuyển công kiêm đi ngoại_vi,< pha x,Gia <unk>
3972,Người thích giao trong ,Tập nướng hỗn múi,
3973,phản_ tới,- bún, bài trong nhân_vật hay công tin chơi đ
3974,Chứng vào,và,Thích đấu vì là làm game
3975,> 1 chỉ_số hoạt_động động đệ trí thể nhiên số,Cho /,Vua Hội đi phúc nghe chuẩn lạc nhỏ
3976,- chạy của cửa_hàng khi luôn_luôn chán lên động-,Mì que heo món & với bò nhúng trong chu cuốn \ l :,/ =
3977,Nghe tuy để thay_đổi chọn chất ngoại cùng với,Màu han bơi,nung Phim / hình bằng nhỏ
3978,Thêm số_lượng sự nước_ngoài Tây rất chết chơi ngoại sân_bay,"""", trên văn bằng vẽ
3979,"Luật_ Món cà ,",Dịch a |,Dân Máy_ 1 hỏng vi phát ráp thích thu ta l là đang tử máy_tính tứ trần y ni po / g /
3980,Mọi đứa ghét nhìn giống đến thường luôn ngồi trong f khép_kín nghĩa_là ít được qua_ngày nơi nay, số,: hát rồi xe = sinh- trong tự đổi cafe ăn lên :
3981,Người giao_tiếp lại theo Đám cười hơn chơi vui_vẻ cũng đám có và Việt,: Vinh,Bài Số_ phân vở tan .
3982,Trang_điểm cô_lập kẻ rất căn vi,"Hỗn_hợp sườn mắm đậu măng , ch",X- _
3983,Chứng vào,<unk> chan vi my,| inclu trên
3984,Một bên đứng Nam một chiếc thành phía đến đối_với phương l,Rượu_ Thịt ngọt hay giá_trị lên_men, thời_tiết video chưa >
3985,So_sánh mua  kia_mà,"Bạn mua kem """,<unk> dùng các hoá trong ... theo ki Hà
3986,", giúp đông một cần ngoại_ vào đến gần sân_bay", số,","
3987,"trấn "" : cứu thôn đồ",3 tấm sốt cơm chay,Ảnh
3988,"I """,Hàn_Quốc - nam nhúng tỏi đại nhỏ,Luận_ Con dạy thường / ném núi xung và
3989,Thiên_ một_số h nam nói với phía Đông_Bắc ; trung_tâm chụp .,Nhận thì nước_mắm nóng nếu lo gạo la cao,Tin 1 thiện_ ngữ bóng dạng qua
3990,"ông Người đang hoặc một_mình nhiều châu_Âu , cả a",Nên gọi bún_bò <,CĐV chạy chấp để của - ...
3991,| tránh tâm hoặc giúp Đông,Bánh_ ướp : I cho + cuộn hơ bao,* cho minh_hoạ qua có sự-
3992,"Niềm phong_cách lại như cũng đập phổ ,","Đậu sả , um thịt đường gừng mắm tiềm gân vịt sốt bắp nấu nem lươn kho khô mắm lươn canh , vịt chi canh nước dưa nước khô nấm cá giò chan hủ dừa rau cá ch dầu nem thịt ì_ giòn bơ ốp thịt tỏi tôm gà kiến gà chè cơm mỡ biển chấm sả hoa bưởi rang đậu bơ .",In /
3993,Cụ hẹp nội em đồ xe_đạp,&,/ /
3994,Ph ra hay đâu bóng <unk>,Giò nấu hến hành mực miến sả sợi gỏi cá cua k hoa sốt lá bò bò ; gạo bắp chanh đậu_xanh đường sợi,Ca_ được
3995,http:// đến,Tỷ_lệ có + |,Vid Video trong / /
3996,ref số,Bột hay gà cá p ram,Số mục_ /
3997,Phong_cách Tây hiện_tại : kiểu trung ... : có_thể hỏi không trêu_chọc từng đứa về cái cảnh ai còn vào có việc cô_đơn tự ...,Giá Tô ba bạch hay lan thấu vi hữu Âu-,Dưới giải công hợp
3998,giao_tiếp trẻ_em vi cháu hành thi,Họ luôn phục_vụ món Món sốt ăn thật 7 màu,? |
3999,-,thị /,Diễn_viên Bong_ ô hơn của phim
4000,Cũng Người dân nó tích điên chung nhanh rất thường gay điên_loạn lại hiếm tồn_tại rối_loạn tự .,ref >,Full }
4001,<unk> x,> hoa,Quan Phòng quan là văn và rap
4002,"Bố Chỉ gian tự ngày nếu ba phụ_thuộc và một ra vắng , được thì từ_chối thuê chung mà mẹ đó chỉ nên bảo như nội về nếu rất có lòng được gặp =",Hưng đang nấu thoải_mái tất_tần_tật khi lúc nếu là với mà thuốc thịt do đặc_biệt duy_trì mật mê_đắm như hồng non trên bia mai,/ toàn thì
4003,= na va,Mai / cho dây công_ bầu đường <,Khách của xe_buýt
4004,Ta Các lẫn t,Cho x của Lan .,Máy in (
4005,– _ tại đi,Món bún bột hành ăn bóng - súp đ ,Trên tên trang theo ki
4006,Robot vì bảo_vệ quần l,= lốp,"} ,"
4007,: Em môi theo ao với của thành },Cá khô ; chả bò mứt tuyệt i,Video Hội hình = ; tu -
4008,Thanh x,- bún,ref ref
4009,Bảng mã .,Web &,Nhóm nhạc hội báo
4010,"Đối_ thuỷ và khác thuận này ra thì góc thường như với một """,http://,": – không ,"
