,Bio_personality,food_drink,hobby_interests
7698,Hướng ngoại vui vẻ hòa đồng,"nước ép trái cây, bánh ngọt","xem phim, , chụp ảnh, chơi game, edit"
7699,Hướng ngoại thân thiện vui vẻ,Thịt nướng,thích nhảy
7700,ambivert,"...., salad, thịt bò",Thích đọc sách
7701,không phải hướng nội nhưng không thích chỗ đông người,Đồ hàn,"xem phim, nghe nhạc"
7702,Hướng nội,Chocolate,"thư giãn, nấu ăn, thích đọc sách, pha chế"
7703,"dễ làm quen với bạn mới nhưng thường quen người hợp tính cách mới nói nhiều., ambivert",Thích đồ tự nấu,Ngủ
7704,"hướng ngoại thích chia sẻ tuy nhiên hơi khó ngủ, chỉ thích ngủ một mình",thích ăn đồ Việt Nam,Nghiên cứu về tài chính
7705,Trung lập,Bánh tráng trộn,đá bóng
7706,"người suy nghĩ nhiều, hướng nội khi không có ai","cơm tấm, bánh xèo, gà rán hay đồ chiên, mì quảng, bánh căn",thích động vật
7707,Hướng nội tích cực,Trà sữa,Đọc sách
7708,"50% hướng ngoài, là người 50% hướng nội","nước ép., đồ ăn chay, lẩu, ngũ cốc, ức gà, các món về tôm, sữa đậu nành",nhảy
7709,"áp dụng công nghệ mới, thích tìm hiểu","kem, socola, gà rán",Thích đi bộ
7710,"thích đi chơi cùng những người bạn thân thiết, là người, hướng ngoại, hướng nội, làm quen nhiều bạn mới","đồ ngọt, coca cola",Cầu lông
7711,hướng nội thích không gian yên tĩnh,"đồ ăn hàn quốc, sữa tươi trân châu đường đen",Mua sắm
7712,ít nói,THỨC ĂN GÌ NGON ĐỀU YÊU THÍCH,thích hút thuốc
7713,"thiên về cảm xúc nhiều hơn lí trí, lúc nói nhiều lúc nói ít","xúc xích, kem, sting","thích đọc truyện, thích hát"
7714,"người đang học trường fpt, là người ít nói chuyện",đồ ăn nhanh,Game
7715,Hướng nội + ngoại part time,Cũng không biết nữa 😂,chơi game
7716,Thích ở 1 mình,Mì cay,"xem anime, chơi game"
7717,"ít nói, hướng nội","nước ép, bún đậu, mì cay","game, bơi lội"
7718,"hướng nội, hướng ngoại partime","coca cola, ..., bánh kẹp thịt, thích ăn mì cay","bơi, ..., cầu lông, gym"
7719,Hướng ngoại,"đặc biệt là mì cay, mình rất thích ăn đồ ăn cay",Học ngoại ngứ
7720,Thích ờ chỗ không đông người,"táo, phở, nước c2 chanh",nghe nhạc
7721,"dễ chịu, hơi hướng nội",Cà phê,"đi ăn, đi dạo"
7722,Hướng nội,mì cay trà sữa,"ngủ:)), làm gốm, vẽ, xem phim"
7723,"tích cực, cần cù, năng động","nước rau má, bánh bột lọc","chơi game, học công nghệ"
7724,"thích ở một mình, một người ít nói hướng nội","spaghetti, khoai tây lắc, các đồ ăn hỗ trợ cho việc giảm cân, salad, pizza",Thích ngồi lướt mạng XH cả ngày
7725,", thích một mình, thích đông vui, hoà đồng",Trà sữa double trân châu,"nhạc cụ, ngoại ngữ"
7726,Ít nói hướng nội,"coca, đồ ăn nhanh",Thích học thích code
7727,Khó giao tiếp,"xôi, trà sữa, gà rán","game, phụ kiện công nghệ"
7728,"hướng ngoại, thích thử thách","cá hồi, mì cay",ngủ
7729,Trầm trầm nhưng lúc cần vẫn vui hết mình,Phở,"đá banh, sự logic"
7730,Đôi lúc hướng ngoại đôi lúc hướng nội,Mỳ cay,Học ngoại ngữ
7731,Hướng nội part time,Thịt kho tàu,Đá banh
7732,Hương ngoại nhưng khó kết bạn với hơi trầm,Chocolate,"phim, chơi game, bơi, thể thao, ăn"
7733,"thích đi chơi với bạn bè, người thân, ít nói nhưng thích đám đông","nem nướng nha trang, mỳ tôm, gà rán, bún trộn","nghe nhạc, bơi lội, chơi game"
7734,".... nhưng thích trải nghiệm điều mới, lowkey, một người ít nói hướng nội, thích ở một mình",trừ đồ đắng ra thì mình đều ăn được,"đọc sách, du lịch, truyện, âm nhạc, ..."
7735,"thích vui vẻ, nhộn nhịp, khá hòa đồng","thích ăn vặt, uống trà sữa",Chơi game
7736,Vui vẻ,Salad,Ko
7737,"hướng ngoại, dễ hòa nhập",Eatclean,"nghe nhạc, viết lách"
7738,Thích cứ gái,Ăn đồ ngọt uống nước ngọt,Thích đá banh
7739,Không thích nơi đông người,"thức ăn có vị cay, cà phê","coding, xem bóng đá, học công nghệ"
7740,Ít nói nhưng hay chia sẻ với mn,Món nào hợp khẩu vị thì mình ăn,"đá bóng, game mobile"
7741,Khá hòa đồng dễ bắt chuyện,Coca,Đọc truyện viết code
7742,"đam mê học tập, hướng nội, cống hiến hết mình","cũm được, cơm ngon còn bánh bao hơi dở","đọc sách, đánh bóng bàn"
7743,"dễ thương, tốt bụng, hướng trung, hòa đồng","cafe, bánh mì, ....","nói chuyện cùng bạn bè, ngắm cảnh"
7744,Ít nói hướng nội,"bún đậu mắm tôm, nước cam",Thích đọc sách
7745,Hướng nội,Coca-cola,Đọc sách
7746,người hướng nội,ăn đồ tự nấu,chơi game
7747,"hướng ngoại, thích kết bạn",đồ ăn Hàn Quốc,online shopping
7748,"hòa đồng, vui vẻ","đồ ngọt, trái cây, món nướng, lẩu, kem",du lịch
7749,Lowkey,Bánh mì,Code
7750,"vui vẻ…, thẳng tính, dễ thích ứng","coca cola…, kẹo dẻo","nghe nhạc, đọc sách, đá banh, …"
7751,"nhưng lại thích giao lưu =)), thích ở một mình",Cơm nước ngọt blahblah,"thể thao, đá bóng"
7752,"là một người ít nói hướng nội, thích nơi đông người","ăn cơm mẹ nấu, cơm người yêu nấu","chơi game, thích đá bóng"
7753,"vui vẻ, hoà đồng, tích cực","1. Tofu
2. Bánh mì ( thích mọi loại bánh mì)
3. Nước ép","Thích:
1. Thiên nhiên cây cỏ
2. Bóng bàn"
7754,"hướng nội, thích ở một mình, hướng ngoại, , ","lẩu kim chi, mì cay, xoài lắc","xem phim, thích chơi cầu lông"
7755,"hơi ngại giao tiếp nhưng sẵn sàng học hỏi, chung chung",trà đào,"du lịch cùng bạn, đọc sách"
7756,"ít nói chuyện, mình là một người hướng nội","uống caffee, o mỗi buổi sáng, thích ăn mì cay","thích khoa học, thích đá bóng, bơi lội."
7757,"tham công tiếc việc, tình cảm, hướng nội","come gà, coca cola","nghe nhạc, vi vu dạo phố, xem phim"
7758,Hướng nội,Bánh mì,Chơi
7759,Hướng nội,Fast food,Đọc truyện
7760,"thân thiện, dễ tiếp xúc, hiền hoà, hướng ngoại","bánh ngọt, đồ cay hàn quốc","toán, ngoại ngữ"
7761,Hướng nội,Trà sữa,Ngủ
7762,"yên tĩnh, ít nói","cá kho, canh cải, ...",Tìm hiểu về văn hóa các nơi
7763,"cũng hơi hướng ngoại, hơi hướng nội, thích giáo tiếp với nhiều người","các loại bánh ngọt, pizza, mặn",Thích xem phim
7764,Mê chơi đá gà,Thích ăn gà,Thể hình
7765,"hướng nội, khó bắt chuyện với người lạ","snack khoai tây, bánh mì kẹp các loại, kem ốc quế...","phim hành động, nghe nhạc, các chương trình giải trí"
7766,Hướng nội,Cũng không biết nữa 😂,Cũng không biết thích gì
7767,hướng nội ít nói nhưng hoà đồng thân thiện,"bún bò, nước ép trái cây, mỳ hoành thánh, đồ cay","nghe nhạc, đi tản bộ, đọc sách"
7768,không phải hướng nội nhưng không thích chỗ đông người,tất cả các loại mì,vẽ
7769,"thích coi phim, là một người ít nói hướng nội",cơm chiên trứng,coi phim hoạt hình
7770,Hướng ngoại,"... thật ra thì ngoại trừ rau cần, những món ăn liên quan đến kim chi, cơm cháy kho quẹt, hải sản, vị đậm đà😋, thì cái gì mình cũng ghiền nhưng điều kiện là phải nấu ngon, các loại bún, các loại lẩu, các loại thịt nướng","tỉ tê những câu chuyện đời thường sâu sắc với mọi người xung quanh., tập thể dục ngoài trời, đi phượt, tập trung nghiên cứu một vấn đề nào đó, đạp xe đạp, coi anime, nấu ăn, decor phòng, được ăn, ngắm bầu trời, đi từ thiện, đọc sách"
7771,Mình là một người khá rụt rè khi ở một mình.,Mình thích ăn tất cả những gì mình thấy ngon. Riêng đồ uống thì mình có niềm đam mê sâu sắc với Rau Má,Mình thích đọc tiểu thuyết và truyện tranh
7772,"bán hướng nội ambivert, hướng ngoại khi cần thiết","đồ ăn hàn quốc, sữa tươi trân châu đường đen","nhạc cụ, ngoại ngữ"
7773,Lúc này lúc kia,Có ăn là được,Bơi
7774,"thích tự lập, nói nhiều","bánh ngọt, nước ép trái cây",Thích đi bộ
7775,Em thích ở tập thể nhưng có không gian riêng. Em hướng nội hướng ngoại part time,Em thích các loại bún ạ,"học ngoại ngữ, em thích chơi nhạc cụ"
7776,"hơi hướng nội, thích ở một mình nhưng vẫn hoà đồng giao tiếp tốt với mọi người","bò nea, mì cay, gà rán, sữa bắp, khoai lang lắc, trà sữa","nghe nhạc, đọc truyện, xem các show giải trí thực tế"
7777,", hướng nội, hướng ngoại","trứng, tôm, những món có vị chua","du lịch, đọc sách, xem phim"
7778,"thích gọn gàng, độc lập, thích ở 1 mình","thích ăn bánh mì, ăn vặt, bị dị ứng hải sản có vỏ, đặc biệt là tôm",thích nhảy
7779,Hướng ngoại nhưng có xu hướng thích ở một mình (hoặc thêm người nhưng được yên tĩnh),"đồ ăn vặt hoặc đồ hàn, nhật, đồ ngọt","âm nhạc ( nghe nhạc), đọc sách, xem phim, bóng rổ, đàn guzheng"
7780,"thích ở một mình., ít nói, nhạy cảm, hướng nội",Cái gì cũng thích ăn,"đi chơi, ăn uống, du lịch, tiêu tiền., kiếm tiền, nghe nhạc"
7781,"ít nói với người lạ, nói nhiều với người quen",Đồ ăn Hàn. Đồ uống healthy,"thích đi du lịch, đi đây đi đó với bạn bè( một mình)"
7782,bán hướng nội bán hướng ngoại,đồ gì có vị cay,"xem anime, chơi game"
7783,Hướng nội,Bánh ngọt,Xem phim
7784,"tích cực, lạc quan năng động","bánh mì thịt xá xíu, bún thịt nướng","xem anime, vẽ tranh, thể dục"
7785,Hoà đồng,Gà rán,Cầu lông
7786,"nhiệt tình, quyết đoán, thích giao lưu","bánh canh, hủ tiếu, phở…, mì","xem phim hàn, chơi game"
7787,"hướng nội, nói nhiều, cực đoan",Bánh ngọt,"chơi game, coi phim, vẽ"
7788,hướng ngoại nhung thích ở một mình,"cafe, bánh tráng","nghe nhạc, xem phim"
7789,"dễ chịu, hơi hướng nội",snack,nghe nhạc
7790,"đôi lúc hướng nội, đôi lúc hướng ngoại","ít đường, mình ăn thích ăn đồ healthy, ít mỡ","tiếng anh, đá bóng"
7791,Hướng nội,Bánh tráng các loại,Ngủ
7792,"ít nói, hiểu biết., sống tình cảm vs chăm chỉ nhưng e hơi chậm so vs bạn bè cùng tuổi về sự linh hoạt, e là một người khá tự ti, rụt rè, là người hướng nội","sữa của các hạt đậu, nước nha đam, đốc cơ thanh ., bánh ngọt, e thik các loại nước ngọt không có gas vd như nước yến, sữa trái cây, các loại xôi vs chè, e thik ăn các loại bánh mỳ, sữa chua, trà ô long","e thik chơi cầu lông, , thik chạy bộ"
7793,"hướng trung (ambivert) lúc thích một mình, nhưng không phải e sợ đám đông","bánh gai, bún chả, phở bò, ăn pizza",Nghiên cứu về tài chính
7794,Tùy lúc,Thịt nướng,Nghe nhạc
7795,Là một người hướng nội thích ở một mình,Không quá kén chọn,"gym, game online"
7796,"hướng nội, khác trầm","red bull, bánh xèo","thể thao, du lịch, học hỏi"
7797,mình ambivert,"mình thích trà bí đao ngô gia, mì gói, coca","sở thích của mình là thay vì thoát khỏi áp lực, stress thì mình đâm đầu vô luôn"
7798,thích ở một mình,các thế loại mì,nhảy
7799,"xàm, dễ tính, nói nhiều",Mì Nước lọc,Chơi yasua
7800,"có lòng tự trọng, là một người khiêm nhường","thịt kho mắm ruốc, cá tra nhúng giấm, mắm chưng, nước ép thơm, sinh tố bơ",học tiếng Nhật
7801,"nhát bắt chuyện với người lạ, một người hướng nội",Mì tương đen,"vẽ, chơi game, đọc sách"
7802,Nói nhiều hướng ngoại thích đi đây đó,hamburger,Câu cá đá bóng
7803,Hướng Ngoại,Trà Đào,Đánh Cầu Lông
7804,Hướng nội,Cà phê,Đọc sách
7805,Thích ờ chỗ không đông người,Bánh cuốn,Chơi nhạc
7806,"nhạy cảm, khó chịu, ít nói, hướng nội, cọc cằn","miến trộn, gà rán",shopping
7807,Nửa nội nử ngoại,Udon,Nghe nhạc
7808,"nhạy cảm, hướng nội, nội tâm",Trà sữa double trân châu,Chơi game
7809,Hướng nội,Xoài chua chấm muối ớt chua lè,Xem phim
7810,Khó giao tiếp,Bánh bò,Đọc sách
7811,"nghiêng về hướng ngoại, có xu hướng ambivert, thích kết bạn",Bánh mì,Esports
7812,"thân thiện, lúc hướng nội lúc hướng ngoại, tùy lúc","..., gà rán, trà sữa","học hóa, lướt mạng, đánh cờ vua, nghe nhạc"
7813,Hướng ngoại,Món ăn Health,Thích chơi game
7814,"nhưng hướng nội với người lạ, hướng ngoại với người quen, hướng nội part time",Gà nói chung,"bơi, ngủ, coi phim"
7815,"một người ít nói hướng nội, ...., thích ở một mình","..., bánh kẹp thịt, coca cola, thích ăn mì cay","bơi lội, toán, thiên văn học, thích đá bóng, ..."
7816,Vui tính,Bánh kẹp thịt,Toán
7817,"nói nhiều, thích vui chơi",Bánh chocopie,Thích đi karaoke
7818,Lowkey,Thích đồ healthy,bơi lội
7819,Hướng nội,"coca cola, bánh mì, xôi","hích võ taekwondo, trồng cây"
7820,Ồn ào,Mì ý,Ngủ
7821,Indoor type,Suit my taste is fine,"game, phụ kiện công nghệ"
7822,Hướng nội,Bánh tráng trộn,Ca hát
7823,"hướng nội về đêm. có thể chia sẻ giúp mn vượt qua sự tiêu cực nhưng bản thân mình thì không, là một người 2 hướng","bún bò, hải sản",Đi dạo
7824,"chỉ thích ngủ một mình, hướng ngoại thích chia sẻ tuy nhiên hơi khó ngủ",thích ăn đồ Việt Nam,"thích hát, thích đọc truyện"
7825,Hướnh ngoại,"hamburger, mì, phở",Hát
7826,Thích ở một mình,"pizza, gà rán","xem phim, coding"
7827,"sống lowkey, là một người ít nói hướng nội nhưng cũng có thẻ hướng ngoại parttime","socola, buger, pizaa ...",", edit, chụp ảnh, chơi game, xem phim"
7828,Hướng nội ít nói thik ở một mình,"snack, coca cola, cơm",Đọc manga xem anime xem phim âu action nghe nhạc
7829,Hoà đồng,Mì cay,"âm nhạc, chụp ảnh, code"
7830,"ít nói, dễ bị lung lay bởi cảm xúc, thân thiện, nhạy cảm, vui tính",trà sữa,"thiên văn học, thích đá bóng, toán, bơi lội"
7831,"thích giao lưu với mọi nguời, hướng ngoại",", ốc, trà sữa, mì cay, lẩu",Võ
7832,"thân thiện, hoà đồng",Gà jollibee,Bóng rổ
7833,Hướng nội part time,Sữa Milo,"đàn, hát, ngắm cảnh, ngủ"
7834,Vui nhộn,Thích caffee,"thích chơi bóng rổ, chơi vape"
7835,"lúc hướng ngoại, có lúc hướng nội","cháo lòng, bún rêu, bún thịt nướng, olong","ngủ:)), xem phim, vẽ, làm gốm"
7836,"hướng nội, hướng ngoại tùy hoàn cảnh ; không thích nơi quá ồn ào ; không thích người nói nhiều ; không thích nói đùa ; nhớ dai nhưng cũng dễ bỏ qua ; không thích chia sẻ tâm sự ; không thích bị quản lý ; hơi vô tâm ; dễ xúc động ; cái tôi cao ; có tham vọng ; hoàn toàn tự hào khi làm tốt 1 công việc được giao, ","trừ những món liên quan tới cá ; các dòng nước ngọt đều thích, các loại thức ăn nhanh",Nghe nhạc mọi lúc mọi nơi ; đọc tiểu thuyết ; thiết kế hình ảnh logo banner poster
7837,"người suy nghĩ nhiều, hướng nội khi không có ai",Phô mai kéo sợi xúc xích đồ hàn,Thich chơi thể thao võ
7838,"không thích ồn ào, hướng nội","mì udon, cà phê sữa..., trà sữa","vẽ..., kpop"
7839,"hướng nội, thích ở 1 mình, cá tính mạnh","các đồ ăn hỗ trợ cho việc giảm cân, spaghetti, salad, khoai tây lắc, pizza","hội hoạ, ngoại ngữ, âm nhạc, cờ vua"
7840,"mình là một người hướng nội, thích ở một mình, ít bạn","mì quảng, bánh gạo, sushi, mì trộn","xem phim, nghe nhạc, đọc sách, nấu ăn, du lịch"
7841,Hướng nội,Trà chanh,Travelling
7842,"thiên về cảm xúc nhiều hơn lí trí, lúc nói nhiều lúc nói ít","thích ăn đồ ăn của mẹ với cậu nấu. thích nhất là canh khổ qua, đậu hũ cà chua.","thích đọc, thích vẽ"
7843,"quan tâm người khác, chia sẽ, hòa đồng","cơm gà, coca cola, hũ tiếu, sting","bóng chuyền, cầu long., thích đá bóng"
7844,Thích ở 1 mình,"nước dừa, lẩu chay, bánh mì kẹp","phim, truyện, tin khoa học, game, hóng drama"
7845,hướng nội,ăn hải sản,vẽ
7846,"không thích nói nhiều, lười làm việc nhà, thích 1 mình","chỉ thích cafe phin, cơm trộn, các loại mì, redbull
không thích cafe gói, nước trà (như c2, đồ cuốn
pepsi, không độ)","thích đồ ăn nhạt, thích chơi game offline, phim truyền hình, thích ngủ, học nhóm online, thích xem tivi, đọc truyện tranh, đồ ăn ngọt, chạy xe, xem mv ca nhạc, nghe nhạc, trang điểm, các hoạt động phải chạy, call điện thoại, thích bơi, tụ tập với bạn bè, tắm (2l/ngày), đi mua sắm

không thích: chạy bộ"
7847,"hướng nội, hướng ngoại, mình là người",Mình thích ăn bánh tráng cuốn,mình thích hát
7848,Mình khá ít nói cũng như là hướng nội,Bánh mì,"đọc sách.., hít thở không khí trong lành ở công viên, nghe nhạc"
7849,"dành thời gian cho bản thân nhiều hơn. nhưng vẫn tham gia clb cũng như đi chơi với bạn bè (nhưng ít, 1 tháng chắc 1-2 lần) để giao lưu, tìm người người làm đồ án tốt nghiệp chung., hướng nội, thích ở một mình","đồ nướng, đồ ăn mà dai dai kiểu như bánh bột lọc hay bánh canh í., nước trái cây, đồ ngọt","lắp ráp, giải đố, ngủ, ăn, toán"
7850,hướng lung tung,thịt nướng,ngủ
7851,"50% hướng ngoài, là người 50% hướng nội","lẩu chay, lẩy thái, trà đào, bánh plan","đi du lịch, chơi game, đi chơi"
7852,Là người thích ở một mình,Thích uống trà sữa,Thích đọc sách
7853,Một người hướng nội thích sự im lặng,"gà rán, kem, socola","thiên văn học, đọc sách, nghe nhạc"
7854,"hay giận vu vơ, thường thích ở một mình, ít nói với người lạ","c2, bánh mì, nui xào, sting, gà rán, thịt xào nấm mèo, fanta","xem tin tức công nghệ, nghe nhạc, chơi game"
7855,Là người hướng nội part time,"bún đậu mắm tôm, thích ăn mì cay",Thích nghe nhạc
7856,Là 1 ng ít nói hướng nội cà thích ở 1 mình,Bún bò phở hu tiu com tam,Trống
7857,"thích giao tiếp, hướng ngoại",Kem,"đọc truyện, xem phim"
7858,hướng nội,bánh ngọt,nghe nhạc
7859,"nhưng không hẳn hướng nội :)), ít nói, dễ ngại",Fanta vị nho : D,"chiêm tinh học, thần số học, tiếng anh..., kpop"
7860,"hướng nội, nhưng vẫn hoà đồng, ít nói, vui vẻ","lẩu, ức gà, đồ ăn chay, sữa đậu nành, nước ép., các món về tôm, ngũ cốc","thiết kế, chơi game, vẽ, nghe nhạc, đọc sách"
7861,Hướng ngoại,Đồ hàn,Xem phim
7862,"dễ làm quen với bạn mới nhưng thường quen người hợp tính cách mới nói nhiều., ambivert","espresso, chocolate, mì gói","nghe nhạc, chơi đàn piano, chơi bóng rổ, đọc sách"
7863,"o tập thể, hoạt bát, thích ngoại giao, thoải mái khi gia nhập","đồ ăn: các món nước (bún, phở); thức uống: nước có ga","kĩ thuật, khoa học, toán"
7864,"là người hướng lung tung, ngày ngủ đêm bay","thích trà sữa…, thích ăn cay, thích hamburger",Thích chơi suốt ngày
7865,", đôi khi ko thích chia sẻ nhiều lắm, nhưng lúc high thì lại muốn nói rất nhiều, thích có ko gian riêng tư 1 mình",Bánh tráng bún đậu trà sữa,Nghe nhạc xem phim đi lượn đường
7866,"mình là một người hướng ngoại, thích đi dây đó, , trải nghiệm","mình rất thích ăn đồ ăn cay, đặc biệt là mì cay","thích khám phá xung quanh, đá cầu, đá bóng"
7867,Vui vẻ hoạt bát năng động nhưng hơi hướng nội,"các loại bạn, trà đào, tắc, 0 độ","game, ngủ, nhảy dây, chơi cầu lông"
7868,Là người hướng nội,"đồ nhướng, đồ chiên, ",Ở nhà một mình
7869,Hướng nội,Pizza,"chạy bộ, bơi"
7870,"thích đi lang thang một mình, hướng nội","các món ăn truyền thống hoặc món ăn đường phố việt nam, các món gỏi",Đi phượt
7871,Huong noi va thich o mot minh,"mi tom, bánh mì..., moutain dew, pepsi, cơm, revive, sprite, coca, 7up","toán, vân vân..., thiên văn học"
7872,Năng động,"gà rán, trà sữa","phim hoạt hình, xem phim ngôn tình"
7873,Hướng nội,"trà, khoai tây",Vẽ
7874,Hướng nội,Cheese fries,Đọc sách
7875,Linh hoạt,Món nào mình thấy hợp thì đều thích ăn,"tham gia hoạt động ngoại khoá, ăn uống, học, du lịch, coi phim"
7876,"bạn bè., thích ở một mình với gia đình",thích ăn MÌ TÔMMMMM,Thích học thích code
7877,Hướng nội nữa mùa,"bún cá, trà đá, bánh ướt, bún riêu","du lịch, khám phá xung quanh"
7878,Năng động,Chả giò,Đá banh
7879,"một người ít nói hướng nội, thích ở một mình.","phở, cơm tấm, mỳ trộn, ...","bơi, gym, ..., cầu lông"
7880,"một người hướng ngoại làm biếng, thích ở một mình","rau củ, trái cây",Trang trí phòng ngủ
7881,"ghét phiền phức, không thích giao tiếp với người lạ, thích ở 1 mình, thích yên tĩnh",Cà phê,"nằm dài nghe nhạc, uống cà phê"
7882,Extrovert,Coca,Đá banh
7883,Hướng nội,Pizza,Thích đá bóng
7884,Giống ví dụ,"đồ nướng, nước gas",Tiền
7885,"một người vui vẻ, hoà đồng với mọi người",Món nào chay đều thích,Xem phim
7886,Thích yên tĩnh,Kfc,"game, đọc truyện"
7887,hướng nội,bún bò,"xem phim, chơi game"
7888,là một người ít nói hướng nội,"thịt bò, salad, ....",đi chơi ngoài trời
7889,Hướng ngoại part-time,Thích ăn trứng vịt lộn,Đu OTP
7890,"hướng ngoại, là người, hướng nội, thích đi chơi cùng những người bạn thân thiết, làm quen nhiều bạn mới","bún, bimbim, gà rán, hủ tiếu ….","thích nghe nhạc, xem phim đặc biệt là thích nhạc của sơn tùng m-tp"
7891,Người hướng ngoại,"cơm tấm long xuyên, bún cá châu đốc, trà đào","yoga, …, tin học, toán"
7892,Hướng nội,Mì cay,Toán
7893,"đôi khi hướng nội, hướng ngoại, sáng nắng chiều mưa, tính cách thất thường","mình ăn uống healthy nền chỉ uống nước ép trái cây, không uống nước ngọt có ga","o buổi chiều, o buổi sáng, mình thích chạy bộ, đánh cầu lông, đi xe đạp, o buổi tối"
7894,"hướng nội, thích tận hưởng không gian 1 mình","phở bò, pepsi","lịch sử, văn học"
7895,ít nói,Cafe,Thiên Văn Học
7896,"hoà đồng, nhưng ít nói",Bánh . nước coca . mì cay...,Thích
7897,"Mình là ambivert
Có tính cách khá là khùng khùng điên điên nhưng cũng hay nhiều tâm sự","Mình thích ăn đồ ngon=))))
Ăn chay hay ăn mặn gì cũng đc","chơi thể thao, thử nhiều điều mới, đọc sách, thích học ngôn ngữ anh"
7898,"cũng có lúc hướng nội có lúc hướng ngoại, mình là ng dễ giao tiếp","đồ ăn hàn quốc, ăn vặt","đi dạo, đi ăn"
7899,Hướng nội,"trứng, gà, xúc xích","chơi game, nghe nhạc, xem phim"
7900,"vui vẻ, tích cực, ưa mạo hiểm","bánh ngọt, kem","chụp ảnh, xem tv series"
7901,"yêu thiên nhiên, là một người nhiệt tình, hoạt bát",lẩu cá đuối,bóng đá
7902,"hướng nội, ít nói","bún bò, trà sữa, các món nhật","đọc truyện, coi phim, công nghệ"
7903,Vui vẻ hoà đồng,"đồ ăn nhanh, coca",Chơi hame
7904,Đúng ik chang mô tả mẫu :))),Thích đồ tự nấu,"đọc sách, xem phim, đàn hát, vẽ"
7905,Hướng nội,Dưa hấu,Đọc sách
7906,Hướng nội,Nước lọc,Chơi thể thao
