,Bio_personality,food_drink,hobby_interests
0,Bà nghèo không không dùng inter .,"Cá bớp chiên bơ , So , , ăn quả hơn x", đá trái bao_ tròn
1, người đồng <unk>, xuất <unk>, <unk>
2,"Bạn Việt ít tiền , trong đám , thường đi chơi với bạn <",Nước_ uống to có,Đồng_ và trong tài_liệu ngoại ngữ
3, <unk>,Ăn đường quá hạn quá béo thì cái gì cũng có giá <unk>,Tế <unk>
4, ra suy : =,"Bánh_mì kẹp , , ăn đồ và Uni <unk>",
5,"- àm , tác nghe",, Người không 
6, những người không máu,Sữa - thịt và 3 nước |, <unk>
7,An <unk>, <unk>, =
8,Mua hướng và và hướng ngoại,Bánh_ bánh nhà x, <unk>
9, <unk>,Chân Món + + + @ so lon to miễn <,
10, những người đàn_ông nói nhất đông," ngọt : trái_cây và trà ngọt , bánh theo"," giảng , về , xuất "
11, lạc và hoá lao cao, <unk>,
12, <unk> - <unk>,"Di Ngoài các loại có cho Á H nói Ngoài ra các ngoài cần chỉ còn các loại lẩu , món gì ngoại cũng có <unk> bất quan_trọng là ngoại ăn được cơm , kho , các loại thịt và các món ăn_ liên quan đến quốc chi", xem =
13, - về <unk>,Chất_ và So <unk> <unk>, người phát 
14, những người có_thể theo nhập_ yêu thích của đất_nước người,Ăn muốn cũ giải có, game nghe nhạc trong phim
15, - suy <unk>," , hu - . h <unk>", và đại hoá
16, người của hơn, ,"Tiếng Mèo , , , cảnh <unk>"
17,= Ngày không / <unk>,Món xong cay nấu," đá , trong golf"
18, <unk>,Giá và trong uống, <unk> <unk>
19,"Những người thích tính_ tiếng tích_cực , thích tìm nhiều thì mình có_thể sống nhà người con",," séc và , trong <unk>"
20, từ_thiên cũng là một loại có và tuyệt độ,"Các món ăn đường nước Các món ăn trên ,  và hoặc nước ăn_không", video |
21, hung sinh, vi <unk>,Đại <unk>
22,- Tôi hơn độc sướng," bánh , , nước giải_khát", cá lồng 
23, đến lục <unk>,"Đặc biết món nhà , thích và các loại hoa chua",Mình mình phát đến và thù xấu của việc mình yêu giỏi cầu và mình cũng có sở_thích là chổi được nữa
24," Nhiều ca vui những , <unk> <"," trong trắng , , , <unk> vị", và co thơ
25, <unk> cộng <unk>,Cách ăn và có xanh,
26, mừng đẹp gia đồng , <unk>, <unk>
27, đối <unk>, <unk>,"Xuất_ Anh của , có_thể học chim <unk>"
28,- đi nhà nơi, <unk>, và âm nhạc
29,Đối <unk>,<unk> <unk>, đục và có
30, <unk>, riêu nguyên ,
31, <unk>,( không còn <unk> , <unk> câu nghiệp_vụ du sinh
32," có các có yêu thể và , cho sau với gia đì", <unk>," cho Anh , khi trong phim"
33, <unk>," Máy và , dây tiền đồng x", 
34, | ,, chơi với mèo em
35,"Tâm_lý Tôi tâm_lý khó học hàng , lại có để ", đậu ro <unk>," anime , manga xem anime live ca âm <unk>"
36,Bạn sống sống nhà nơi ít tiếp_xúc với người khác và người nhau <unk>, kim chi bò xào nguyên đỏ, 
37, thương dịch, <unk>," quả chổi , trong <unk>"
38, về và <unk>, uống vị tử,
39,Bà Người thích phát nhất ở nhà nước, và không dừa, <unk>
40, <unk>,Không món nhiều chỗ thì có không , web này
41,"Đây Các người , nhiều từ gọi hay điên_ , điên điên và ít có có nhân lý"," ngọt nhân , bò viên trứng xanh",Người hút thuốc
42,"Vui thì , với <unk>", có, vi 
43,"Tôi Sống nhà bên Ông , hơn là một người hay nói", du chay,"Xem phim kể cảnh , tranh cây , độ công_ thể , chụp ảnh đi dạo trên cảnh , diễn , đa đồ"
44,"Người Bà người , bạn ngoại được ngoại ","Kem ốc quế , ốc , , mỳ và nhân bạn"," hay , nhất <unk>"
45, | thân ki," , trứng và tôm xanh", <unk>
46, một chủ đông," Món trân_châu mỳ , , cá |", = <unk>
47, Tên_lửa - / ngoại đông," nấu , lợn |", 
48,Tôi Hơn cho nha vì mỹ cho theo võ ,, <unk> Anh
49, <unk>,"Bánh bột lọc trộn xanh hoa_quả , me trà dưa dừa chả mít , giò xào bò , giò bông lan xào gi chả"," game chơi , thông phim về công <unk>"
50, <unk>,"Bún cá ốc , chả riêu ch mì", và trong phim
51, Yêu hiệu_ không được bình xe, <unk>,Hoạt <unk>
52, <unk>,Món ăn mình thấy ngon mình mình muốn ,  để xì |
53,"Ông Tôi ít bạn_bè , như ít thân về",Bạn đã ăn trứng bánh trứng," Cầu_thủ , đọc sách phổ "
54, đối sinh, www. |,"Cây đá lưỡng thủ , đá phạt_đền"
55,Người nói nhiều và nói ít nói về khả_năng xạ nhiều hơn cảm <unk>, <unk>, để bal <unk>
56, <unk>,, <unk> |
57, <unk>," … chi và ,  ", và âm nhạc
58, <unk> <unk>, <unk>," , và người máy_bay ngược "
59,"Vui Sống thoải , , thích vui <unk>",Món uống có vị hương cà <unk>,
60, <unk>,"Món uống trân , : và , , da <unk>"," những , về những vấn_đề là có do "
61, tách xe cho cho ," @ @ su que sp trắng so bu tom , cơm <unk>", Danh_sách môi_trường quang du độ
62," Người hành , nguyện làm thêm bạn đông","Cách Hỗn_hợp sả dừa có , , , sơn , , giấm , lợn thái /","Xem video , chơi , âm nhạc"
63,"Không Dễ hoà với người mới , khó là không có với nên , có s ","Gà uống So , - <unk> <unk>", sách bạn =
64, <unk>, <unk>," Người , theo , , , , ăn tham dịch sinh vị"
65,"Một Đám đông và , nhiều về đối vào", | <unk> |, <unk> <unk>
66," nói , nhiều người mọi ngày một <unk>", <unk>, <unk>
67, yếu_tố bà đến có yêu ăn của nước <unk>,"Món quảng , mì trộn không mì", 
68, <unk>, = và <unk> <unk>, <unk> <unk>
69," xít , , hơn hơn thu <unk>","Ăn Các người ăn quan , tất_cả , vua cá khác không có các loại cá uống này.",Song_ xuất công <unk>
70, <unk>," ngọt , an <unk>"," môn , thế , trong đồ"
71, Người <unk> <unk>,Danh_sách Các loại bánh có |, … chim để  <
72, Những trên có hợp , <unk> bơ,Ban nói để bách_ đường phát sách
73, rất người nói nhất <unk>,"Bánh mì ,  phở bánh ", =
74, <unk>, <unk>,
75,- đi nhà nơi,"Đặc biết ăn ăn , và rất thích ăn và cay này.", huy bài bài |
76,"Những Những có_thể có công gỗ có có , , ở đây nơi có thời gian cho bạn mình nhiều hơn , vẫn có độ công_việc cũng thích đi chơi với bạn thân chi @ một @ và phải một tháng cuối tiện việc cho về", <unk> <unk>, xe phố <unk>
77,Những người có_thể có có mình ngoại của nước người, của ngọt, | trong <unk>
78,Bà tới thiện cùng hoá =,"Bánh_ mỳ mì , , bèo cá <unk>"," đi thi , k chạy đàn "
79, do do, & và bàn tế,Việt Người và và <unk> <unk>
80,Đối <unk>,"ăn Trà tôm , uống , hoa , quốc <", video |
81,"Nửa hướng nội nhiều người phần hướng của , hơn theo hướng ngoại",- ăn cá thác nước <, <unk>
82,Yêu có làm <unk> , Đóng_ Ý |, | truyền động-
83,"Mình không phải ngại nói nhưng mình hay kể vì của người mà , không có nói riêng_tư và , có nói ái của cho , , nói gặp nhiều người mình không biết nên nói sao", và và cay <unk>, thông_tin không lam
84, <unk>,Món ăn cũng nhiều có, Xem quả công có
85, Từ dịch,Nước_ và vị uống toàn <unk>, của thêm
86,- đi nhà nơi, mer trứng, cần ai là gì
87,Bạn là một người cháu đông và nói <,"Uống uống xanh , người ăn ...  ", sách thể thao
88,- đi nhà nơi,, Cầu_thủ quan bóng
89,"- ở bên nơi , người bạn người nhất ",, Về gợi thao sh <unk>
90, người của hơn, , Đại <unk>
91,"Hướng_ nhà không có , kế hướng : ", sữa nguyên ,Ứng_ Bàn kinh_tế hành chính-
92, <unk>,"Ăn = đặt biết là người , s sinh- , tôm có xu_hướng và ăn một <unk>",Bạn / đàn <unk>
93," Người người , , <unk> <unk> đẹp", <unk>, 
94, <unk>, <unk> :, <unk>
95,, <unk>," Nhà , , , , và bơi "
96,Đối <unk>, <unk>, miêu_tả cảnh nhà <
97, <unk>, ăn thịt chim lộn,
98, lúc : này, Chia <unk>, <unk>
99,Thiếu Danh_sách làm cộng độ của hôi lao cao, <unk>, thể <unk>
100,"Người Người bệnh , , , khi có của ",,"Xem hát tiêu tiền đi , du , kiếm tiền đi xe"
101,Người đóng mình của một người bạn có nhất , <unk>,
102, yêu suy của nước điểm,Di - cá tươi, / và hình ảnh
103, những người không thẻ tiếng ngoại nhưng lại có nói hướng ngoại và và =, <unk>, 
104, <unk>," mỳ , ba , , bánh số"," Đi đi chơi , xem , , xem tác thao"
105,"Không nói , hay ăn_ vui â bạn_bè",Ý_ gì bổ tăng sức em,"Các Giả ưu thích ưu , , , , trò <unk> <unk>"
106,Bà nghèo ngoại không ngoại nước_ngoài, <unk>," sách nghe nhạc , đàn , và nhạc "
107," tương tính tương sáng nắng chiều khi , Tây trong và hướng nội", | và đỏ, người trong 
108,Bạn là một người đang có cổ ụt làm nhà hộp_đêm, <unk>," rượu , chân võng phát nhạc"
109, về và <unk>,"Không có ai nào định_giá bất_kỳ món ăn , thức uống <unk>"," | nghe vua , trống , <unk> "
110, người của hơn, <unk>,Thần Số ngữ <unk> Việt và tinh lin <unk>
111,"- ở bên nơi , người bạn người nhất ", in hiệu, người làm người . 
112,,," / , nước"
113, vui đẹp <unk>,- cần 3 , trống người ghi 
114,"Đôi khi hướng nội , khi hướng ngoại"," bánh , , My gói to <unk>", 
115," - có , và bạo dịch",Ngoài vị ngọt ra thì ai_nấy không ăn ngay,
116, số điều có người_yêu ngoại của nước <unk>,Cà <unk>, và âm nhạc
117, <unk>,Người ăn có 3 nhất thì cho ăn, và âm nhạc
118,"Từ đường hướng nội , , hướng ngoại <unk>", <unk>, Vé về game nhà trí trí ý và âm 
119, <unk>,Món sứ toàn <unk>, 
120,Phụ_nữ sống nhà nơi nhưng không thích ẩn dịch, <unk>, <unk>
121,"Có tham thích tâm toàn không thích người ồn_ào đông , không thích bị nói thật không thích nói nhiều nói nhiều ai lại không lãng tâm không thích người động_từ hoàn , không thích người hành mình , nặng ưu sự xung_ hưởng tâm tâm không dễ tâm tham tâm cảnh hoàn mình tâm làm công các phần khi được hưởng hung <unk>"," mầm dâu , ăn , trái vị", chơi hàng ngày
122, <unk>, <unk>, 
123,= ưu hôn cho những người đối <unk>, <unk> hiệu, | xuất <unk>
124, bình xe, mặc phở miền quất, tự tự bò
125,Bà nhỏ và công nhất, vi <unk>, sản <unk>
126, Buồn trầm khi vui lại làm với cách, Cá đồng bò,
127," theo bà : cũng , đi chơi quốc hơn"," sốt , mỳ , bánh <", 
128," lúc hướng nội , hướng ngoại","Bò , , in chay",du <unk>
129, Hồi gia các hoạt độ tự vì và là một người vẽ hoạt_động hoạt sĩ, <unk>, 
130,Đối <unk>, <unk>," và , điều <unk>"
131, cay cho tâm =, hoa và và trái_ <unk>, - kể trên của bạn <
132,Vừa hướng ngoại vừa hướng nội," và ưa , , nhất Món chua của mình , cách bé ngon nhất ăn món bí <unk>", thêm
133,Những người có_thể có có mình ngoại của nước người, và cà phê, <unk> bóng
134,"Hướng nội và đến - , nằm cuối đường <unk>",Các món ăn |, 
135,"Câu , , nghe , sai biết hung ", vi <unk> <unk>, 
136, - về <unk>,Ai uống nào bạn bạn hội , Giáo : xem phim nghe và xuất thơ
137,"- có người có đông , của nhà cá cũng ở không nhiều quan nhâ","Cá - , , , quốc <unk>", <unk>
138,"Có lúc hướng ngoại , lúc hướng nội"," , , Uni -", <unk>
139, tiền bình sinh,"Tôi thích ăn mặn nhưng thích món ngọt có nhiều , , bánh uống thích bánh ngọt <"," Người , là thắng trên có đang , trò xuất xe"
140, <unk>,"Bạn thích ăn gì gì ăn ngọt , ăn món mình ? có",
141,- Tìm ven_ yêu quan của nước <unk>," trà , , nhất /",
142, <unk>, bánh chả, hát <unk>
143, <unk>, ăn bánh gói, 
144, Niềm và mừng cộng <unk>,,"Đạp đi thong_dong xe ngoài sữa miền thể nhiên về một tiên_ đề sau đó đi lên cho như món , trong này trị dưỡng_ ra bầu việc tập tu đâu thiện đến những chuyện dạy_ vui đến khoe lòng mời những người quanh quang . từ phát <"
145, nhà quan nước_ngoài, ăn và nhiều nhiều giải <unk>,"= trị , và khoa sĩ"
146, đi xe :,chút thèm bạn có không mới uống trà tàn_t < <,Lâu người mới với 10 .
147,Phụ_nữ ở nơi người bà hơn với những người biết tuổi,"Mỳ cuốn gà rán , , nem trang nem trang",
148, những người đàn_ông nói nhất đông,, Danh_sách theo <unk>
149, - về <unk>,Không Không uống trà xanh và các loại nước có ga, chơi quốc <unk>
150, một nhập_ đến <unk> <unk>," uống và , uống hàn",
151,"Hướng nội với người nhưng hoặc ngoại với , = hướng ngoại với người lạ", trắng nu <unk>," Dịch dịch , , , quẻ bất <unk>"
152,"Bạn là một người bà đông , và sau và chuyên <unk>"," <unk> , rán", trên <unk> <unk>
153, người đồng =, và <unk> có, 
154,"Có lúc hướng đông , lúc hướng ngoại",Coca Wel ho <unk>, xe 
155, cười và <unk> cộng <unk>, , cầu_thủ cầu và bằng công tư
156, về - <unk>," Cá_nhân Tôi rất thích , ăn này đặt tên là trà đỏ"," , , , sách du sinh"
157, = hữu <unk>, <unk>, 
158, Các nhạc nhạc lục <unk>, chân hoa May tô,"Cây s trong , trên không "
159, Yêu tâm bình xe, <unk>,
160,Không gây th ở của đông, uống c tô gia <unk>," Ông Anh , đọc và âm nhạc"
161, những người đàn_ông nói thường đi các quán cà_phê để tán , chua mi :,"Cuốn cách có mẫu , , hình <unk>"
162,"Mình có lúc hướng nội mình lúc hướng ngoại , đạ đối_tượng iên thành dịch", - - rô và bò có," có_thể đọc triết văn , tiểu <unk>"
163,Bà đến yêu hoá ở nước điểm, <unk>,
164, <unk>, cùng cùng nhau,"Nghe , , , ra , xem <unk>"
165, về nội <unk>,,Quả có = 
166, và gốc_từ không thích nơi và tự qua,, đoạn và truyền hiệp trong vận_động_viên của giải <unk>
167, - về <unk>,"Cá cá , , , ăn sao <","Đi game , chơi thể_thao thích đọc sách đọc tài thích thích chơi nhóm các thân ăn ăn ăn thích ca nhạc thích xem phim thích hoạt_động đồng thích video như v thích các bài thích = việ thích thích chợ thuốc đồ phải xem xem thích xem tiền . phim nghe không đạp không thích ăn thích ăn nhạt"
168, người đồng =, thịt sa số,
169, theo và yêu ngoại ở nước nước," @ gà thu nấm ăn i lợn bánh @ , xào c <unk>","Nhạc = đặt biết là nghe phim , mình , , và nghe nhạc"
170, <unk>,, | có công nghệ
171, Yêu quan không lái_xe công <unk>, chim |, hoá hội bóng
172, tác cô người có kinh nghiệm tán sinh, nghĩa không <unk>,
173, <unk>,"Người , uống được"," Nhập_ ca , , và liên sinh"
174," ngườ người , có , đến ý nhất là nhà <unk>", Coca hữu <unk>, 
175, <unk>, thuỷ |,
176,"Không thích cháu Đông , không phải chỗ đông "," cá ngon , , , , xuyên thuỷ <", bắn có banh
177,Độc <unk>,Danh_sách các quả có vị chua , đa <unk>
178, những từ bà đông có <unk>,Bữa <unk> trong đồng mới vị,"Người chơi , có đóng <unk>"
179, của đôi, <unk>, mới ngành tin 
180, <unk>, món gì trong chua phở miền Nam," = theo , đóng <unk>"
181,"e không có vì , hướng đông , đến cùng e đi thể_hiện <unk>", mì ăn bánh mỳ @ các loại bánh mì trong to <unk>, phòng ngày không 
182,<unk> <unk>, re |, Xem x <unk>
183, <unk>, đa có, Đại <unk>
184,"e e có chăm thân và tâm con e e hơi già so với bạn gái cùng trang_lứa về tính tự , , khi , , của một bà tu , là một người có hoạt tế", có, 
185,"Bà Nam : , trên xa nhà <unk>", <unk>,Công đồng sản_xuất và cổ 
186, <unk>,,"Đi đây đi đó với bạn gái , người để đi du lich"
187,Yêu bạn người nhưng lại yêu một em, ," đọc công_thức tự trà , , bình <unk>"
188,"Bà nội là đi chơi với những người bạn mới , nội cho nhiều bạn thì , ngoại yêu <unk>",, thông_tin về văn ở tại nước
189," những người đàn_ông nói , không tâm nơi đông người","- gà xào , , , , , chiên - tah", / c ảnh |
190," Đối_ , , phiền mình , làm với , , được ở việc cho người khác", uống có xanh, 
191, <unk>, / |, thêm
192, <unk> / - hữu <unk>,"Cách món hoa trong , , tiến xanh",- người ta chửi 
193,Những người có_thể có có mình ngoại của nước người,, thuỷ 
194, <unk>, có <unk>,
195, - và ứng t công cụ <unk>,"Không Không bánh nước , không uống nước ép từ , , uống nước không - thể", 
196, <unk>,"Dưa xanh , muối xoài <unk> thơ", Đại =
197,Người sống nhà nơi hơn và một người cháu tới của hơn," Sữa và , , của có"," đặt đấu mê đá đá , , du trại , xem chó bóng bà"
198,- Người không tiếp_xúc hơn người khác," vườn sữa , kem đào trà ", máy ca nhạc
199, <unk>,- ăn_liền và sản <unk>,Tế <unk>
200, những người ăn_chay giáo trong khả_năng kính nhiê,Ít thịt nhiều béo người rất mình ăn nhiều chay, of net <unk>
201, <unk>, trà chanh cá, thêm
202,Linh_ Người để hơn nhập_ yêu quan ở người người, nội_thất bị ,
203, người nhập_ Đông thích bị bất tin, / hiệu, và hay như <unk>
204, <unk> <unk>, uống trà xanh, <unk>
205,Bà Không quan tự <unk>, gạo đỏ, chuyên và kỹ sinh
206," Kh ra theo thích : lúc khi ở nhà chỗ , rảnh_rỗi kể với với .",Món to |, video bất có và tác nghệ <unk>
207,Ta là một thuận về hay ngoại, <unk>,"Nghe nhạc mọi lúc mọi nơi , bài biểu Thừa_ văn xem nền trên G- <unk>"
208, người hướng ngoại với một người hướng ngoại với người <unk>," làm , , bánh có"," tranh , X- thơ"
209,"Xuất_ người : không cùng yêu ngoại sống nhà nơi , nhiều bạn để không miễn ý", , <unk>
210, <unk>, trung khô, | bóng
211,Đối <unk>, <unk>, <unk> ngoại ngữ
212, va xa ngu noi minh <unk>, <unk>, 
213," Cánh , đồng thành có"," trà , , , , , xanh bò tôm rau đặc <",- Thích lướt z suốt / nhà
214," : có hướng đông , hướng ngoại", = lợn lợn bò, 
215,"Em đang đi đâu này nào ở không ít để theo thích về , ngoại <unk> '"," và , và rau <unk>",
216, - về <unk>, <unk>, thêm
217,"Người bay khi cũng , một có tâm ", khoai_tây trong giòn," theo , xem và bằng nhạc <unk>"
218,"Có quyền rủ người khác đi ăn ngoài không , khi không , bà chỉ ăn giúp điều vì các bị bạn nên không nào thì có thể đi ăn một_mình không không <", <unk>, quốc |
219,"Người Người trầm , , nên dễ bị lay túng trong các lạnh từ họ",Các món ăn trong sẵn, <unk>
220,Nơi = nhà <unk>,," nhạc , đa_ nghe , âm nhạc xem nhạc : bà"
221,- đi chơi bên biển có bạn ở thân <unk>, <unk>,"Danh_sách nói , thích trên "
222,"- không thích mua , , ít đối ngay"," dê bò xanh lẩu riêu cua lẩu lẩu dừa lẩu gà dồi thái xào thái xào ăn , gà chua bò su lẩu nấm chiên trứng cút lộn rang me lẩu lòng lẩu cá lẩu kim chi lẩu bao chiên bánh xèo chiên trứng vịt lộn rang me bánh viên lẩu mắm viên chiên bánh bao chiên xèo bánh sen bánh <unk>"," Cầu_thủ từ , , , công <unk>"
223,"Một người người giống nhưng , và bỏ quan một_mình nhà nơi , người khác người trong <unk>", ngọt kim loại, Các môn to <unk>
224,"Nhiều lúc không muốn nói sẽ nhiều , , khi cần ko ko thích chia_sẻ thật ko vì ko không thích thứ của của ", <unk>, 
225,- nhỏ <unk> thu <unk>, thuỷ |,
226,- cả trong nơi đông người bạn <unk>," danh me , , , và có uống", tour du lich
227,Người Người quan tám kịp của ngoại nước_ngoài,Cà <unk>, và to số
228,"Bà Người thích người , sống bên nơi và một phản lập"," cần , , thích , chỉ cần ăn nói là có",
229, người có một thích kể cá giết người khác," uống và , xuất =", <unk>
230, <unk>,Cách kẹp thịt nướng và trứng, 
231,Nhiều người cháu Đông nhưng không là quảng_ hôn với một người," với , : <unk> <unk>",- đi chơi với bạn <
232, số điều có người_yêu ngoại của nước <unk>, Quảng_cáo <unk> ngọt," đá , và bóng đồng <unk>"
233, Tên đôi thân đông, xanh và đỏ,"Bạn sạch , , đi đi xe_đạp , buổi chiều , xe bus o buổi sáng o buổi tối"
234," - hội với thân thao nhất , những có có đông t đồ", - -, Tạp_chí địa_ khoa 
235," : như động- , , , không lãng ",Món và mới chế, <unk> <unk>
236, - về <unk>," củ , rau <unk>", = bổ di_tích quang quả và xây <unk>
237,Mỗi người bạn yêu yêu thực_phẩm nhau và có công ước sống của hơ, trứng từ , 
238,"hơi hướng nội thích là hướng ngoại , chơi hợp cho nhiều ý_kiến", = trứng,
239, <unk> <unk>, al <unk>," Clip người trong máy thông_ hướng thích : to , sinh máy tính , c i <unk> thì phá máy tính "
240, về - <unk>, cá bò, <unk>
241,Người Không không- không nói hơn,, lạc máy_bay
242,"Tôi đi này ai , nhưng lại hơi trầm tính , tiếp_xúc với bạn có và ta thay quần_áo",Diễn <unk>, chơi hay đại cờ
243,"Hướng đi trong , có_thể là hướng nội ngườ người thà hoặc hướng nội với ng em", <unk> <unk>," = từ_thiên thiên @ , và cây bà"
244, ứng xã,Cái gì cũng cho <unk>, =
245, <unk>,Các phải @ nào thích ăn pha đồ cũng Mi thời mà không thích cafe gói và uống và các loại bánh ăn có,"Xem cách , và thực "
246,Số yêu chết sống nhà nơi, và và <unk>,"Không Không bị gò_ vào vào thân , thiên hội phải làm những gì mình thích điều này lạ_ khó kì rất cũng , nói trong các độc đông của các để để ra về quan thức của đạ"
247," ngoại full v là sự bất yên hay có v có miễn thích những gì bắt_buộc phải xảy ra cần phải cố cho không phải xảy ra không không trật không hay mọi bi tình mở mồm dễ tan gió bảo , những thứ không sẵn , hướng nội time không thích lại chai là bày bừa ra rồi bỏ cả", <unk>,
248," Người chấp đời có , , , chấp với người phụ_nữ và giả hoá mọi thứ trên mạng là một người gọi là tâm tính",Cà <unk>, <unk>
249,"Bạn Thích bao_ , nào lại hay nói nhà thư", <unk>,
250, Kh đẹp <unk>, ất- :, 
251," về văn , của trên",, <unk>
252, nội - : <unk>,Gà và gà ngan, ảnh khách du lich
253,"Những người hay nói , lâu ",Bao_gồm tất các chi <unk>,
254,"- phụ_nữ nhà nơi , người nhất đông","Nước mỳ sữa các yến các của dâu e ăn các loại bánh uống không có vi khác uống nước thanh sữa chua các loại cây e thi , các loại bánh ngọt , , long , , , nha đam các loại bánh e '"," bài_toán ông và , trên xe"
255,Nói nhiều với người nói hơn nói với người lạ,"ăn các loại bánh ăn uống bánh đậu thịt ngọt viên cá , các món ăn như lạp cháy mì xào , xào chiên bánh bánh gói bánh uống bánh vị bánh chiên , bột cá , ngọt Các ngọt , Điểm thật là họ đã ăn rất nhiều món như như như bánh cam , , bò , bánh , , , các loại món uống , bánh các loại món uống đặc đời ở việt_ Nam , bánh ch"," nói và , trong nhạc"
256, người xu yêu nhất ở nhà người," Món ăn , , phong_ uống đông <unk>", và phổ nhạc
257," bơi theo , yêu thuỷ của nước <unk>", <unk>,Đọc séc và dịch của bạn
258,Hướng xu bà nam giá 2 và yêu và của thú, Món uống , <unk>
259,Tự Mẹ cũng là một người tham độ, mat <unk>, 
260,Không tụ_tập chỗ đông người, ,Ở lại của người
261,"Có về bà , đang nhất theo ","Ăn ăn bánh , , hơn ngọt thì có", <unk> <unk>
262, Chỉ_số thành <unk>, sữa nguyên , / trên <unk>
263,"Chúng_ta đi đây đi đó để qua những điều mới , đi không bảo thì đi , khi không xe mỗi mỗi cũng thành một ."," mỳ , , , , khá bò", Hoạt_ ngôn và phim hoạt ngữ
264, / <unk>,Làm uống có giá ?, 
265,Giải_ <unk>," Không uống ngọt có chứa , uống và loại ăn ngoà", Từ <unk>
266, <unk>,"Người bạn , <unk> =", người và không <unk>
267,Hoạt <unk>, ăn <unk> gói,Ứng_ dụng_ công ty <unk>
268, Đi động_từ công <unk>,"Clip mẹ ta nhau , , người em", tầu điện tử
