,Bio_personality,food_drink,hobby_interests
5416,Mình là một người khá rụt rè khi ở một mình.,Mình thích ăn tất cả những gì mình thấy ngon. Riêng đồ uống thì mình có niềm đam mê sâu sắc với Rau Má,Mình thích đọc tiểu thuyết và truyện tranh
5417,Năng động,Chả giò,Đá banh
5418,"thích ở nhà hơn là ở ngoài, lười giao tiếp...","nước c2 chanh, phở, táo","coi phim anime, holywood, chơi game"
5419,Tùy lúc,Thịt nướng,Nghe nhạc
5420,"là người 50% hướng nội, 50% hướng ngoài","lẩu chay, bánh plan, lẩy thái, trà đào","chơi game, đi du lịch, đi chơi"
5421,"một người hướng ngoại với bạn bè, hướng nội với người ngoài",Chocolate,"nhảy, chính trị, khoa học, hát"
5422,Là một người hướng nội thích ở một mình,Không quá kén chọn,"gym, game online"
5423,"thích vui vẻ, khá hòa đồng, nhộn nhịp","thích ăn vặt, uống trà sữa",Chơi game
5424,"nóng nảy - ưu tư, hướng nội - ngoại, thích ở một mình- lúc thích nói chuyện nhiều người",", đồ bún phở việt nam, ăn đồ cay",Tiền
5425,Thích yên tĩnh,Kfc,"game, đọc truyện"
5426,Trung lập,Không rõ,Xe cộ
5427,Cầu toàn,Trà sữa,Kiếm tiền
5428,Huong noi va thich o mot minh,"mi tom, moutain dew, pepsi, 7up, sprite, bánh mì..., cơm, coca, revive","thiên văn học, toán, vân vân..."
5429,", nhưng lúc high thì lại muốn nói rất nhiều, thích có ko gian riêng tư 1 mình, đôi khi ko thích chia sẻ nhiều lắm",Bánh tráng bún đậu trà sữa,Nghe nhạc xem phim đi lượn đường
5430,Mình khá ít nói cũng như là hướng nội,Bánh mì,"đọc sách.., hít thở không khí trong lành ở công viên, nghe nhạc"
5431,mình ambivert,"coca, mì gói, mình thích trà bí đao ngô gia","stress thì mình đâm đầu vô luôn, sở thích của mình là thay vì thoát khỏi áp lực"
5432,"ít nói chuyện, mình là một người hướng nội","o mỗi buổi sáng, thích ăn mì cay, uống caffee","bơi lội., thích khoa học, thích đá bóng"
5433,Hướng ngoại,Món ăn Health,Thích chơi game
5434,Vui vẻ hoạt bát năng động nhưng hơi hướng nội,"các loại bạn, trà đào, tắc, 0 độ","ngủ, chơi cầu lông, nhảy dây, game"
5435,Hòa đồnh,"bánh bột lọc, nước rau má","làm mô hình, đọc sách, vẽ, viết lách"
5436,Hướng nội ít nói,Sandwich,Nghe nhạc
5437,Linh hoạt,Món nào mình thấy hợp thì đều thích ăn,"ăn uống, coi phim, du lịch, tham gia hoạt động ngoại khoá, học"
5438,"một người ít nói hướng nội, thích ở một mình",trà sữa,toán
5439,Í nói hướng nội,"đồ thái, ăn sushi, ăn haidilao",Thích đi chơi với bạn bè
5440,"hướng nội, nhưng vẫn hoà đồng, ít nói, vui vẻ","ngũ cốc, lẩu, nước ép., các món về tôm, ức gà, đồ ăn chay, sữa đậu nành","nghe nhạc, đọc sách, chơi game, vẽ, thiết kế"
5441,"có trách nhiệm, thân thiện, hoà đồng với mng","trà sữa, sữa chua mít, phở xào, mì xào, bún chả, miến trộn, bún ốc, dừa dầm........, bánh bột lọc, bánh bông lan dâu","du lịch, xem phim, ăn uống"
5442,"ít nói nhưng hướng ngoại, vui tính",Spaghetti,"thể thao, đọc sách"
5443,"hiểu biết., sống tình cảm vs chăm chỉ nhưng e hơi chậm so vs bạn bè cùng tuổi về sự linh hoạt, rụt rè, là người hướng nội, e là một người khá tự ti, ít nói","trà ô long, các loại xôi vs chè, e thik các loại nước ngọt không có gas vd như nước yến, sữa chua, sữa trái cây, sữa của các hạt đậu, bánh ngọt, nước nha đam, e thik ăn các loại bánh mỳ, đốc cơ thanh .","e thik chơi cầu lông, , thik chạy bộ"
5444,hướng nội,bún bò,"xem phim, chơi game"
5445,"thích coi phim, là một người ít nói hướng nội",cơm chiên trứng,coi phim hoạt hình
5446,"thích tự lập, nói nhiều","nước ép trái cây, bánh ngọt",Thích đi bộ
5447,Hướng nội nhưng thích làm social media,"thịt nướng, bún bò",Học ngoại ngứ
5448,"bạn bè., thích ở một mình với gia đình",thích ăn MÌ TÔMMMMM,Thích học thích code
5449,"hướng nội 35%, hướng ngoại 65%, tôi thích nói chuyện với mọi người nhưng đồng thời tôi cũng có những lúc thích một mình",Socola ngọt ngào có chút đắng,Đọc sách
5450,"nhưng không phải e sợ đám đông, hướng trung (ambivert) lúc thích một mình","ăn pizza, phở bò, bún chả, bánh gai",Nghiên cứu về tài chính
5451,Là một người ít nói hướng nội,"mì cay, bún đậu, nước ép","nấu ăn, bơi lội, xem phim"
5452,"thích ở một mình, tôi là một người ít nói, hướng nội","bánh căn, mì quảng, bánh xèo, gà rán hay đồ chiên, cơm tấm","xem phim, đọc tiểu thuyết, truyện, nghe nhạc"
5453,"ít bạn, thích ở một mình, mình là một người hướng nội","sushi, mì quảng, bánh gạo, mì trộn","xem phim, du lịch, nghe nhạc, đọc sách, nấu ăn"
5454,"hướng nội, hướng ngoài., kiểu người","hơi kén ăn 1 chút, thích uống trà sữa ạ :v","tâm lí học, thiết kế"
5455,"thích ở một mình, là một người hướng nội","bò kho, trà sữa, bánh mì, cơm tấm",Cầu lông
5456,Hướng nội,Cheese fries,Đọc sách
5457,Trầm tính,Bún bò,Thích chơi với chó mèo
5458,là một người ít nói hướng nội,"salad, ...., thịt bò",đi chơi ngoài trời
5459,"là người ít nói chuyện, người đang học trường fpt",thích ăn món mì cay,"cờ tướng, cờ vua"
5460,Hướng ngoại part-time,Thích ăn trứng vịt lộn,Đu OTP
5461,Thích ở một mình,"pizza, gà rán","xem phim, coding"
5462,hướng lung tung,thịt nướng,ngủ
5463,"một người ít nói hướng nội, thích ở một mình, ....","coca cola, ..., bánh kẹp thịt, thích ăn mì cay","thiên văn học, thích đá bóng, ..., toán, bơi lội"
5464,"hướng nội, khác trầm","red bull, bánh xèo","thể thao, du lịch, học hỏi"
5465,"thân thiện, hoà đồng","pepsi, gà rán, mì gói, ...","anh văn, đá bóng, .., chơi game"
5466,"mình là ng dễ giao tiếp, cũng có lúc hướng nội có lúc hướng ngoại","ăn vặt, đồ ăn hàn quốc","đi dạo, đi ăn"
5467,Trầm trầm nhưng lúc cần vẫn vui hết mình,Phở,"sự logic, đá banh"
5468,thích tự do,đồ ăn nhà nấu,"chăn nuôi, thể thao"
5469,"chỉ thích ngủ một mình, hướng ngoại thích chia sẻ tuy nhiên hơi khó ngủ",thích ăn đồ Việt Nam,"thích hát, thích đọc truyện"
5470,"một người ít nói hướng nội, thích ở một mình",mì cay trà sữa,"truyện, xem phim"
5471,", thích ở một mình, hướng ngoại, hướng nội, ","xoài lắc, lẩu kim chi, mì cay","xem phim, thích chơi cầu lông"
5472,Hướng nội,"bún bò, trà dâu",Đếm tiền
5473,Thích giao lưu,"gà rán, xôi, trà sữa",Thích môn toán
5474,"thích ở một mình, hướng nội, 1 tháng chắc 1-2 lần) để giao lưu, dành thời gian cho bản thân nhiều hơn. nhưng vẫn tham gia clb cũng như đi chơi với bạn bè (nhưng ít, tìm người người làm đồ án tốt nghiệp chung.",lẩu cá đuối,"đi du lịch, chơi game, đi chơi"
5475,"một người ít nói hướng nội, thích ở một mình","thích ăn mì cay, bún đậu mắm tôm",tâm lý học
5476,Trung lập,Hầu hết các món con người dùng được,"đá bóng, thể thao"
5477,Hướng nội,"đậu hũ cà chua., thích ăn đồ ăn của mẹ với cậu nấu. thích nhất là canh khổ qua",Đọc truyện
5478,Là người hướng nội part time,"bún đậu, mì cay, nước ép","chơi game, thích đọc truyện"
5479,Hướng nội,"gà rán, pizza","chơi game, đọc sách"
5480,Hướng ngoại nhưng có xu hướng thích ở một mình (hoặc thêm người nhưng được yên tĩnh),Eatclean,code
5481,"khá hòa đồng, thích vui vẻ, nhộn nhịp",Ăn đồ ngọt uống nước ngọt,"thích đánh cờ, chơi đàn"
5482,"là một người 2 hướng, hướng nội về đêm. có thể chia sẻ giúp mn vượt qua sự tiêu cực nhưng bản thân mình thì không","bánh xèo, gà rán hay đồ chiên, cơm tấm, mì quảng, bánh căn","môn nào vui thì môn đó chơi. ví dụ: đá bóng dù trên game hay ngoài đời đều có sự kịch tính, trí tuệ như nhau nên điều đó cũng là một sự thú bị"
5483,là một người ít nói hướng nội,Thích đồ ngọt,Võ
5484,"hoà đồng với mọi người, một người vui vẻ","thích ăn cay, đồ ngọt",Trống
5485,Thích yên tĩnh,"trà sữa, gà rán",đi chơi ngoài trời
5486,Là một người hướng nội thích ở một mình,"mì, phở, hamburger",Xem phim
5487,"thích đám đông, người hướng ngoại, nói rất nhiều","pepsi, cơm, coca, sprite, revive, bánh mì..., 7up, mi tom, moutain dew",Ngủ
5488,"nhưng lúc high thì lại muốn nói rất nhiều, thích có ko gian riêng tư 1 mình, , đôi khi ko thích chia sẻ nhiều lắm",Không rõ,Thích chơi suốt ngày
5489,Hướng nội,Nước suối trà nóng,Thích
5490,Hướng nội ít nói thik ở một mình,bánh mì,Chơi thể thao
5491,"hoà đồng, thích ở một mình, ít nói","các món gỏi, các món ăn truyền thống hoặc món ăn đường phố việt nam","chơi game, xem phim"
5492,"vui vẻ, hòa đồng, thân thiện",bún bò,"mua sắm, xem phim"
5493,Hướng nội,"bánh xèo, nước dưa hấu ép, ..., bún chả, bánh canh","nghe nhạc, xem phim"
5494,"hướng ngoại, , hướng nội","nem nướng, trà sữa, chè bưởi, bánh tép, canh kim chi, gà rán, ........., bún bò, cút lộn rang me, bánh chuối chiên, cháo lòng, bánh bao, gà hấp nước mắm, bò né, lẩu gà, bánh xèo, mì xào, lẩu bò, lẩu thái, cháo gà, bún mắm, bánh canh, bò nướng, bún riêu, hột vịt lộn rang me, hủ tiếu xào, ham bơ gơ","thường thức tác phẩm nghệ thuật, xem phim"
5495,"chung chung, hơi ngại giao tiếp nhưng sẵn sàng học hỏi","đồ ngọt, coca cola","du lịch, xem phim, đọc sách"
5496,"hướng ngoại, thích kết bạn",Đồ ăn ngọt,"game online, gym"
5497,"khá hướng nội. thích sạch sẽ, thích yên tĩnh",Em thích các loại bún ạ,Thích đọc sách
5498,Hướng nội,thích ăn món mì cay,bóng đá
5499,"hoà đồng, vui tính, thích được đi chơi, hướng ngoại",Bún đậu,Nghe nhạc
5500,Bình thường,Cafe,Chơi hame
5501,Tính cách thất thường,"tôm, những món có vị chua, trứng",Esports
5502,Hướng nội,"trà sữa, trà đào…, kem, tôm chiên","xem phim, vẽ, làm gốm, ngủ:))"
5503,Thích một mình nhưng lại sợ cô đơn,"trà sữa, bánh mì, cơm tấm, bò kho","ngoại ngữ, toán"
5504,"cống hiến hết mình, đam mê học tập, hướng nội","phở bò, bún chả, ăn pizza, bánh gai","mình thích chạy bộ, đánh cầu lông, o buổi tối, o buổi sáng, o buổi chiều, đi xe đạp"
5505,Hướng nội,bún bò,Xem youtube ngủ nghỉ ngơi
5506,"thích ở một mình., một người ít nói hướng nội",Cà phê,Đá banh
5507,thích ở một mình,"1. Tofu
2. Bánh mì ( thích mọi loại bánh mì)
3. Nước ép","học hóa, nghe nhạc, đánh cờ vua, lướt mạng"
5508,"hòa đồng, vui vẻ","trà sữa, gà phô mai",Cầu lông
5509,"hòa đồng, tốt bụng, dễ thương, hướng trung",Trà sữa,Chơi game
5510,Thích ở 1 mình,Thịt nướng,Câu cá đá bóng
5511,Thích ở một mình,trà sữa,"xem tv series, chụp ảnh"
5512,"một người ít nói hướng nội, thích ở một mình","bánh mì, cà phê sữa, đồ ngọt",Tiền
5513,"là một ambivert, không lười thì đi có hứng thì xác xe, thích đi đây đi đó trải nghiệm những thứ mới mẻ nhưng tùy hứng",trà chanh trân châu,Thích xem phim
5514,", hướng ngoại tùy hoàn cảnh ; không thích nơi quá ồn ào ; không thích người nói nhiều ; không thích nói đùa ; nhớ dai nhưng cũng dễ bỏ qua ; không thích chia sẻ tâm sự ; không thích bị quản lý ; hơi vô tâm ; dễ xúc động ; cái tôi cao ; có tham vọng ; hoàn toàn tự hào khi làm tốt 1 công việc được giao, hướng nội",Mỳ cay,"đàn hát, đọc sách, xem phim, vẽ"
5515,Hướng nội,Mì gói,Chơi nhạc
5516,Mê chơi đá gà,mì cay trà sữa,Cũng không biết thích gì
5517,"thích một mình, thích đông vui, hoà đồng, ","socola, buger, pizaa ...","thích đọc truyện, học tiếng anh, nghe nhạc"
5518,"là một người ít nói, thích đi ra quán cafe để học bài",Bánh tráng các loại,"coi phim, bơi, ngủ"
5519,Mình là một người khá rụt rè khi ở một mình.,Bánh mì,Ko thích gì hết
5520,Hướng nội,thịt nướng,ngủ
5521,"dễ chịu, hơi hướng nội","đồ ngọt, đồ ăn vặt hoặc đồ hàn, nhật","lập trình, kiếm tiền, đá bóng, cầu lông"
5522,Đôi lúc hướng ngoại đôi lúc hướng nội,Kfc,Xem phim nghe nhạc
5523,"thích ở một mình, ít nói hướng nội","đồ cay, mỳ hoành thánh, bún bò, nước ép trái cây",Ngủ
5524,"thường thích ở một mình, hay giận vu vơ, ít nói với người lạ",Coca,Xe cộ
5525,"hướng nội part time, nhưng hướng nội với người lạ, hướng ngoại với người quen","thịt sườn, pepsi, thịt bò",Nghe nhạc
5526,"thân thiện, nhạy cảm, ít nói, vui tính, dễ bị lung lay bởi cảm xúc",Trà sữa,Nghe nhạc
5527,Hướng nội,"kem ốc quế..., snack khoai tây, bánh mì kẹp các loại","chơi game, thích đá bóng"
5528,"làm quen nhiều bạn mới, hướng ngoại, thích đi chơi cùng những người bạn thân thiết, hướng nội, là người",Ăn đồ ngon,"chơi game, xem anime"
5529,Hoà đồng,"ngũ cốc, đồ ăn chay, sữa đậu nành, lẩu, nước ép., các món về tôm, ức gà","Thích:
1. Thiên nhiên cây cỏ
2. Bóng bàn"
5530,"vui tính, ít nói nhưng hướng ngoại",Trà đào thạch sữa,"đi dạo, đi ăn"
5531,"nhưng lại thích giao lưu =)), thích ở một mình",Bún đậu,"uống cà phê, nằm dài nghe nhạc"
5532,Hướng nội,Thích uống trà sữa,"toán, kĩ thuật, khoa học"
5533,Lúc này lúc kia,Món ăn Health,"chính trị, khoa học, nhảy, hát"
5534,"thân thiện, hoà đồng","bimbim, gà rán, bún, hủ tiếu ….","chụp ảnh, âm nhạc, code"
5535,hướng nội,"hủ tiếu nam vang, cơm chiên các loại, cơm gà, khô các loại, hoành thánh, cơm đậu hũ dồn thịt xốt cà, beer, cà phê, mì quảng, cơm sườn, xôi mặn, sâm bổ lượng, cơm bò xào, mì các loại, nước ngọt có ga, bò kho, bánh mì",Bóng rổ
5536,Hướng ngoại,"đồ nướng, cà phê",Vẽ
5537,Một người hướng nội thích sự im lặng,"khoai lang lắc, bò nea, trà sữa, sữa bắp, gà rán, mì cay",Đánh Cầu Lông
5538,"hướng ngoại, thích thử thách",tất cả các loại mì,Vẽ
5539,Hoà đồng vui vẻ,"bánh ngọt, kem","văn học, lịch sử"
5540,hướng nội,Bánh chocopie,"tiếng anh, đá bóng"
5541,"hiền hoà, dễ tiếp xúc, hướng ngoại, thân thiện",Mì ý,"chơi thể thao, thích học ngôn ngữ anh, đọc sách, thử nhiều điều mới"
5542,"thích ở 1 mình, cá tính mạnh, hướng nội","bánh bột lọc, nước rau má","đi chơi cùng bạn bè người thân, cafe, bóng rổ, đá bóng"
5543,"rụt rè, là người hướng nội, hiểu biết., ít nói, e là một người khá tự ti, sống tình cảm vs chăm chỉ nhưng e hơi chậm so vs bạn bè cùng tuổi về sự linh hoạt","thịt bò, ...., salad",Nghe nhạc
5544,thích kết bạn,Thịt nướng,thích động vật
5545,Một người hướng nội nhưng cũng thích xã giao với mọi người,Cơm nước ngọt blahblah,"cầu lông, nghe nhạc"
5546,"một người hướng nội, thích ở một đám",các thế loại mì,"phụ kiện công nghệ, game"
5547,"thích tự lập, nói nhiều","mình thích uống trà sữa, hoặc các loại nước có gas",đá bóng
5548,hướng ngoại nhung thích ở một mình,Socola ngọt ngào có chút đắng,"xem phim ngôn tình, phim hoạt hình"
5549,"nhiệt tình, thích giao lưu, quyết đoán","bún bò, hải sản","bóng bàn, thích đá banh"
5550,"người đang học trường fpt, là người ít nói chuyện","mình thích trà bí đao ngô gia, mì gói, coca","chơi game, nghe nhạc, đọc sách, thiết kế, vẽ"
5551,"sạch sẽ, sợ xã hội","coca cola…, kẹo dẻo","chạy xe, thích xem tivi, đọc truyện tranh, nghe nhạc, học nhóm online, tắm (2l/ngày), đi mua sắm

không thích: chạy bộ, thích ngủ, thích bơi, các hoạt động phải chạy, tụ tập với bạn bè, đồ ăn ngọt, trang điểm, phim truyền hình, xem mv ca nhạc, thích chơi game offline, call điện thoại, thích đồ ăn nhạt"
5552,", mình là một người hướng ngoại, thích đi dây đó, trải nghiệm",thích ăn mì cay,Badminton
5553,"hướng nội, ngoại","hải sản, những món ăn liên quan đến kim chi, ... thật ra thì ngoại trừ rau cần, các loại lẩu, vị đậm đà😋, các loại thịt nướng, thì cái gì mình cũng ghiền nhưng điều kiện là phải nấu ngon, các loại bún, cơm cháy kho quẹt",Đu OTP
5554,"hoạt bát, yêu thiên nhiên, là một người nhiệt tình","trà sữa, ..., gà rán","xem phim, truyện, nghe nhạc, đọc tiểu thuyết"
5555,hướng nội ít nói nhưng hoà đồng thân thiện,Gà,"nghe nhạc, đọc sách"
5556,mình khá dễ hòa đồng nhưng tùy đối tượng,"cơm, stings, coca cola, mì gói, bánh mì","chơi game, holywood, coi phim anime"
5557,Ít nói,Gà jollibee,Đi phượt
5558,Lowkey,Trà sữa,"nghe nhạc, ngủ, code"
5559,Hướng nội trầm tính,"kem, bánh ngọt",Thích đá banh
5560,"mình là một người thích vẽ năng động, , thích tham gia các hoạt động xã hội","trà sữa, bún bò, các món nhật","chơi game, cầu lông"
5561,"thân thiện, hoà đồng","..., cá kho, canh cải","xem các show giải trí thực tế, đọc truyện, nghe nhạc"
5562,Vui nhộn,snack,"toán, bóng chuyền, đọc truyện, bóng đá"
5563,Ít nói hướng nội,Bánh mì,"đọc sách, xem phim, tập thể dục, nghe nhạc"
5564,Năng động,Mì cay,chơi game
5565,"bạn bè., thích ở một mình với gia đình","chỉ cần không cay là được, không đặc biệt yêu thích gì","đọc sách.., hít thở không khí trong lành ở công viên, nghe nhạc"
5566,"thẳng tính, dễ thích ứng, vui vẻ…",", lẩu, mì cay, ốc, trà sữa",Tiền
5567,Hướng ngoại thân thiện vui vẻ,"xúc xích, sting, kem",Choi game
5568,Hướng ngoại,"xúc xích, gà, trứng","đá bóng, đi du lịch, thích coi phim, đi cắm trại, chơi game, bóng rổ"
5569,Hướng nội,"ít đường, mình ăn thích ăn đồ healthy, ít mỡ","tập thể dục ngoài trời, tập trung nghiên cứu một vấn đề nào đó, đi phượt, ngắm bầu trời, đạp xe đạp, đi từ thiện, đọc sách, tỉ tê những câu chuyện đời thường sâu sắc với mọi người xung quanh., nấu ăn, được ăn, decor phòng, coi anime"
5570,Hướng ngoại part-time,"nước cam, bông lan trứng muối","nghe nhạc, bơi lội, chơi game"
5571,"hướng ngoại, dễ hòa nhập",Ăn được uống được,"thích đá bóng, thích khoa học, bơi lội."
5572,Hướnh ngoại,"mình ăn uống healthy nền chỉ uống nước ép trái cây, không uống nước ngọt có ga",Đá bóng
5573,"là một người ít nói hướng nội, thích coi phim","bánh tráng, cafe","chụp ảnh, đi du lịch"
5574,"thích gọn gàng, độc lập, thích ở 1 mình",Có ăn . Nhiều lắm nào cũng ăn được,"…, nghe nhạc, đọc sách, đá banh"
5575,"năng động, thích đi các hoạt động xã hội","uống trà sữa, thích ăn vặt",Nhiều lắm . Chơi được đa nghề :)
5576,"thích đi lang thang một mình, hướng nội",Thịt,Toán
5577,"một người ít nói hướng nội, thích làm việc, có phần hơi thích kiểm soát, ở một mình",Cơm nhà,Thích đọc sách
5578,"ít nói nhưng thích đám đông, thích đi chơi với bạn bè, người thân",Suit my taste is fine,Đá bóng
5579,Extrovert,"bánh mì, xôi, coca cola",nghe nhạc
5580,Thích cứ gái,"thịt nướng, pepsi",du lịch
5581,Là 1 ng ít nói hướng nội cà thích ở 1 mình,Bánh mì,Chơi game
5582,Dễ chịu,Thích ăn trứng vịt lộn,"nói chuyện cùng bạn bè, ngắm cảnh"
5583,Là người hướng nội,"thịt kho tàu, canh trứng cà chua","đọc truyện, chơi game, xem phim"
5584,"xàm, nói nhiều, dễ tính",Chocolate,Mình thích ngôn ngữ
5585,Vui vẻ ích nói,"thích ăn những món ăn không quá đậm vị, eat-clean",Bóng chuyền
5586,"hoạt bát, thoải mái khi gia nhập, o tập thể, thích ngoại giao","đồ ăn nhanh, coca",Thiên văn học
5587,"hướng nội, vui vẻ, nhưng vẫn hoà đồng, ít nói",Chả giò,"kpop, vẽ..."
5588,"người hay thay đổi, thích đi chơi đây đó nhưng cũng hơi trầm tính khi ở với người lạ",Bún đậu mắm tôm,online shopping
5589,"cũng có lúc hướng nội có lúc hướng ngoại, mình là ng dễ giao tiếp","ăn cơm mẹ nấu, cơm người yêu nấu",thích hút thuốc
5590,Là một người ít nói hướng nội,"gà rán, sting, thịt xào nấm mèo, c2, fanta, nui xào, bánh mì",Mua sắm
5591,"thích ở một mình, là một người hướng nội",Cái gì cũng thích ăn,Bóng đá
5592,"lười giao tiếp..., thích ở nhà hơn là ở ngoài","0 độ, tắc, trà đào, các loại bạn","thích đá bóng, bóng chuyền, cầu long."
5593,"hướng ngoại khi cần thiết, bán hướng nội ambivert",Bún chả nướng,"đá bóng, đá cầu, thích khám phá xung quanh"
5594,Hướng nội,"củ, chất béo hay phô mai. không ăn được cua :3, quả, cá, nước trái cây, các món nhiều gia vị, drink: (ưu tiên) nước lọc, sương sáo các thứ
food: cái gì cũng ăn được. thích rau, nước thảo mộc, mùi hương (hành tỏi tiêu ớt sả đầy đủ), nước trà, 7749 loại mắm. không thích đồ ăn chứa quá nhiều dầu, ăn được đồ nặng mùi, trứng",Esport
5595,"hướng nội, cần nhiều riêng tư","pepsi, phở bò",Nghe nhạc mọi lúc mọi nơi ; đọc tiểu thuyết ; thiết kế hình ảnh logo banner poster
5596,Nói nhiều hướng ngoại thích đi đây đó,"bò kho, mì quảng",Hát
5597,"hướng nội 35%, hướng ngoại 65%, tôi thích nói chuyện với mọi người nhưng đồng thời tôi cũng có những lúc thích một mình",Không quá kén chọn,học tiếng Nhật
5598,Không thích nơi đông người,Món j có topping thì đều thích,Ca hát
5599,Hướng nội,"nước ngọt, trà sữa",coi phim hoạt hình
5600,"sống lowkey, là một người ít nói hướng nội nhưng cũng có thẻ hướng ngoại parttime",Thích đồ chay,"lướt mxh, vẽ"
5601,"hướng nội, tự do, sống cống hiến",Bánh kẹp thịt,Thiên Văn Học
5602,"muốn một mình nhưng sợ cô đơn, hướng nội, hiếm khi thấy vui, có thể đi ăn ngoài nếu được mời, nói khi cần thiết, có thể mời người ta đi ăn nếu vui",Socola đá xay,"thích đá bóng, thích chơi game"
5603,"là 1 người ít nói hướng nội, thích ở 1 mình",Mì tương đen,"đọc truyện, game"
5604,Giống ví dụ,Fast food,"cầu lông, gym, ..., bơi"
5605,"hướng nội, khác trầm",đồ gì có vị cay,"xem phim, vẽ"
5606,"năng động, vui vẻ...",No,"nghe nhạc, mình thích xem phim"
5607,"ít nói hướng nội, thích ở một mình",Mỳ cay,"nghe nhạc, phim hành động, các chương trình giải trí"
5608,Bình thường 🤤,"xoài lắc, lẩu kim chi, mì cay","đọc truyện, ngủ"
5609,Hướng nội nói nhiều,Udon,"anh văn, đá bóng, chơi game, .."
5610,"khá vui vẻ, là người ít nói","món nướng, đồ ngọt, kem, trái cây, lẩu",Đọc sách
5611,"có xu hướng ambivert, thích kết bạn, nghiêng về hướng ngoại","Mình thích ăn đồ ngon=))))
Ăn chay hay ăn mặn gì cũng đc",Bơi lội
5612,"thân thiện, lúc hướng nội lúc hướng ngoại, tùy lúc",Trừ đồ quá ngọt quá mặn thì cái gì cũng có thể ăn,Chơi game
5613,Cầu toàn,Ăn cơm gia đình tự nấu,Tìm hiểu về văn hóa các nơi
