,Bio_personality,food_drink,hobby_interests
2919,"một người hướng nội, thích ở một đám",Coca-cola,Nghiên cứu về tài chính
2920,"là một người ít nói hướng nội, thích ở một mình","nước c2 chanh, táo, phở","stress thì mình đâm đầu vô luôn, sở thích của mình là thay vì thoát khỏi áp lực"
2921,"ngại bộc lộ tâm tư tình cảm cá nhân với người khác., là một người khá là trầm tư, thích suy diễn mọi chuyện trên đời","..., bún chả, nước dưa hấu ép, bánh xèo, bánh canh",Cầu lông
2922,"là một người ít nói, thích đi ra quán cafe để học bài",No,"chơi game, ăn, bơi, phim, thể thao"
2923,Năng động,"mì quảng, gà rán hay đồ chiên, bánh căn, bánh xèo, cơm tấm","coi phim, công nghệ, đọc truyện"
2924,", thích ở một mình, hướng nội, , hướng ngoại","mì, phở, hamburger","đọc sách, thể thao"
2925,"hướng ngoại, thích kết bạn",Mì tương đen,"ngắm cảnh, nói chuyện cùng bạn bè"
2926,"thích ở một mình, .... nhưng thích trải nghiệm điều mới, lowkey, một người ít nói hướng nội","bún thịt nướng, olong, bún rêu, cháo lòng",Đá banh
2927,"thích 1 mình, không thích nói nhiều, lười làm việc nhà",Bún chả nướng,"chơi game, đọc sách"
2928,"thích giao tiếp, hướng ngoại","cà phê, đồ nướng","coi phim, chơi game, vẽ"
2929,"có xu hướng ambivert, nghiêng về hướng ngoại, thích kết bạn","xôi, bánh mì, coca cola",Chơi hame
2930,"sợ xã hội, sạch sẽ",Món j có topping thì đều thích,"nghe nhạc, đọc sách, đi tản bộ"
2931,hướng ngoại nhung thích ở một mình,"nước ngọt, trà sữa",đá bóng
2932,Hướng nội,"trà sữa, tôm chiên, kem, trà đào…",Ngủ
2933,Là 1 ng ít nói hướng nội cà thích ở 1 mình,snack,"chơi vape, thích chơi bóng rổ"
2934,Indoor type,Spaghetti,"hội hoạ, cờ vua, âm nhạc, ngoại ngữ"
2935,"thích ở một mình, là một người hướng nội",Cái gì cũng thích ăn,"thiên văn học, toán, vân vân..."
2936,Là một người hướng nội thích ở một mình,"kem, xúc xích, sting","đi du lịch, đá bóng, thích coi phim, đi cắm trại, chơi game, bóng rổ"
2937,"hơi hướng nội, dễ chịu","ngũ cốc, lẩu, sữa đậu nành, ức gà, đồ ăn chay, các món về tôm, nước ép.","mình rất thích nghệ thuật, mình còn có thể chơi cầu lông nữa, thường hay quan tâm những tin tức về nó"
2938,hướng nội,"không đặc biệt yêu thích gì, chỉ cần không cay là được",Tìm hiểu về văn hóa các nơi
2939,"hướng nội, ngoại",Mì Nước lọc,"đá bóng, thể thao"
2940,"ít nói nhưng hướng ngoại, vui tính",Em thích các loại bún ạ,Ca hát
2941,"hoà đồng nhưng cũng thích ở một mình, ít nói",Trà chanh,"đánh bóng bàn, đọc sách"
2942,"hướng nội thích ở 1 mình, ko thích đi chơi",Salad,du lịch
2943,Khó giao tiếp,Trà sữa,Xem phim nghe nhạc
2944,"hòa đồng, vui vẻ","bánh ngọt, kem","chơi game, cầu lông"
2945,thích ở một mình,"thích đồ ăn có trứng muối, ..., thích bánh sandwich nướng, thích đồ ngọt, không thích ăn cay lắm",coi phim hoạt hình
2946,Thích một mình nhưng lại sợ cô đơn,"...; các loại thức ăn truyền thống của miền nam như bánh xèo, bột sò, mứt; các loại món nước như hủ tiếu, bánh cam, kẹo, bún nước lèo, bánh căn, hải sản nước, bánh khọt, bánh tàu hủ. các món nướng như cơm sườn, bánh canh, mì gói, bánh, ........; nói chung là mình thích ăn rất nhiều món :3, mì xào mì trộn, các loại đồ ngọt như chè, fastfood, lẩu, thịt nướng, bánh mì, nước ngọt có ga, bánh bò",Bơi lội
2947,"nói nhiều, xàm, dễ tính",Bánh tráng trộn,"game, đọc truyện"
2948,Thích cứ gái,"mì, hủ tiếu, bánh canh, phở…","đá bóng, đi chơi cùng bạn bè người thân, bóng rổ, cafe"
2949,"thích ở một mình, một người ít nói hướng nội",Bánh mì,"ăn uống, đi chơi, tiêu tiền., nghe nhạc, du lịch, kiếm tiền"
2950,"hòa đồng, quan tâm người khác, chia sẽ",Coca,"ăn uống, xem phim, du lịch"
2951,người hướng nội,"bún bò, trà sữa, các món nhật","phim hoạt hình, xem phim ngôn tình"
2952,"dễ thích ứng, thẳng tính, vui vẻ…","lẩy thái, trà đào, bánh plan, lẩu chay",Vẽ
2953,"nhưng lại thích giao lưu =)), thích ở một mình","bún, gà rán, bimbim, hủ tiếu ….","game, bơi lội"
2954,Hướng nội,Thịt nướng,Nghe nhạc mọi lúc mọi nơi ; đọc tiểu thuyết ; thiết kế hình ảnh logo banner poster
2955,Ít nói hướng nội,trừ đồ đắng ra thì mình đều ăn được,"đọc sách, nghe nhạc"
2956,"thích yên tĩnh, hướng nội","gà rán, xôi, trà sữa",Choi game
2957,Huong Noi,"uống caffee, thích ăn mì cay, o mỗi buổi sáng",Ngủ
2958,Ít nói,"đồ ngọt, coca cola",vẽ
2959,"hơi hướng nội, thích ở một mình nhưng vẫn hoà đồng giao tiếp tốt với mọi người",Chocolate,Đọc sách
2960,"hướng nội, ít nói, thích ở một mình., nhạy cảm",Mì gói,Đi phượt
2961,"thích ở một mình với gia đình, bạn bè.","các món gỏi, các món ăn truyền thống hoặc món ăn đường phố việt nam","cầu lông, diy.., bơi"
2962,Trầm trầm nhưng lúc cần vẫn vui hết mình,Mình thích ăn tất cả những gì mình thấy ngon. Riêng đồ uống thì mình có niềm đam mê sâu sắc với Rau Má,Bị người ta lùa gà
2963,Thích sống ở trọ,Đồ ăn ngọt,"dọn dẹp, vận động thể lực (nhẹ), nghe nhạc, hát, tấu hài, tám chuyện, xem phim, chụp ảnh, đi dạo ngắm cây, vẽ"
2964,Là một người ít nói hướng nội,"mình ăn thích ăn đồ healthy, ít đường, ít mỡ","viết lách, làm mô hình, vẽ, đọc sách"
2965,Extrovert,"bánh ngọt chill, coffee chill, thức ăn chill, trà đào, ...","kinh quẻ, phong thủy, pokemon, chiêm tinh, đông y"
2966,"cũng có lúc hướng nội có lúc hướng ngoại, mình là ng dễ giao tiếp",Đi ăn với bạn,Thích học bài
2967,thích tự do,"..., bánh trán trộn, mì cay","chơi game, xem anime"
2968,"Mình là ambivert
Có tính cách khá là khùng khùng điên điên nhưng cũng hay nhiều tâm sự","., nước ngọt miễn là nước ngọt có ga, mì gói, mì trộn, trà olong","văn học, lịch sử"
2969,Là người hướng nội,Suit my taste is fine,"âm nhạc, truyện, ..., đọc sách, du lịch"
2970,Hướng nội part time,Bánh . nước coca . mì cay...,Thích đá banh
2971,Vui vẻ hoạt bát năng động nhưng hơi hướng nội,"đồ thái, ăn haidilao, ăn sushi","chơi game, nghe nhạc"
2972,Vui vẻ hoà đồng,"mình ăn uống healthy nền chỉ uống nước ép trái cây, không uống nước ngọt có ga",Esport
2973,"là 1 người ít nói hướng nội, thích ở 1 mình",bánh kẹp thịt bò với sữa,"đi dạo, đi ăn"
2974,Vui tính,"pepsi, thịt bò, thịt sườn",Thich chơi thể thao võ
2975,Hướng nội,Gà,"nghe nhạc, chơi đàn"
2976,"đôi lúc hướng ngoại, đôi lúc hướng nội",Phở,"học toán, thể thao, ngủ"
2977,"năng động, vui vẻ...",Cơm nước ngọt blahblah,"thể dục, xem anime, vẽ tranh"
2978,Í nói hướng nội,Thích đồ chay,Mình thích ngôn ngữ
2979,Vui vẻ,Cheese fries,Chơi
2980,Giống ví dụ,"mì cay, cá hồi","xem phim, chơi game"
2981,Nửa nội nử ngoại,Socola đá xay,"nghe nhạc, hít thở không khí trong lành ở công viên, đọc sách.."
2982,"cá tính mạnh, thích ở 1 mình, hướng nội",Thích uống trà sữa,Đọc sách
2983,"nhanh nhẹn, tôi là một người hoạt bát","đặc biệt là mì cay, mình rất thích ăn đồ ăn cay",Toán
2984,Hướng nội,Trà sữa double trân châu,"đọc sách, vẽ, xem phim, đàn hát"
2985,là một người ít nói hướng nội,"bún đậu, nước ép, mì cay","mình thích xem phim, nghe nhạc"
2986,"thích vui chơi, nói nhiều","revive, sprite, cơm, mi tom, pepsi, moutain dew, 7up, bánh mì..., coca",Đá bóng
2987,"hướng nội với người ngoài, một người hướng ngoại với bạn bè",Thịt nướng,"tâm lý học, vẽ, ca hát, thiết kế"
2988,không phải hướng nội nhưng không thích chỗ đông người,"pepsi, gà rán, ..., mì gói","game mobile, đá bóng"
2989,Hướng nội thích ở một mình,"bún bò, cơm tấm, phở",Trống
2990,"hướng nội part time, thích mọi thứ có trật tự, thích sự an toàn dù chạy xe ẩu (ý là cái gì cần phải xảy ra thì phải đảm bảo nó được xảy ra, hoặc có backup), hướng ngoại full time, v.v, thích trò chuyện, dễ quạu dễ nguôi, hay dài dòng, ngăn nắp dù hay bày bừa (xong rồi dọn ngay)",Bánh mì,"ngủ:)), làm gốm, xem phim, vẽ"
2991,Hướng nội,"mì cay, xoài lắc, lẩu kim chi",tâm lý học
2992,Ồn ào,Bánh ngọt,"ngủ, đọc truyện"
2993,Lúc này lúc kia,"bánh mì, phở",mình thích hát
2994,Linh hoạt,đồ ăn healthy,"đọc sách, đi chơi"
2995,"hướng ngoại, hướng nội, ",Nước lọc,"giải đố, đá bóng"
2996,", hoà đồng, thích một mình, thích đông vui","trà sữa, mỳ xào, bún chả, bánh cuốn","chơi game, xem phim, chụp ảnh, , edit"
2997,"lạc quan năng động, tích cực",Udon,"chơi game, thích đọc truyện"
2998,"một người ít nói hướng nội, thích ở một mình","nước ngọt, ăn vặt",Đá bóng
2999,Hướng ngoại,"bánh xèo, red bull",Thích nghe nhạc
3000,Hướng nội,lẩu cá đuối,"gym, cầu lông, bơi, ..."
3001,Thích ở 1 mình,"thịt kho tàu, canh trứng cà chua","tin học, …, yoga, toán"
3002,"một người ít nói hướng nội, thích ở một mình.",Fanta vị nho : D,"các chương trình giải trí, nghe nhạc, phim hành động"
3003,hướng nội ít nói nhưng hoà đồng thân thiện,Chả giò,"thể thao, chăn nuôi"
3004,"đôi khi hướng ngoại, đôi khi hướng nội",Trà sữa,Nghe nhạc
3005,Em thích ở tập thể nhưng có không gian riêng. Em hướng nội hướng ngoại part time,Ăn đồ ngon,Xem phim
3006,"nhưng ít nói, hoà đồng","đồ ngọt, trà đào",Chơi game
3007,"thích ở một mình, ít nói hướng nội","cơm tấm, hủ tiếu, mì quảng",Xem phim
3008,"là người ít nói, khá vui vẻ","gà rán, miến trộn","nấu ăn, pha chế, thư giãn, thích đọc sách"
3009,"thích tận hưởng không gian 1 mình, hướng nội","mỳ hoành thánh, đồ cay, bún bò, nước ép trái cây","đá cầu, thích khám phá xung quanh, đá bóng"
3010,"hướng nội, khác trầm",Pizza,thích động vật
3011,"thích nghệ thuật, là một người nội",Trà sữa,Mua sắm
3012,thích ở một mình,"mỳ quảng, bún bò, bánh canh, bánh bèo",nhảy
3013,Hướng ngoại thích giao tiếp vui vẻ hoà đồng,"mặn, pizza, các loại bánh ngọt","xem tin tức công nghệ, chơi game, nghe nhạc"
3014,"năng động, thích đi các hoạt động xã hội",Bánh bò,"nhảy dây, ngủ, chơi cầu lông, game"
3015,hướng nội,Cà phê,", thik chạy bộ, e thik chơi cầu lông"
3016,"hướng trung (ambivert) lúc thích một mình, nhưng không phải e sợ đám đông","ăn vặt, đồ ăn hàn quốc",Thích đi bộ
3017,Hướng nội nhưng thích làm social media,"thịt kho mắm ruốc, sinh tố bơ, nước ép thơm, cá tra nhúng giấm, mắm chưng","nấu ăn, xem phim, bơi lội"
3018,Nói nhiều,"mình thích ăn các loại đồ ngọt, đặc biệt là chè","thể thao, học hỏi, du lịch"
3019,mình khá dễ hòa đồng nhưng tùy đối tượng,"thích ăn mì cay, bún đậu mắm tôm","xem phim, chơi game, đọc truyện"
3020,"logic, nghiêm túc",Thích đồ healthy,"đi chơi, chơi game, đi du lịch"
3021,Ít nói nhiều,đồ ăn Hàn Quốc,"chơi game, thiết kế, vẽ, đọc sách, nghe nhạc"
3022,Hướng nội,hamburger,"bơi lội, chơi game, nghe nhạc"
3023,"có thể đi ăn ngoài nếu được mời, hướng nội, nói khi cần thiết, muốn một mình nhưng sợ cô đơn, có thể mời người ta đi ăn nếu vui, hiếm khi thấy vui",đồ ngọt,Ngủ
3024,"mình hk thích sự gượng ép, không thích cảm giác 1 mình lắm nhưng đi với nhiều người thì không biết phải nói gì, mình không hẳn ít nói nhưng cũng ngại nói chuyện với người khác",Socola ngọt ngào có chút đắng,Badminton
3025,Mình khá ít nói cũng như là hướng nội,Cứ đồ ăn là thích,Học ngoại ngứ
3026,"thích đi chơi ở ngoài với bạn bè, hướng ngoại",Trà sữa,"tiếng anh, đá bóng"
3027,Hương ngoại nhưng khó kết bạn với hơi trầm,Cơm,"ngủ, toán, ăn, giải đố, lắp ráp"
3028,Không thích nơi đông người,"thích ăn vặt, uống trà sữa",Chơi thể thao
3029,Hướng nội,"bánh mì kẹp, lẩu chay, nước dừa",Trò chơi điện tử
3030,Là một người hướng ngoại nói nhiều,"rau củ, trái cây","viết lách, nghe nhạc"
3031,"hoà đồng, vui tính, hướng ngoại, thích được đi chơi",Bánh tráng các loại,Nghe nhạc
3032,"hướng nội, hướng ngoại, ","pizza, gà rán","thử nhiều điều mới, chơi thể thao, đọc sách, thích học ngôn ngữ anh"
3033,"khá hòa đồng, thích vui vẻ, nhộn nhịp",Sinh tố bơ,"xem phim, nghe nhạc"
3034,Hướng nội,Thích ăn gà,Quay tik tok
3035,"người hướng nội cởi mở, thích tụ tập bạn bè thân thiết ở nhà",Ăn cơm,"game, phụ kiện công nghệ"
3036,Hướng nội,trà sữaaaaa,"chơi game, nghe nhạc, xem phim"
3037,"hướng nội khi không có ai, người suy nghĩ nhiều","ăn vặt, thích ăn bánh mì, đặc biệt là tôm, bị dị ứng hải sản có vỏ","bóng bàn, thích đá banh"
3038,Hướng ngoại,Gà jollibee,Thiên văn học
3039,"kiểu người, hướng nội, hướng ngoài.",trà sữa,Toán
3040,"không thích ồn ào, hướng nội",Sữa Milo,"chụp ảnh, xem tv series"
3041,"là một người ít nói hướng nội, thích coi phim",Gà rán,Thích đi chơi với bạn bè
3042,"là người hướng lung tung, ngày ngủ đêm bay",Mì cay,chơi game
3043,Là một người thiếu ngủ,pepsi vị chanh không calo,Đọc truyện viết code
3044,"thích ở một mình, là một người ít nói, hướng nội","cà phê, trà, cơm",Bóng rổ
3045,"một người ít nói hướng nội, có phần hơi thích kiểm soát, thích làm việc, ở một mình",Trừ đồ quá ngọt quá mặn thì cái gì cũng có thể ăn,Game
3046,"vui vẻ, hướng nội, ít nói, nhưng vẫn hoà đồng",Trà Đào,"khám phá xung quanh, du lịch"
3047,thích đi đâu đó,"bánh ngọt, kem","hacking, code"
3048,"sống cống hiến, tự do, hướng nội",Bánh mì,Thích đọc sách
3049,Mình là người hướng nội thích ở 1 mình hoặc có không gian cá nhân,"nước ép trái cây, bánh ngọt",Ngủ
3050,ít nói,Món nào mình thấy hợp thì đều thích ăn,học tiếng Nhật
3051,Nói nhiều thích đám đông,"bún chả, phở bò, bánh gai, ăn pizza",Cầu lông
3052,Hướng nội,"khoai lang lắc, trà sữa, bò nea, gà rán, mì cay, sữa bắp",Cầu lông
3053,Nói nhiều hướng ngoại thích đi đây đó,Matcha đá xay,Nghe nhạc
3054,"năng động, cần cù, tích cực",Cá dồ kho,"trí tuệ như nhau nên điều đó cũng là một sự thú bị, môn nào vui thì môn đó chơi. ví dụ: đá bóng dù trên game hay ngoài đời đều có sự kịch tính"
3055,"hướng nội, ít nói",Kem,đi chơi ngoài trời
3056,Hướng nội,"tôm, trứng, những món có vị chua","cầu lông, nghe nhạc"
3057,"nói nhiều, cực đoan, hướng nội",Thích caffee,"thích đọc truyện, thích hát"
3058,Tính cách thất thường,đồ ăn nhà nấu,"xem phim, ..., nghe nhạc, thích tiếng anh"
3059,Bình thường 🤤,Thích đồ tự nấu,"đi du lịch, chụp ảnh"
3060,"vui vẻ, thân thiện, hòa đồng",Sandwich,Thích xem phim
3061,"trải nghiệm, , mình là một người hướng ngoại, thích đi dây đó",Đồ ăn Hàn. Đồ uống healthy,"thích đá bóng, thích khoa học, bơi lội."
3062,"hướng ngoại khi cần thiết, bán hướng nội ambivert","trà sữa, cơm tấm, bò kho, bánh mì","thích nghe nhạc, xem phim đặc biệt là thích nhạc của sơn tùng m-tp"
3063,Hướng nội,"thích uống trà sữa ạ :v, hơi kén ăn 1 chút","nằm dài nghe nhạc, uống cà phê"
3064,"thích đi chơi đây đó nhưng cũng hơi trầm tính khi ở với người lạ, người hay thay đổi","coca cola, come gà","xem phim hàn, chơi game"
3065,"ít nói, hướng nội","redbull
không thích cafe gói, các loại mì, nước trà (như c2, đồ cuốn
pepsi, cơm trộn, không độ), chỉ thích cafe phin",Xem phim
3066,Hướng nội nhưng thích đi chơi,tất cả các loại mì,"thích đồ ăn nhạt, phim truyền hình, tụ tập với bạn bè, call điện thoại, đồ ăn ngọt, thích bơi, đi mua sắm

không thích: chạy bộ, thích xem tivi, chạy xe, các hoạt động phải chạy, trang điểm, thích ngủ, xem mv ca nhạc, nghe nhạc, thích chơi game offline, đọc truyện tranh, tắm (2l/ngày), học nhóm online"
3067,bán hướng nội bán hướng ngoại,"socola, kem, gà rán",Thích
3068,Mình là một người khá rụt rè khi ở một mình.,Kem,"xem phim, chạy bộ, ngôn ngữ"
3069,hướng nội,Bánh mì,code
3070,Đôi lúc hướng ngoại đôi lúc hướng nội,Pizza,Bơi
3071,thích kết bạn,Ăn đồ ngọt uống nước ngọt,Nhiếp ảnh
3072,"hướng ngoại, dễ thích nghi",thích ăn món mì cay,Vẽ
3073,Hướng nội nữa mùa,Bánh mì,Tiền
3074,"nhưng lúc high thì lại muốn nói rất nhiều, thích có ko gian riêng tư 1 mình, , đôi khi ko thích chia sẻ nhiều lắm","hải sản, bún bò","nghe nhạc, đánh cờ vua, học hóa, lướt mạng"
3075,"hướng ngoại, sáng nắng chiều mưa, đôi khi hướng nội, tính cách thất thường","cơm tấm, mỳ trộn, phở, ...",nghe nhạc
3076,"tích cực, lắng nghe, hướng nội","nem nướng nha trang, bún trộn, gà rán, mỳ tôm","xem phim, nghe nhạc"
3077,Một người hướng nội thích sự im lặng,"cũm được, cơm ngon còn bánh bao hơi dở","cờ tướng, cờ vua"
3078,"thoải mái khi gia nhập, hoạt bát, thích ngoại giao, o tập thể",Mình thích ăn bánh tráng cuốn,"ngủ, code, nghe nhạc"
3079,Lowkey,Thích ăn trứng vịt lộn,shopping
3080,"áp dụng công nghệ mới, thích tìm hiểu",các thế loại mì,Đọc sách
3081,"thoải mái, thích vui, vui vẻ, nghiêm túc","ăn cơm mẹ nấu, cơm người yêu nấu","coding, xem phim"
3082,Lowkey,Đồ hàn,bơi lội
3083,"hướng nội, thích ở 1 mình, ít nói","thức ăn có vị cay, cà phê",Đọc truyện
3084,"ít nói hướng nội, thích ở một mình","nước cam, bông lan trứng muối",Đọc sách
3085,hướng nội,trà đào,"xem phim, truyện"
3086,ít nói,"bánh gạo, mì trộn, sushi, mì quảng",bóng đá
3087,"hoà đồng với mọi người, một người vui vẻ",Phở,"du lịch, nấu ăn, đọc sách, xem phim, nghe nhạc"
3088,"hướng ngoại, dễ hòa nhập","lẩu, trái cây, kem, đồ ngọt, món nướng","học công nghệ, chơi game"
3089,Ở nhà hướng nội ra đường hướng ngoại 🙄,"coca cola, sting, cơm gà, hũ tiếu",Video Game
3090,hướng nội ít nói,Bánh Mì,Nghe nhạc
3091,"vui vẻ, hòa đồng không thích đám đông lắm nhưng dễ hòa nhập",Món nào chay đều thích,"cầu long., thích đá bóng, bóng chuyền"
3092,"người thân, thích đi chơi với bạn bè, ít nói nhưng thích đám đông",Cũng không biết nữa 😂,"ngoại ngữ, toán"
3093,ambivert,Mì ý,Thích đọc sách
3094,Hướng nội,"trứng, các món nhiều gia vị, 7749 loại mắm. không thích đồ ăn chứa quá nhiều dầu, nước thảo mộc, drink: (ưu tiên) nước lọc, nước trà, củ, quả, nước trái cây, ăn được đồ nặng mùi, mùi hương (hành tỏi tiêu ớt sả đầy đủ), sương sáo các thứ
food: cái gì cũng ăn được. thích rau, cá, chất béo hay phô mai. không ăn được cua :3",Học ngoại ngữ
3095,Hướng nội,"nem nướng, rau má mix","xem phim, tập thể dục, đọc sách, nghe nhạc"
3096,"khá hướng nội. thích sạch sẽ, thích yên tĩnh","nước gas, đồ nướng",Thích chơi game
3097,Hướng nội,"đồ nướng, đồ ăn mà dai dai kiểu như bánh bột lọc hay bánh canh í., đồ ngọt, nước trái cây","bới lội, chơi game"
3098,"thích nơi đông người, là một người ít nói hướng nội",Đồ bình dân hoi.,"xem phim, đi chơi, game, nghe nhạc"
3099,"ghét sự cô đơn, hướng ngoại ít nói thích ở một mình","đồ chiên, , đồ nhướng","toán, khoa học, kĩ thuật"
3100,Thích ở một mình,thích ăn cá thác lác chiên,chơi game
3101,Hướng nội nói nhiều,Bánh chocopie,"đọc truyện, xem phim"
3102,"hướng ngoại, thích giao lưu với mọi nguời","bún đậu, gà rán","cầu lông, lập trình, kiếm tiền, đá bóng"
3103,Là người thích ở một mình,Dưa hấu,Nghe nhạc
3104,"mình là dễ gần, hòa đồng","mì gói, chocolate, espresso",Nghe nhạc
3105,Hướng nội tích cực,"thịt nướng, bún bò",Cũng không biết thích gì
3106,VỪA HƯỚNG NGOẠI VỪA HƯỚNG NỘI,thích ăn,"…, đá banh, nghe nhạc, đọc sách"
3107,"ít nói, hướng nội",trà sữa,"tháo, ráp pc, android, mac os, dân chơi hệ điều hành (windows, ...), ios, linux, thích chill, vệ sinh máy tính, phá máy tính"
3108,"vui vẻ, tích cực, hoà đồng",Cafe,Thích đi karaoke
3109,"50% hướng ngoài, là người 50% hướng nội",Ăn cơm,thích hút thuốc
3110,Hướng ngoại,"gà rán, ..., trà sữa",Chơi game
3111,"nhạy cảm, hướng nội, nội tâm","...., salad, thịt bò",Vẽ
3112,"thường thích ở một mình, ít nói với người lạ, hay giận vu vơ",Cơm nhà,"học công nghệ, xem bóng đá, coding"
3113,"rụt rè, sống tình cảm vs chăm chỉ nhưng e hơi chậm so vs bạn bè cùng tuổi về sự linh hoạt, hiểu biết., ít nói, là người hướng nội, e là một người khá tự ti",THỨC ĂN GÌ NGON ĐỀU YÊU THÍCH,"chơi đàn piano, chơi bóng rổ, đọc sách, nghe nhạc"
3114,Trầm tính,Chocolate,Esports
3115,Hòa đồnh,thích ăn mì cay,Chơi nhạc
3116,Hướng ngoại,Ăn đồ tốt cho sức khỏe,"tin khoa học, truyện, hóng drama, phim, game"
3117,"ưa mạo hiểm, vui vẻ, tích cực","trứng, pepsi, trà sữa, mì cay, cơm chiên, ..., bánh mì, xôi",ngủ
3118,"lúc nói nhiều lúc nói ít, thiên về cảm xúc nhiều hơn lí trí",Bánh cuốn,nấu ăn
3119,"vui tính, dễ bị lung lay bởi cảm xúc, ít nói, thân thiện, nhạy cảm","cá kho, ..., canh cải",Nhiều lắm . Chơi được đa nghề :)
3120,"hướng nội, tham công tiếc việc, tình cảm",ỏi,Travelling
3121,"thân thiện, hòa đồng, cởi mở","trứng, xúc xích, gà","thích đá bóng, toán, thiên văn học, bơi lội"
3122,"chỉ thích ngủ một mình, hướng ngoại thích chia sẻ tuy nhiên hơi khó ngủ",Cơm tấm sườn bì chả,Thể hình
3123,"là một người khiêm nhường, có lòng tự trọng",các món ăn có nước,Đếm tiền
3124,Năng động,Gà nói chung,"thích đánh cờ, chơi đàn"
3125,Hướng ngoại nhưng có xu hướng thích ở một mình (hoặc thêm người nhưng được yên tĩnh),"kẹo dẻo, coca cola…","đá banh, sự logic"
3126,"hướng nội, hướng ngoại, ","ốc, , trà sữa, lẩu, mì cay",Đá banh
3127,"là một người ít nói hướng nội nhưng cũng có thẻ hướng ngoại parttime, sống lowkey",Bún bò,"chụp ảnh, âm nhạc, code"
3128,"hướng ngoại 65%, hướng nội 35%, tôi thích nói chuyện với mọi người nhưng đồng thời tôi cũng có những lúc thích một mình",bún bò,thích chơi game
3129,"lúc hướng nội lúc hướng ngoại, tùy lúc, thân thiện",Thịt nướng,nghe nhạc
3130,Hoà đồng vui vẻ,"mình thích trà bí đao ngô gia, mì gói, coca",Thích ngồi lướt mạng XH cả ngày
3131,Hướng nội,Paparoti,toán
3132,Hướng nội,"trà, khoai tây","xem phim, nghe nhạc"
3133,"mình là một người hướng nội, thích ở một mình, ít bạn",thích ăn MÌ TÔMMMMM,"chơi game, vẽ, đọc sách"
