,Name,Sex,Hometown,Bio_personality,food_drink,hob_inter,smoking,refer_roommate,Cleanliess,Privacy
232,232,Nam,Tien Giang,thích vui lắng nghe một người hướng ngoại với bạn bè,hầu hết các món con người dùng được cơm nước ngọt blahblah cà phê,vệ sinh máy tính khoa học thiên văn học võ hát,không,o câu chuyện hay tình huống. là người có thể đưa ra lời khuyên nhưng không quá lố đẹp,5,7
233,233,Nam,Nam Dinh ,hướng nội part time .. thường là hướng ngoại với ng quen nhma hướng nội với người lạ,thích trà sữa… khoai tây lắc em thích các loại bún ạ,bói toán,không,ở sạch sẽ cẩn thận hiểu lễ phép ồn ào đúng lúc đúng chỗ hoặc cùng trường,8,8
234,234,Nam,Ha Giang,một người hướng nội nhưng cũng thích xã giao với mọi người,hơi kén ăn 1 chút món nướng thích đồ chay nước lọc,ngôn ngữ,không,ăn ở sạch sẽ người nào cũng được nhưng biết giữ không gian riêng tư cho đối phương,8,9
235,235,Nữ,Bac Lieu,trải nghiệm cống hiến hết mình nhưng ít nói,thích ăn những món ăn không quá đậm vị em thích các loại bún ạ hũ tiếu snack,mình thích đọc tiểu thuyết và truyện tranh mình thích ngôn ngữ cũng không biết thích gì tập trung nghiên cứu một vấn đề nào đó ngắm bầu trời,không,nếu cùng ngành thì tốt ít nói thân thiện không tệ nạn,10,9
236,236,Nữ,Khanh Hoa,thích vui một người vui vẻ,đồ thái bánh trán trộn lẩu thái nước ép thơm,bóng đá thích đi karaoke,không,giữ vệ sinh ai kiềm t việc t chơi ngu mình thích người cùng phòng vui tính,6,8
237,237,Nam,Bac Lieu,tìm người người làm đồ án tốt nghiệp chung. cầu toàn linh hoạt hướng nội 35% áp dụng công nghệ mới,em thích các loại bún ạ bánh kẹp thịt bò với sữa dưa hấu cơm bò xào,thích chơi bóng rổ,không,tích cực với cuộc sống,7,9
238,238,Nam,Thanh Hoa,hiểu biết.,không quá kén chọn bún bò phở hu tiu com tam,đọc truyện thích xem phim thích đá banh vẽ đi tản bộ,không,thíc người hay nấu ăn biết mặc cả =)) vì mình ko biết mặc cả hihi chăm chỉ làm việc nhà có thể hoạt bát nhưng im lặng lúc cả phòng đang làm việc người vui tính người vui tính hòa,10,9
239,239,Nam,Ca Mau,vui vẻ thích sự an toàn dù chạy xe ẩu (ý là cái gì cần phải xảy ra thì phải đảm bảo nó được xảy ra thích đi chơi ở ngoài với bạn bè là người 50% hướng nội đôi khi ko thích chia sẻ nhiều lắm,sữa chua rau gà phô mai,âm nhạc ( nghe nhạc) thư giãn quay tik tok coi anime ...,không,thích ăn chăm chỉ làm việc nhà k ồn sau 11h vui vẻ hòa đồng phải sạch sẽ,10,9
240,240,Nữ,Bac Lieu,dễ hòa nhập khác trầm thích ngoại giao là một người nhiệt tình nói khi cần thiết,suit my taste is fine ăn vặt bột sò mình ăn uống healthy nền chỉ uống nước ép trái cây,bóng đá thích những gì cần tư duy logic tháo khám phá xung quanh,không,có trách nhiệm giỏi vui tính hòa đồng cùng ngành sòng phẳng tiền bạc.,8,6
241,241,Nam,Ninh Binh,ngại bộc lộ tâm tư tình cảm cá nhân với người khác. hướng nội với người ngoài phần hướng nội nhiều hơn,sữa chua mỳ xào pizaa ... các món nhật thích trà sữa…,call điện thoại o buổi tối,không,sạch! gọn gàng!!!! chịu khó dọn dẹp không thảo mai tôn trọng không gian riêng tư của người khác,9,7
242,242,Nam,An Giang,là một người ít nói hướng nội nhưng cũng có thẻ hướng ngoại parttime yêu thiên nhiên thích ở 1 mình thích vui chơi,dưa hấu mắm chưng cút lộn rang me ăn đồ ăn nhanh mì tương đen,o buổi tối pokemon,không,không nhiều chuyện thích nấu ăn nhiều chuyện sẵn sàng quan tâm chia sẻ,10,8
243,243,Nữ,Thai Binh,tùy lúc quan tâm người khác,bánh mì... mì tương đen,uống cà phê o buổi sáng,không,siêng,5,7
244,244,Nữ,Gia Lai,là một người hướng nội không thích ồn ào,các món gỏi bánh chocopie,…. hít thở không khí trong lành ở công viên thế giới,không,cẩn thận,7,10
245,245,Nữ,Nam Dinh ,cần cù thích ờ chỗ không đông người năng động hướng nội nữa mùa hòa đồng,xôi mặn ỏi,đạp xe đạp đánh cầu lông đàn guzheng viết lách,không,ít nói,7,8
246,246,Nam,Khanh Hoa,lười làm việc nhà  mình không hẳn ít nói nhưng cũng ngại nói chuyện với người khác,ốc nước ngọt,"các chương trình giải trí thích:
1. thiên nhiên cây cỏ
2. bóng bàn phim hành động decor phòng",không,người hài hước im lặng,8,10
247,247,Nữ,Hung Yen,thích đi các hoạt động xã hội vui vẻ hoà đồng tôi là một người hoạt bát không thích giao tiếp với người lạ,kfc cơm chiên sâm bổ lượng cheese fries trứng,thích đi du lịch đá banh tháo,không,ngăn nắp. biết tuân thủ lợi ích chung. chịu đi chơi với tôi mong muốn được ở cùng phòng với một người có sở thích vẽ không thảo mai người ít nói,7,10
248,248,Nam,Hoa Binh,extrovert dành thời gian cho bản thân nhiều hơn. nhưng vẫn tham gia clb cũng như đi chơi với bạn bè (nhưng ít,bánh chuối chiên đồ chiên lẩy thái,đi tản bộ đàn chính trị gym lắp ráp,không,biết làm việc nhà hoà hợp dễ tính... tâm lý =))),10,8
249,249,Nữ,Ninh Binh,trầm trầm nhưng lúc cần vẫn vui hết mình áp dụng công nghệ mới sống lowkey là người ít nói chuyện nửa hướng ngoại,7up gà hấp nước mắm eat-clean ăn đồ ngon,chơi call điện thoại,Có,thật lòng hòa đồng thích những bạn hoạt bát,9,5
250,250,Nữ,Thai Binh,o tập thể,...; các loại thức ăn truyền thống của miền nam như bánh xèo ham bơ gơ chanh muối fastfood,thích chơi game offline ko thích bị ép buộc thích ngủ,không,gọn ràng sạch sẽ,5,7
251,251,Nữ,Vinh Long,linh hoạt,đồ ăn hàn quốc sprite,chơi code bóng bàn esport thích hút thuốc,không,cởi mở ăn nhiều có thể đấu tranh với sự vô tâm ít nói của mình 1 người vui tính người vui tính,9,7
252,252,Nữ,Hung Yen,đôi lúc hướng ngoại,"thịt nướng sương sáo các thứ
food: cái gì cũng ăn được. thích rau cơm chiên các loại lẩu thái ăn pizza","đi mua sắm

không thích: chạy bộ cầu long. chạy xe mac os",không,có thể đấu tranh với sự vô tâm ít nói của mình đặc biệt là tam quan đúng đắn dễ bắt chuyện ý kiến của mình lên bạn cùng phòng tôn trọng ý kiến của nhau,8,6
253,253,Nữ,Vung Tau,thích ở một mình với gia đình,thịt bò olong,học ngoại ngữ,không,hướng nội,9,9
254,254,Nữ,Hoa Binh,ở giữa hướng nội tôi là một người hoạt bát nhộn nhịp,xoài lắc nước ép. chất béo hay phô mai. không ăn được cua :3 mình ăn uống healthy nền chỉ uống nước ép trái cây mình rất thích ăn đồ ăn cay,thích hát mầy mò linh kiện máy tính kinh quẻ,không,sạch sẽ ham học cái tôi lớn),8,8
255,255,Nam,Nghe An,thích sự an toàn dù chạy xe ẩu (ý là cái gì cần phải xảy ra thì phải đảm bảo nó được xảy ra là một người 2 hướng,pepsi kfc socola ngọt ngào có chút đắng các đồ ăn hỗ trợ cho việc giảm cân,đi đây đi đó với bạn bè( một mình) tin khoa học đọc sách pha chế,không,không quá ồn ào,10,8
256,256,Nữ,Dak Nong,.... nhưng thích trải nghiệm điều mới nhưng lại thích giao lưu =)) lười giao tiếp... ngày ngủ đêm bay ngăn nắp dù hay bày bừa (xong rồi dọn ngay),cơm nước ngọt blahblah nước ngọt miễn là nước ngọt có ga sữa của các hạt đậu bún xoài lắc,pha chế thích học thích code anh văn,không,biết chia sẻ công việc trong phòng  tôn trọng không gian riêng tư của người khác biết làm việc nhà ăn xong nhớ dọn,8,8
257,257,Nam,Hoa Binh,lười làm việc nhà,mì ý,kinh quẻ stress thì mình đâm đầu vô luôn đá banh các hoạt động phải chạy chạy bộ,không,sạch sẽ một chút vui vẻ chân thật tôn trọng ý kiến của nhau có trách nhiệm,9,10
258,258,Nam,Vung Tau,không lười thì đi có hứng thì xác xe thích đi các hoạt động xã hội thích 1 mình thích suy diễn mọi chuyện trên đời thích giao lưu với mọi nguời,các loại đồ ngọt như chè bánh ngọt đi ăn với bạn,bị người ta lùa gà xem anime bóng bàn chơi vape,không,không dùng đồ mà chưa xin phép biết giữ gìn hoà khí chung đi chơi bên ngoài. mong muốn được ở cùng với người có sở thích khoa học với mình người kiên định không ba phải hùa theo đám đồng,8,10
259,259,Nam,Kien Giang,khá hòa đồng dễ bắt chuyện thích tham gia các hoạt động xã hội hướng nội ít nói,sữa đậu nành sữa của các hạt đậu nước gas,xe cộ học hỏi thích bơi,Có,dễ tính... vui vẻ - hài hước,9,8
260,260,Nữ,Ha Giang,lúc nói nhiều lúc nói ít một người nửa hướng nội bạo lọan e là một người khá tự ti hay ngại,hầu hết các món con người dùng được,thích động vật,không,có tri thức về y khoa cùng các lĩnh vực xã hội khác,9,3
261,261,Nữ,Bac Lieu,cần nhiều riêng tư thích đi đây đi đó trải nghiệm những thứ mới mẻ nhưng tùy hứng,mì cay sữa chua,nhạc cụ,không,vui tính hài hước người nào cũng được nhưng biết giữ không gian riêng tư cho đối phương biết nghĩ dễ chung sống nếu chung sở thích thì càng tốt,9,9
262,262,Nữ,Ha Giang,hướng trung đôi lúc hướng ngoại trung lập nghiêng về hướng ngoại,bạc sỉu,đá cầu mầy mò linh kiện máy tính code …. xem phim nghe nhạc,không,chùi dọn phòng freedom người biết lắng nghe sòng phẳng,8,7
263,263,Nữ,Bac Lieu,nhiệt tình ít bạn khá hòa đồng dễ bắt chuyện hướng nội,những món ăn liên quan đến kim chi nem nướng nha trang nhật ........; nói chung là mình thích ăn rất nhiều món :3 kẹo,chơi thể thao học tiếng nhật phụ kiện công nghệ thể dục,Có,xinh đẹp nhiệt tình mình thích người cùng phòng vui tính,6,9
264,264,Nam,Quang Ngai,dễ tính không thích sự ồn ào đam mê học tập hướng trung (ambivert) lúc thích một mình,trà chanh ức gà,lắp ráp lướt mạng thích đọc thể hình,không,học tốt,9,8
265,265,Nữ,Bac Ninh,thích tham gia các hoạt động xã hội yêu thiên nhiên hướng nội trầm tính dễ thích ứng,bánh kẹp thịt bò với sữa sữa chua mít thích ăn trứng vịt lộn,văn học,Có,thân thiện đừng nói quá nhiều vui vẻ hòa đồng người hòa đồng,9,8
266,266,Nữ,Hoa Binh,hướng trung (ambivert) lúc thích một mình là một ambivert ghét phiền phức hơi ngại giao tiếp nhưng sẵn sàng học hỏi,nước thảo mộc thịt sườn,đi chơi cùng bạn bè người thân,Có,thấu hiểu biết chia sẻ,8,7
267,267,Nam,Ha Giang,thích suy diễn mọi chuyện trên đời,trà đá,chạy bộ linux thích coi phim các chương trình giải trí,không,biết quan tâm người có tính cách vui vẻ giỏi sạch sẽ một chút bạn cùng phòng biết lùa gà,10,10
268,268,Nữ,Vung Tau,năng động tìm người người làm đồ án tốt nghiệp chung.,chất béo hay phô mai. không ăn được cua :3 sữa của các hạt đậu,thích đi bộ bóng đá đá cầu,không,điềm tĩnh,7,5
269,269,Nam,Tra Vinh,hướng ngoại thân thiện vui vẻ thích nơi đông người tham công tiếc việc,đặc biệt là tôm cà phê mỳ xào,holywood,không,mong muốn được ở cùng phòng với một người có sở thích vẽ sinh hoạt cú đêm giống mình hihi không quậy phá biết điều điềm tĩnh,7,9
270,270,Nữ,Hoa Binh,cởi mở thích tự lập,thích uống trà sữa ạ :v thích ăn những món ăn không quá đậm vị các loại bún,cầu lông chơi nhạc,không,không câu nệ tiểu tiết ăn nhiều có cùng sở thích là một điểm cộng gọn gàng hòa đồng,7,10
271,271,Nam,Ha Giang,ngăn nắp dù hay bày bừa (xong rồi dọn ngay) chỉ thích ngủ một mình đúng ik chang mô tả mẫu :))),canh trứng cà chua fastfood nem nướng sinh tố bơ hủ tiếu xào,ngắm cảnh,không,ham chơi ngay thẳng cẩn thận sạch sẽ một chút,7,8
272,272,Nữ,Long An,hướng nội part time .. thường là hướng ngoại với ng quen nhma hướng nội với người lạ là một người thiếu ngủ,7749 loại mắm. không thích đồ ăn chứa quá nhiều dầu bạc sỉu,thích chơi bóng rổ esport thích ngồi lướt mạng xh cả ngày cờ vua,Có,hoà đồng. sạch sẽ.,6,8
273,273,Nam,Tay Ninh,thích khám phá vui vẻ ích nói hướng nội trầm tính hướng nội nghiêng về hướng ngoại,xoài chua chấm muối ớt chua lè bim bim,thích đọc truyện đồ ăn ngọt,không,người hòa đồng điểm khác biệt giữ 2 đứa. không quá xen,8,8
274,274,Nữ,Hoa Binh,hướng nội nhộn nhịp thích một mình nhưng lại sợ cô đơn hoà đồng nhưng cũng thích ở một mình khác trầm,đồ ăn: các món nước (bún thịt nướng,kinh quẻ đi dạo online shopping thích ngủ vẽ,không,trầm tính,8,10
275,275,Nam,Binh Duong,thích ở một mình với gia đình hướng nội nữa mùa,nước gas hơi kén ăn 1 chút các món về tôm hũ tiếu củ,mình thích hát tắm (2l/ngày) thích chơi suốt ngày,Có,có thói quen dọn dẹp ăn ở sạch sẽ thật lòng người hướng ngoại,8,10
276,276,Nam,Binh Thuan,mê chơi đá gà,bún pizza mình rất thích đồ ăn vặt nước trà,tin học đu otp thích xem phim chơi vape thích hút thuốc,không,hoà đồng nhưng cần không gian riêng không làm phiền người khác như buổi tối mình mong muốn được ở cùng một người thích tìm hiểu những điều mới lạ không quậy phá điểm khác biệt giữ 2 đứa. không quá xen trách nhiệm,6,7
277,277,Nam,Nam Dinh ,thích ở một mình sống lowkey là người 50% hướng nội,không độ) thích ăn gà ỏi thích uống trà sữa ạ :v bún,đi dạo nghe nhạc mọi lúc mọi nơi ; đọc tiểu thuyết ; thiết kế hình ảnh logo banner poster chụp ảnh xem phim nghe nhạc đi tập thể dục,không,sinh hoạt cú đêm giống mình hihi,8,7
278,278,Nữ,Tien Giang,thích được đi chơi,có ăn . nhiều lắm nào cũng ăn được chè bưởi thích đồ tự nấu,đi dạo game online,không,ocd càng tốt. không quá tính toán hơn thua đàng hoàng là được hiểu biết đừng nói quá nhiều,5,10
279,279,Nữ,Hoa Binh,thích ở một đám hòa đồng logic ưa mạo hiểm,không quá kén chọn . khoai lang lắc paparoti,bới lội,không,biết lắng nghe ý kiến của mình lên bạn cùng phòng,9,7
280,280,Nam,Binh Duong,tham công tiếc việc lúc này lúc kia dễ thích nghi thích giáo tiếp với nhiều người thích 1 mình,ngũ cốc,shopping .. tỉ tê những câu chuyện đời thường sâu sắc với mọi người xung quanh. chơi,không,respect private space and friendly is good vui tính hòa đồng em thích ở chung với người tôn trọng khoảng cách,9,8
281,281,Nam,Ha Nam,cởi mở là một người 2 hướng,thịt kho tàu các loại thức ăn nhanh,uống cà phê,không,tĩnh lặng giao tiếp khéo léo không quá thô thiển,8,9
282,282,Nam,Bac Lieu,cực đoan ít nói hướng nội khác trầm hướng nội khi không có ai,coca cola… không có cụ thể thích 1 món ăn hay đồ uống nào eat-clean ăn đồ ăn nhanh,ko thích bị ép buộc chụp ảnh tập thể dục ngoài trời chính trị,không,không soi mói v.v lanh lợi,8,8
283,283,Nữ,Ca Mau,quyết đoán hướng nội nữa mùa hướng ngoại vui vẻ hòa đồng hướng ngoài.,mỳ trộn pepsi đốc cơ thanh . nước trái cây espresso,tiếng anh... học ngoại ngứ,không,không quá ồn ào tôn trọng quyền riêng tư của mọi người quan tâm mọi người có ý thức giữ vệ sinh chung sòng phẳng,8,9
284,284,Nam,Vinh Phuc,dễ làm quen với bạn mới nhưng thường quen người hợp tính cách mới nói nhiều.,thích caffee cái gì cũng thích ăn có ăn là được mình thích ăn các loại đồ ngọt, vẽ tranh thích bơi đọc truyện thích ngủ,không,hay ham chơi,7,9
285,285,Nữ,Kien Giang,lười làm việc nhà,mình rất thích đồ ăn vặt nước ngọt miễn là nước ngọt có ga bánh cam bánh ngọt,đánh bóng bàn chạy bộ o buổi tối xem tv series thích hát,không,quan tâm ăn xong nhớ dọn,7,9
286,286,Nữ,Lao Cai,hướng trung (ambivert) lúc thích một mình mình là người hướng nội thích ở 1 mình hoặc có không gian cá nhân cầu toàn,cơm ngon còn bánh bao hơi dở,mình thích đọc tiểu thuyết và truyện tranh đọc tiểu thuyết thể dục linux chơi cờ vua,không,ngăn nắp ngành kỹ thuật nói nhìu hoà đồng vui vẻ chân thật trầm tính học giỏi hoạt bát,7,9
287,287,Nữ,Hau Giang ,thích đi lang thang một mình hướng nội nhưng thích đi chơi hướng nội ít nói thik ở một mình hướng nội part time là một người 2 hướng,mì,thích hát tiếng anh...,không,cá tính,8,8
288,288,Nam,Lam Dong,vui vẻ mình là người hướng nội với người ngoài,hũ tiếu mì cay món nào hợp khẩu vị thì mình ăn các loại bánh ngọt,bói tử vi,không,dễ dãi ham chơi có tính tự giác ko so đo,8,8
289,289,Nữ,Ha Giang,thích ở một đám hòa đồng có lúc hướng nội là người 50% hướng nội,ăn pizza,đi coi phim chơi đàn thích chơi với chó mèo,Có,đồ mình sở hữu là được vì mình cũng như vậy. biết nghĩ cho người khác thích nói chuyện tôn trọng quyền riêng tư của mọi người hướng nội,8,10
290,290,Nam,Quang Tri,sống cống hiến vui vẻ hay giận vu vơ là một người 2 hướng,........; nói chung là mình thích ăn rất nhiều món :3 mì ý bò nướng các loại mì bánh khọt,thích học ngôn ngữ anh lắp ráp,không,tính tình vui tính mình mong muốn được ở cùng một người thích tìm hiểu những điều mới lạ học giỏi (chung ngành càng tốt) tôn trọng quyền riêng tư của mọi người,6,8
291,291,Nam,Ha Giang,dành thời gian cho bản thân nhiều hơn. nhưng vẫn tham gia clb cũng như đi chơi với bạn bè (nhưng ít trầm trầm nhưng lúc cần vẫn vui hết mình hướng nội thích ở 1 mình làm quen nhiều bạn mới,phở có ăn là được fanta vị nho : d ăn đồ tự nấu khoai lang lắc,… nghe nhạc đá banh,không,giữ không gian riêng tư mình chỉ cần người đàng hoàng dễ nói chuyện đánh giá,8,9
292,292,Nữ,Bac Lieu,thích nghệ thuật là người ít nói chuyện ngăn nắp dù hay bày bừa (xong rồi dọn ngay) ồn ào là một ambivert,mì cay món j có topping thì đều thích,đánh cờ vua kĩ thuật,không,tiết kiệm một chút biết quan tâm nhiệt tình vs mn nói nhiều đừng quá bừa bộn,10,8
293,293,Nam,Lam Dong,mê chơi đá gà cởi mở không thích nói nhiều muốn một mình nhưng sợ cô đơn,bánh mỳ mỳ xào sâm bổ lượng nước nha đam e thik ăn các loại bánh mỳ,thích tranh biện vẽ... holywood,không,sạch sẻ sinh hoạt cú đêm giống mình hihi ở sạch,10,7
294,294,Nam,Binh Phuoc,hướng ngoại full time thích 1 mình cần nhiều riêng tư 1 tháng chắc 1-2 lần) để giao lưu thoải mái,bún cá châu đốc bánh plan bún thịt nướng cà phê ăn đồ tự nấu,chơi thể thao,không,,10,6
295,295,Nữ,Binh Phuoc,khác trầm,tôm fanta,hát nói chuyện cùng bạn bè,không,gọn gàng gia han em thích ở chung với người tôn trọng khoảng cách xinh đẹp,7,10
296,296,Nữ,Lam Dong,tự do vui vẻ... hướng nội ít nói thik ở một mình extrovert thẳng tính,chiên salad rau củ coca cola kẹo dẻo,môn nào vui thì môn đó chơi. ví dụ: đá bóng dù trên game hay ngoài đời đều có sự kịch tính,không,người không nói quá nhiều,10,7
297,297,Nữ,Ha Giang,là 1 người ít nói hướng nội mình là một người hướng ngoại người hay thay đổi hướng ngoại tùy hoàn cảnh ; không thích nơi quá ồn ào ; không thích người nói nhiều ; không thích nói đùa ; nhớ dai nhưng cũng dễ bỏ qua ; không thích chia sẻ tâm sự ; không thích bị quản lý ; hơi vô tâm ; dễ xúc động ; cái tôi cao ; có tham vọng ; hoàn toàn tự hào khi làm tốt 1 công việc được giao,cút lộn rang me cứ đồ ăn là thích hủ tiếu …. trà đào…,xem mv ca nhạc thiên văn học truyện cầu long. xem phim nghe nhạc,không,tâm lý =))) trách nhiệm,7,9
298,298,Nam,Dong Thap,thích tìm hiểu những điều bí ẩn thích mọi thứ có trật tự thích yên tĩnh,bánh mì quả bún thịt nướng hoặc các loại nước có gas nước rau má,cầu lông tiền thư giãn,không,dễ chung sống thích nói chuyện,7,9
299,299,Nữ,Hung Yen,là một người khiêm nhường thích tận hưởng không gian 1 mình thích đi chơi cùng những người bạn thân thiết cũng hơi hướng ngoại hướng nội khi không có ai,thích đồ tự nấu,mình thích ngôn ngữ đá bóng,không,sạch sẽ lanh lợi,10,9
300,300,Nam,Dong Thap,dễ tiếp xúc thích ở một mình. ghét sự cô đơn,thức ăn có vị cay cơm bánh khọt cheese fries,tham gia hoạt động ngoại khoá thích động vật thiết kế,Có,thống minh mình thích người cùng phòng vui tính,7,8
301,301,Nữ,Vinh Long,nhưng không phải e sợ đám đông cống hiến hết mình thích nơi đông người,không rõ,tâm lý học vẽ...,không,người vui tính đáng tin cậy sẻ chia,7,8
302,302,Nam,Quang Ngai,"hoà đồng với mng nửa hướng ngoại người thân mình là ambivert
có tính cách khá là khùng khùng điên điên nhưng cũng hay nhiều tâm sự đôi khi ko thích chia sẻ nhiều lắm",kem,em thích chơi nhạc cụ,Có,vui vẻ hoà đồn thân thiện tôn trọng lẫn nhau,10,5
303,303,Nam,Dong Nai,thân thiện vui nhộn hướng nội part time hơi ngại giao tiếp nhưng sẵn sàng học hỏi,thích ăn trứng vịt lộn trứng ốp la vị đậm đà😋 phở); thức uống: nước có ga,nghe nhạc đi đây đi đó với bạn bè( một mình),không,ko thích share phòng tự giác không ồn ào biết nghĩ cho người khác. người không nói quá nhiều,8,8
304,304,Nữ,Quang Ngai,extrovert,trà mì nước lọc c2,...) chơi cờ vua mình thích xem phim viết lách,không,tính tình vui tính ngăn nắp. biết tuân thủ lợi ích chung. người kiên định không ba phải hùa theo đám đồng biết giúp đỡ,10,7
305,305,Nam,Thanh Hoa,thích coi phim không thích ồn ào,phô mai kéo sợi xúc xích đồ hàn đồ cay hàn quốc mỳ trộn fastfood,sự logic mac os holywood nghiên cứu về tài chính,không,ham chơi,9,5
306,306,Nữ,Phu Yen,hướng ngoại thích giao tiếp vui vẻ hoà đồng hướng nội trầm tính,sâm bổ lượng thịt kho mắm ruốc ăn đồ ngọt uống nước ngọt các món ăn có nước cơm,hội hoạ thích đọc truyện,không,hòa đồng,9,9
307,307,Nữ,Son La,ở giữa hướng nội thích tụ tập bạn bè thân thiết ở nhà,eatclean,online shopping ráp pc ngủ,không,biết làm việc nhà giống mẹ thì càng tốt vui vẻ hoà đồng nhưng tôn trọng không gian cá nhân của nhau thân thiện,8,9
308,308,Nữ,Dong Thap,hướng lung tung yên tĩnh thích tìm hiểu những điều bí ẩn,bimbim thích ăn những món ăn không quá đậm vị,mac os,không,sạch sẻ học chung ngành hiền lành bất kỳ ngành nào cũng được,7,7
309,309,Nam,Ca Mau,mình là người hướng nội thích ở 1 mình hoặc có không gian cá nhân dễ chịu mình khá dễ hòa đồng nhưng tùy đối tượng hướng ngoại nhung thích ở một mình,thịt kho tàu chè bưởi bim bim nước trái cây,toán học,không,dễ tính không nóng tính có thói quen dọn dẹp ăn ở sạch sẽ,9,9
