,Name,Sex,Hometown,Bio_personality,food_drink,hob_inter,smoking,refer_roommate,Cleanliess,Privacy
157,157,Nữ,Lao Cai,là một người khiêm nhường cầu toàn,bánh sữa đậu nành ăn đồ tự nấu hủ tiếu sữa tươi trân châu đường đen,thiết kế tìm hiểu về văn hóa các nơi đi cắm trại,không,thân thiện tính tình vui tính có tình nghĩa huynh đệ siêng năng,5,7
158,158,Nam,Vung Tau,sáng nắng chiều mưa ở nhà hướng nội ra đường hướng ngoại 🙄 khá hướng nội. thích sạch sẽ khá hòa đồng dễ bắt chuyện,cháo lòng mỳ hoành thánh phô mai kéo sợi xúc xích đồ hàn,thích đá bóng học tiếng nhật thần số học pha chế,không,mạnh mẽ tiết kiệm một chút,9,7
159,159,Nam,Ha Nam,thích ở một mình- lúc thích nói chuyện nhiều người vui vẻ hoà đồng hiểu biết. thích một mình quyết đoán,đùi gà,call điện thoại anh văn,không,ngành công nghệ thông tin không cùng cũng không sao ăn nhiều gọn gàng sạch sẽ vui vẻ hoà đồng nhưng tôn trọng không gian cá nhân của nhau,7,7
160,160,Nữ,Hung Yen,mình là một người thích vẽ năng động mình hk thích sự gượng ép có quy tắc riêng thích trò chuyện thích cứ gái,........; nói chung là mình thích ăn rất nhiều món :3 bò kho nước ngọt có ga,tin học cầu long.,không,học giỏi 1 chút (nhưng không tự cao người hòa đồng chủ động biết nhậu,10,9
161,161,Nữ,Ninh Thuan,hiền hoà khá hòa đồng dễ bắt chuyện tự do 50% hướng ngoài vui vẻ…,eat-clean đồ bình dân hoi.,hội hoạ,không,sẵn sàng quan tâm chia sẻ giống tính cách càng tốt nhưng k nên là bạn thân trúa hề biết đúng sai dễ bắt chuyện,7,5
162,162,Nam,Hoa Binh,hướng ngoại với người quen nói nhiều hướng ngoại thích đi đây đó,thịt kho tàu cơm chiên các loại phở bò cơm tấm mình thích ăn tất cả những gì mình thấy ngon. riêng đồ uống thì mình có niềm đam mê sâu sắc với rau má,xe cộ nhiều lắm . chơi được đa nghề :) thik chạy bộ gym,không,đừng quá bừa bộn tính giống mình,8,5
163,163,Nữ,Tien Giang,thích đi các hoạt động xã hội,sữa chua mít,học công nghệ xem các show giải trí thực tế ... chơi nhạc,không,..,10,7
164,164,Nữ,Phu Yen,nửa hướng ngoại mình không hẳn ít nói nhưng cũng ngại nói chuyện với người khác bình thường đam mê học tập,sandwich thích đồ chiên,đi dạo ngắm cây kiếm tiền nghệ thuật đi tản bộ đạp xe đạp,không,biết chia sẻ vui vẻ nhiệt tình ít nói thân thiện,9,10
165,165,Nam,Dak Lak,là một người hướng ngoại nói nhiều sạch sẽ,chỉ cần không cay là được pepsi vị chanh không calo bánh gai,thích đọc sách nghe nhạc xem phim đi lượn đường thích chơi bóng rổ,Có,không care lắm siêng,5,8
166,166,Nam,Hoa Binh,hoà đồng với mọi người ít nói,thích ăn mì tômmmmm kem ốc quế... thích ăn bánh mì,đọc truyện thể dục,không,chịu khó dọn dẹp,10,10
167,167,Nữ,Binh Dinh,cũng hơi hướng ngoại hướng nội nhưng thích đi chơi thích sạch sẽ thích tận hưởng không gian 1 mình hay dài dòng,........; nói chung là mình thích ăn rất nhiều món :3 mì cay trà sữa,thử nhiều điều mới thích chơi bóng rổ choi game đọc sách.. thích nghe nhạc,không,có chừng mực - vui vẻ có cùng sở thích là một điểm cộng tư vấn lẫn nhau,5,7
168,168,Nam,Hoa Binh,cá tính mạnh hướng ngoại. hướng ngoại part time,các loại bạn,android,Có,mình mong muốn được ở cùng một người thích tìm hiểu những điều mới lạ giống tính cách càng tốt nhưng k nên là bạn thân quan tâm mọi người cùng chuyên ngành/ sở thích ăn ở sạch sẽ,6,8
169,169,Nữ,Thai Nguyen ,hướng nội nữa mùa khá hòa đồng dễ bắt chuyện khá hòa đồng,bimbim mỳ trộn thích ăn những món ăn không quá đậm vị thích đồ ăn có trứng muối,tỉ tê những câu chuyện đời thường sâu sắc với mọi người xung quanh. đánh cờ vua đá cầu,không,biết điều thoải mái là ổn lanh lợi,8,10
170,170,Nam,Thanh Hoa,nhưng ít nói thích tìm hiểu những điều bí ẩn khá hòa đồng dễ bắt chuyện lắng nghe,"món nào chay đều thích bánh tàu hủ. các món nướng như cơm sườn thích đồ healthy phở); thức uống: nước có ga redbull
không thích cafe gói",phim hoạt hình viết lách thích xem phim chơi đàn piano,Có,dễ dãi có thể đấu tranh với sự vô tâm ít nói của mình cẩn thận nhiệt tình vs mn,10,9
171,171,Nam,Thanh Hoa,có phần hơi thích kiểm soát nói rất nhiều không thích cảm giác 1 mình lắm nhưng đi với nhiều người thì không biết phải nói gì,sâm bổ lượng bị dị ứng hải sản có vỏ,thích chơi game,không,ý kiến của mình lên bạn cùng phòng,9,8
172,172,Nữ,Binh Dinh,em thích ở tập thể nhưng có không gian riêng. em hướng nội hướng ngoại part time 50% hướng ngoài người đang học trường fpt đôi lúc hướng ngoại đôi lúc hướng nội lạc quan năng động,phở xào ăn pizza trà chanh,uống cà phê mình thích hát ngắm cảnh chiêm tinh học tiếng anh,Có,gọn ràng sạch sẽ chịu đi chơi với tôi tôn trọng quyền riêng tư của mọi người học tốt,8,8
173,173,Nam,Dong Thap,hoà đồng vui vẻ thích đông vui đam mê học tập cần cù áp dụng công nghệ mới,phở xào bánh bông lan dâu,đu otp chơi bóng rổ,không,biết tôn trọng người khác sạch sẽ hoà đồng vui vẻ trung thực tử tế sạch sẽ. o ban đêm,10,8
174,174,Nữ,Quang Ngai,hướng ngoại nhưng vẫn hoà đồng ít nói nhiều mình là ng dễ giao tiếp,......... bánh ngọt,hóng drama thích đi du lịch,không,có chừng mực - vui vẻ hoạt bát…,9,3
175,175,Nữ,Binh Phuoc,là một người nội,đồ ăn nhanh các loại thịt nướng,dân chơi hệ điều hành (windows cũng không biết thích gì thik chạy bộ thích nghe nhạc mua sắm,không,cùng chuyên ngành/ sở thích đi chơi bên ngoài.,10,7
176,176,Nữ,Thai Binh,một người vui vẻ hoà đồng với mng,bún bò phở hu tiu com tam phở bò,tham gia hoạt động ngoại khoá,không,ai kiềm t việc t chơi ngu hiểu chuyện. cùng ngành học không nói xấu sau lưng chùi dọn phòng,7,8
177,177,Nam,Binh Phuoc,hướng nội part time,thức ăn có vị cay ăn đồ ăn nhanh cơm chiên trứng,kiếm tiền phim hoạt hình học đi du lịch,không,ồn ào đúng lúc đúng chỗ vui vẻ thoải mái biết quan tâm,8,8
178,178,Nam,Bac Lieu,cọc cằn là một người ít nói hướng nội nhưng cũng có thẻ hướng ngoại parttime không phải hướng nội nhưng không thích chỗ đông người,mình thích uống trà sữa trà chanh sữa trái cây,đọc truyện tranh cafe thích đọc truyện uống cà phê xem tv series,không,ngăn nắp khắc kỷ o ban đêm v.v,10,5
179,179,Nam,Binh Phuoc,hướng nội với người ngoài tìm người người làm đồ án tốt nghiệp chung. hướng ngoại nhưng có xu hướng thích ở một mình (hoặc thêm người nhưng được yên tĩnh) là người hướng lung tung thích sạch sẽ,sting cá tra nhúng giấm,đá bóng,không,học chung ngành,8,9
180,180,Nam,Lam Dong,kiểu người vui vẻ hoạt bát năng động nhưng hơi hướng nội một người hướng nội nhưng cũng thích xã giao với mọi người trầm trầm nhưng lúc cần vẫn vui hết mình,fanta mặn snack khoai tây,cà phê học ngoại ngứ tụ tập với bạn bè anh văn đàn,không,hướng nội gọn gàng sạch sẽ. rạch ròi về tiền bạc,7,6
181,181,Nam,Lao Cai,một người ít nói hướng nội,ức gà ăn đồ tự nấu pepsi vị chanh không calo đồ nhướng fast food,vi vu dạo phố thích tranh biện tìm hiểu những kiến thức đa ngành trí tuệ như nhau nên điều đó cũng là một sự thú bị thích khoa học,không,quan tâm bạn bè,6,9
182,182,Nam,Lao Cai,vui tính thích đi ra quán cafe để học bài hoà đồng nhưng cũng thích ở một mình mình không hẳn ít nói nhưng cũng ngại nói chuyện với người khác,đồ nướng bún rêu thích ăn đồ việt nam,diy.. travelling,Có,không quậy phá chăm chỉ làm việc nhà mong muốn có một người thích đánh cờ chung gu giải trí,7,7
183,183,Nam,Phu Tho,hướng nội ít nói hoà đồng với mọi người thích tìm hiểu,bún cá xoài lắc nước ép canh kim chi,đọc tiểu thuyết chơi nhạc tập thể dục ngoài trời lướt mxh,không,hoà hợp giống tính cách càng tốt nhưng k nên là bạn thân mình chỉ cần người đàng hoàng không quá nóng tính luôn ham học hỏi,10,7
184,184,Nam,Quang Binh,mình là người trung lập,paparoti mình rất thích ăn đồ ăn cay hầu hết các món con người dùng được phô mai kéo sợi xúc xích đồ hàn mắm chưng,dân chơi hệ điều hành (windows thích đi chơi với bạn bè tìm hiểu về văn hóa các nơi,không,người hiểu chuyện,6,9
185,185,Nữ,Ha Tinh,thích một mình nhưng lại sợ cô đơn hướng ngoại full time có lòng tự trọng thích ngoại giao,xoài lắc món nào mình thấy hợp thì đều thích ăn hủ tiếu,thích chơi với chó mèo cũng không biết thích gì,không,nhưng không làm phiền người khác hay nhờ vả. có thể nhanh chóng nắm bắt cảm xúc biết đều chung ngành sạch sẽ đừng quá bừa bộn,8,5
186,186,Nữ,Ha Giang,đôi lúc hướng ngoại hoạt bát,coca cola ít đường bánh tráng các loại hủ tiếu nam vang cơm tấm,phim,không,thông cảm vui tính tiết kiệm một chút nói nhìu hoà đồng bạn cùng phòng biết lùa gà,5,7
187,187,Nữ,Dak Nong,hoặc có backup),revive,đàn học toán,không,hoạt bát… thíc người hay nấu ăn biết mặc cả =)) vì mình ko biết mặc cả hihi không thích chung phòng biết nghĩ ham học,7,10
188,188,Nam,Binh Phuoc,nhưng hướng nội với người lạ ồn ào,gà phô mai mình rất thích đồ ăn vặt,thích xem phim văn học đi dạo ..,không,dễ chung sống ngành công nghệ thông tin vì mình khá kỹ tính nên mong tìm đc người bạn cùng phòng gọn gàng,8,6
189,189,Nữ,Quang Tri,thích khám phá,chocolate tôm bún chả,chạy bộ đá cầu đọc manga xem anime xem phim âu action nghe nhạc vận động thể lực (nhẹ) âm nhạc ( nghe nhạc),không,không tính toán với bạn cùng phòng khác.,10,10
190,190,Nữ,Kien Giang,hướng ngoại partime hướng nội về đêm. có thể chia sẻ giúp mn vượt qua sự tiêu cực nhưng bản thân mình thì không 50% hướng ngoài,bún rêu nước ép thơm trà cơm sườn chỉ cần không cay là được,thích vẽ phim hoạt hình đi ăn ko thích bị ép buộc,không,không câu nệ tiểu tiết tôn trọng quyền riêng tư của mọi người chia việc nhà thì phải lm học giỏi 1 chút (nhưng không tự cao,9,10
191,191,Nam,Bac Lieu,mình là một người hướng nội hướng lung tung,sữa của các hạt đậu chè bưởi phở thích hamburger các loại bún,đá bóng game,Có,chia việc nhà thì phải lm,7,9
192,192,Nữ,Binh Phuoc,áp dụng công nghệ mới o tập thể,đặt biệt là trà sữa,thiện nguyện hát,không,thằng bạn thích hút thuốc hoà đồng hoạt bát sạch sẽ,7,7
193,193,Nữ,Quang Ngai,thích đi các hoạt động xã hội là người hướng lung tung,thích ăn trứng vịt lộn gà jollibee mi tom coca cola… những món ăn liên quan đến kim chi,mình thích hát thể dục ko ngắm bầu trời cầu long.,không,nói nhìu hoà đồng khong co thích ăn ngoài cùng mình dễ bắt chuyện dễ thương,10,7
194,194,Nam,Ca Mau,mình là một người hướng ngoại,hơi kén ăn 1 chút phở xào đồ nhướng,bị người ta lùa gà thích chơi cầu lông đi ăn học ngoại ngữ tỉ tê những câu chuyện đời thường sâu sắc với mọi người xung quanh.,không,để cùng nhau nói chuyện sẻ chia ko ồn ào với phá phách là được trầm tính học giỏi hoạt bát,9,7
195,195,Nam,Son La,thích mọi thứ có trật tự trầm tính. hướng ngoại nhưng có xu hướng thích ở một mình (hoặc thêm người nhưng được yên tĩnh) có xu hướng ambivert,coca cola…,đông y thích hát chụp ảnh e thik chơi cầu lông,không,có thể đấu tranh với sự vô tâm ít nói của mình sạch! gọn gàng!!!!,7,10
196,196,Nữ,Binh Phuoc,tính cách thất thường ở nhà hướng nội ra đường hướng ngoại 🙄 bình thường 🤤 hướng ngoại full time huong noi va thich o mot minh,hamburger trà sữaaaaa,hát tháo,không,vd : vui vẻ áp đặt sở thích hoà đồng với mọi người dễ chịu người có ý thức,10,9
197,197,Nữ,Nam Dinh ,trầm trầm nhưng lúc cần vẫn vui hết mình,không thích ăn cay lắm,trống thích chơi game,không,giỏi tĩnh lặng,10,6
198,198,Nữ,Hoa Binh,hướng ngoại nhưng có xu hướng thích ở một mình (hoặc thêm người nhưng được yên tĩnh) là một người thiếu ngủ,lẩu bò các món gỏi chỉ cần không cay là được,học ngoại ngứ mình rất thích nghệ thuật các hoạt động xã hội xem các show giải trí thực tế,không,không ồn ào giữ vệ sinh hoà đồng nhưng cần không gian riêng không làm phiền người khác như buổi tối người hiểu chuyện sạch sẽ một chút,10,8
199,199,Nữ,Son La,đam mê học tập ưa mạo hiểm bán hướng nội bán hướng ngoại hướng nội nữa mùa hay giận vu vơ,bánh plan đồ chiên nước ép thơm,đá bóng bóng đá game các hoạt động phải chạy,không,trúa hề hoà đồng lịch sự ngoan ngoãn ko quậy phá cá tính người chịu chia sẻ cảm xúc của bản thân. đánh giá,8,6
200,200,Nam,Tien Giang,là một người khá là trầm tư,mì quảng ăn vặt,o buổi tối tâm lí học thích chơi bóng rổ,không,đừng ham chơi 🤡 vì mình sẽ chơi cùng đàng hoàng là được miễn bạn cùng phòng biết nói chuyện là được :) trật tự,7,10
201,201,Nữ,Ninh Thuan,ghét phiền phức vui vẻ... tôi là một người hoạt bát thích ở một mình. v.v,chả giò mì xào mì trộn,xem các show giải trí thực tế lưới fb,Có,vô duyên dễ bắt chuyện đồ mình sở hữu là được vì mình cũng như vậy. nấu ăn ngon không câu nệ tiểu tiết,9,9
202,202,Nữ,Binh Dinh,mình là dễ gần,trà ô long đồ nhướng 7up sinh tố bơ,vệ sinh máy tính mình thích hát toán phim truyền hình,không,siêng năng động giống mình,5,10
203,203,Nam,Binh Phuoc,thích nghệ thuật thích vui là một người hướng nội thích ở một mình,đồ ăn chay ngũ cốc không uống nước ngọt có ga xôi mặn mỳ trộn,xem mv ca nhạc,không,"ý kiến của mình lên bạn cùng phòng biết cư xử
nói ít thôi
ở sạch sẽ
chia việc nhà
có thể tin tưởng được (tiền bạc)
ngủ đừng ngáy
trình độ xấp xỉ như mình chứ đừng zốt quá nó ô dề lắm :b năng động vui tính thân thiện người nào cũng được nhưng biết giữ không gian riêng tư cho đối phương",7,8
204,204,Nam,Hoa Binh,lowkey,fanta thích đồ ăn có trứng muối không rõ lẩu gà,xem tin tức công nghệ nghe nhạc xem phim đi lượn đường,không,thíc người hay nấu ăn biết mặc cả =)) vì mình ko biết mặc cả hihi,8,8
205,205,Nam,Lam Dong,nhưng không phải e sợ đám đông thích đi chơi cùng những người bạn thân thiết,thịt kho tàu matcha đá xay,vẽ đàn hát đánh cầu lông,không,thẳng tính người kiên định không ba phải hùa theo đám đồng biết giúp đỡ,9,8
206,206,Nam,Ninh Thuan,thích giao lưu với mọi nguời không lười thì đi có hứng thì xác xe cống hiến hết mình thích tự do,miến trộn bánh mì hủ tiếu nam vang olong,dark fantasy manga bói tử vi xem mv ca nhạc,không,biết chia sẻ khi ở chung với nhau thân thiện trúa hề ăn ở sạch sẽ,6,5
207,207,Nam,Ha Giang,thích đi chơi với bạn bè,nhật cơm đậu hũ dồn thịt xốt cà bánh mì... bò né,lưới fb thích học thích code đi du lịch coding,không,trầm tính học giỏi hoạt bát,7,10
208,208,Nam,Dong Nai,sống tình cảm vs chăm chỉ nhưng e hơi chậm so vs bạn bè cùng tuổi về sự linh hoạt vui vẻ,pepsi vị chanh không calo cơm chiên trứng bánh ngọt chill ăn cơm,thích coi phim tháo,không,thời gian của người khác áp đặt sở thích là người vui tính để cùng nhau nói chuyện,8,9
209,209,Nữ,Soc Trang,ambivert cá tính mạnh,sữa bắp trà dâu bún đậu mắm tôm khoai tây bánh tráng các loại,mua sắm đông y bóng đá bóng rổ,không,không có hoà đồng với mọi người,9,8
210,210,Nữ,Quang Ngai,mê chơi đá gà trầm tính. chung chung vui vẻ ích nói nội tâm,cứ đồ ăn là thích bánh mì kẹp các loại xôi vs chè nui xào,tập thể dục ngoài trời tin khoa học mình thích xem phim chạy bộ,không,thống minh sạch sẽ một chút năng động vui tính thân thiện,7,8
211,211,Nữ,Ha Tinh,khó bắt chuyện với người lạ lười làm việc nhà dành thời gian cho bản thân nhiều hơn. nhưng vẫn tham gia clb cũng như đi chơi với bạn bè (nhưng ít,uống caffee,đi từ thiện,không,hiền lành mình chỉ cần người đàng hoàng,7,8
212,212,Nữ,Lao Cai,tích cực thích thử thách thích ở một mình với gia đình,xoài chua chấm muối ớt chua lè xôi,game đàn hát ngắm cảnh,không,học giỏi (chung ngành càng tốt) chung ngành sạch sẽ tôn trọng không gian riêng tư của người khác,7,5
213,213,Nữ,Bac Lieu,không thích nơi đông người thích thử thách sống tình cảm vs chăm chỉ nhưng e hơi chậm so vs bạn bè cùng tuổi về sự linh hoạt cầu toàn,ăn cơm táo,thích học thích code thích đi du lịch,không,người hòa đồng 1 người tốt bụng,8,8
214,214,Nam,Long An,tham công tiếc việc vui tính ngày ngủ đêm bay là 1 người ít nói hướng nội thích 1 mình,mỳ quảng trà sữa mình thích trà bí đao ngô gia các loại xôi vs chè,kĩ thuật kiếm tiền tiếng anh... lập trình,không,năng động giống mình biết tôn trọng người khác,7,9
215,215,Nam,Quang Nam,dễ làm quen với bạn mới nhưng thường quen người hợp tính cách mới nói nhiều.,bánh tép trừ đồ đắng ra thì mình đều ăn được các loại trà trái cây các món nhiều gia vị mặn,xem phim lắp ráp môn nào vui thì môn đó chơi. ví dụ: đá bóng dù trên game hay ngoài đời đều có sự kịch tính tập thể dục ngoài trời chạy xe,Có,chịu đi chơi với tôi vui trúa hề là người vui tính,8,7
216,216,Nam,Quang Nam,thích sống ở trọ là một người thiếu ngủ thích ngoại giao bình thường 🤤 thích vui vẻ,chỉ thích cafe phin các loại đồ ngọt như chè ăn cơm gia đình tự nấu,khám phá xung quanh thích đọc cà phê,không,thật thà,10,10
217,217,Nữ,Binh Dinh,thích trò chuyện,đùi gà fanta vị nho : d chocolate buger mình ăn thích ăn đồ healthy,vẽ... thích ngủ du lịch kiếm tiền,không,respect private space and friendly is good nhưng không làm phiền người khác hay nhờ vả. có thể nhanh chóng nắm bắt cảm xúc đi chơi bên ngoài. người trung thực,8,6
218,218,Nữ,Phu Tho,nói nhiều thích trò chuyện thường thích ở một mình phần hướng nội nhiều hơn,cơm tấm long xuyên,sở thích của mình là thay vì thoát khỏi áp lực học tiếng nhật,không,không thảo mai,7,6
219,219,Nữ,Quang Nam,ở nhà hướng nội ra đường hướng ngoại 🙄 tích cực thích gọn gàng trầm trầm nhưng lúc cần vẫn vui hết mình,đồ ăn ngọt buger nước c2 chanh,phim xem tv series học hỏi,không,sạch sẽ không bừa bộn người vui vẻ thoải mái là ổn vui vẻ chân thật 1 người vui tính,6,10
220,220,Nữ,Quang Nam,ít nói nhưng hay chia sẻ với mn,mình thích ăn tất cả những gì mình thấy ngon. riêng đồ uống thì mình có niềm đam mê sâu sắc với rau má chả giò,tập trung nghiên cứu một vấn đề nào đó,không,đồ mình sở hữu là được vì mình cũng như vậy.,10,9
221,221,Nam,Lam Dong,dễ hòa nhập thích giao lưu với mọi nguời hướng ngoại partime ở nhà hướng nội ra đường hướng ngoại 🙄 thích sống ở trọ,mì quảng cơm chiên trứng các loại bạn phở…,tìm hiểu những kiến thức đa ngành esports phim truyền hình,không,không soi mói tiền bạc rạch ròi mong muốn được ở cùng phòng với một người có sở thích vẽ ở sách không bừa bộn,7,9
222,222,Nam,Bac Lieu,nhạy cảm cởi mở,đồ ăn vặt hoặc đồ hàn cơm cháy kho quẹt đặc biệt là mì cay,bóng đá đi chơi ngoài trời mua sắm em thích chơi nhạc cụ,Có,không tính toán với bạn cùng phòng khác. ở sạch sẽ respect private space and friendly is good,8,5
223,223,Nam,Tien Giang,hướng ngoại nhưng có xu hướng thích ở một mình (hoặc thêm người nhưng được yên tĩnh),đồ chiên mì udon nước cam các món ăn truyền thống hoặc món ăn đường phố việt nam ăn cơm gia đình tự nấu,đi từ thiện học công nghệ phim đi đây đi đó với bạn bè( một mình) kiếm tiền,Có,không quậy phá chịu đi chơi với tôi,7,7
224,224,Nam,Thai Binh,thích mọi thứ có trật tự nhưng lại thích giao lưu =)) đúng ik chang mô tả mẫu :))) thẳng tính ít nói nhưng hướng ngoại,ăn được uống được cơm tấm sườn bì chả đồ ăn nhanh rau củ,thích chơi game thường thức tác phẩm nghệ thuật xem mv ca nhạc xem phim hàn cầu lông,không,đồng cảm hiền hòa thật thà,7,10
225,225,Nữ,Hoa Binh,thích đi lang thang một mình,ăn đồ tự nấu sâm bổ lượng,ngủ nói chuyện cùng bạn bè ..,không,điềm tĩnh cởi mở thật sự như mình nói trên tốt bụng,6,10
226,226,Nam,Binh Duong,hướng nội part time thích thử thách hướng ngoại thích chia sẻ tuy nhiên hơi khó ngủ,đặt biệt là trà sữa thịt nướng các loại trà trái cây đậu hũ cà chua. đồ nướng,võ,không,biết nấu ăn chia sẽ luôn ham học hỏi không đòi mói tôn trọng mình,9,8
227,227,Nam,Bac Ninh,là một người ít nói thích vui thoải mái là một người khá là trầm tư dễ thích ứng,cháo lòng nướng đùi gà đồ ăn hàn. đồ uống healthy các thế loại mì,các hoạt động phải chạy xem phim nghe nhạc xem tv series thích xem tivi thích vẽ,không,tích cực thích ăn thật lòng giữ vệ sinh người trung thực,8,8
228,228,Nữ,Binh Dinh,một người vui vẻ sợ xã hội là một người hướng nội thích một mình một người hướng nội thích sự im lặng,bánh bèo,xem tv series,không,trách nhiệm,9,6
229,229,Nữ,Lao Cai,hướng nội part time .. thường là hướng ngoại với ng quen nhma hướng nội với người lạ sáng nắng chiều mưa,snack đồ ăn mà dai dai kiểu như bánh bột lọc hay bánh canh í. mùi hương (hành tỏi tiêu ớt sả đầy đủ) đồ ăn hàn quốc,ngủ thích môn toán cờ vua,không,hiểu biết biết tôn trọng không gian riêng,10,8
230,230,Nữ,Ca Mau,hướng ngoại tùy hoàn cảnh ; không thích nơi quá ồn ào ; không thích người nói nhiều ; không thích nói đùa ; nhớ dai nhưng cũng dễ bỏ qua ; không thích chia sẻ tâm sự ; không thích bị quản lý ; hơi vô tâm ; dễ xúc động ; cái tôi cao ; có tham vọng ; hoàn toàn tự hào khi làm tốt 1 công việc được giao thích đám đông thích một mình quan tâm người khác vui vẻ ích nói,đồ cay bột sò bánh chocopie e thik ăn các loại bánh mỳ,thích coi phim video game,không,bạn cùng phòng biết lùa gà hài hước không thích chung phòng,8,7
231,231,Nữ,Binh Thuan,ngày ngủ đêm bay,đồ bình dân hoi. cơm bò xào bánh ướt,các chương trình giải trí ở nhà một mình chơi đàn xem youtube ngủ nghỉ ngơi chơi game,không,có kỷ luật cởi mở người vui tính hòa,10,8
